mensagem,odio
MANDAR SONDA PRA 3 PLANETAS ACHAR PSOL FUNK MACONHERO IUTUBER VIDA INTELIGENTE,0
roubar estuprar cometer latrocínio pra simples matar dó,1
especialista discutir influência ciência religião psicologia cristã,0
esperar oq cara defender,0
esperar grande sucesso encontro,0
esperar peçam Michael J Fox bater palma vencedor senão saímos de aqui hoje,0
esperar ser dia refugiado comecer shar,0
esperar vida ter brinde pra matar,0
esperar Quartel Bombeiros Cascais ter espaço suficiente acolher julgamento arguido Operação Marquês,0
esperar ter gostar nomeação Juíz Neil Gorsuch Corte Suprema homem brilhante respeitar,0
Espírito Santo mostrar q acabar c polícia certo dir iluminar cidade,1
Esporte Galo Vila vencer Rio Branco seguir firme ponta tabela Detalhes Meiodia,0
ESPOE PRA INTRODUZIU LÍNGUA XEXÉQUINHA,0
ESQUECI CADASTRO SARAIVA P GANHAR DESCONTO MULHER BURRA BRASIL,0
eSQUENTA adorar programa mto cultural abordar vario problema favela pagode amoooor,1
esquerdista ligar pra moral ligar pra dinheiro calar qdo soltar Bruno incomodar de ele voltar jogar ganhar,1
esquerdopata blackbloc atacar manifestante próTrump merda esquerda igual mudar,1
esquerdopata pra,0
cena Angola acabar,0
sentido envolvimento Rússia tentativa encobrir erro campanha perdedor d,1
imprensa esquerda chamar golpista,1
lógico jovem sensato,0
responsável babar ovo,0
kkkkkk,0
mosca achar problema ser Brasil geração lacre,1
gente combater racismo q pessoa branco x Coisatipo vestir iemanjá,1
geração atual jovem foder acabar Mete ditador socialista país pra metade fuzilar papo,1
GERAÇÃO LIXO PAE PROIBO NETOS VEREM YOUTUBERS,0
hora qdo mulher sair balada pra pra casa pra levar vara,1
hora feira pra baladinha vagabundoEssa hora der relaxr,0
hora puta viar online,1
hora puta viar online exceto,1
imagem montagem comunista,0
mulher enrolado cozinha,1
mulher mt burra,1
notícia merecer compartilhar,0
piada merecer Twitter rede social,0
pistoleira inventar íntimo 3 ministro amiga íntimo Janot,0
diversidade colaborar ciência produzer Brasil ser descolar necessidade,0
procuradora piadaLevou lambada Dr Miguel Nagib autor projeto,0
escola marxisto doutrinadora esquerda saber alienar futuro cidadão,1
escola LGBT escola público Passamos limite vitimar acusar,0
FÃS FITFI HARMONY CAMILA CABELLO RETARDADA PAI AUSENTE FICAM ESFREGANDO PERERÉQUINHA PRA APARECER TÁ MODA,0
fufa ligar namorada marcar date saudade lol,0
mulher burro raiva,1
NOTAS REDE GLOBO MOSTRA,0
sociedade machista opressor,0
pessoa acabar visualizar perfil,1
mulher acusar Donald Trump denegrir mulher,1
tentar conseguir KKK lésbica senter orgasmo ser lésbico kkkkk,1
sofrer senhor engenho vergonha movimento Lixo,0
pra receber volta perceber sentir choque Angola pra Portugal pá,0
cara lixo humano de aquele imbecis achar saber,1
CARA,0
caviar tá D L I C I S,0
dia começar receber feliz dia mulher pôr piadinha loura burro wpp família ah errar,1
padre dar Pajero pro pai menino acusar pedofilia,0
amor esquerda,1
FAMOSO CHUPA CU,0
turma pessoa ficar desempregar seguir politicamente correto,1
argumento hahaha viver mentira medo desmascarar,1
feminismo igualdade homem mulher,1
filha puta Donald Trump diminuir quantidade refugiado entrar país pq nao familia de ele ta sofrer la,1
dia MULHER reinvidicado mulher história país Feminismomarx,1
futebol hoje politicamente correto profissional homem verdadeé Mariquinhafutebol porrar,0
galo ta tocar terror independência jogar inFeliciano Malacheia la n morrer tb,0
IBRA FINAZZI RABO CAVALO,0
nome quase esquerdopata hahahahah,0
padre igreja época pai falar ir catequese pra voltar pra casa Pajero,0
homem perder emprego cara dar opinião Facebook adivinhar moral de ele,1
papo Rússia NOTÍCIA FALSA criar dem usar mídia pra mascarar derrota eleição,0
PSG CAETANO FALA FRANCÊS,0
DIA ESTAVAM CHAMANDO PUTA PARIU TRABALHEI 40 ANOS RAMO MARCENARIA PRA CHAMADO DIS,0
golpe racismo tar olho ver,0
chegar hora europeu acordar,0
2018 chegar kkkkkkkk,0
ah táVenezuela paraíso Cuba Somália Coreia Norte idem ha crise refugiado Europa,0
alguem LIMPAR IMAGEM USP néafinal maconha MARXISMO esquerda destruir univ,1
aproveitar lacrar imprensa golpista etc,0
Caetano viver dinheiro público ser eleger passado concurso público,0
idiota inúteis mamador dinheiro público iludir milhão imbeci,1
certíssimo ninguém pseudoterrorista país refugiado terrorista,1
Estadão comentar ser liberar Brasil,0
duvido feminismo MACHO HOMEM pedir feminismo capacho esquerda,1
mimimi feministo,0
internauta feminazi capacho esquerda,1
feminista capacho lulopetismo mulher querer feminista Esquerda mandar,1
unico desvantagem levar bolada parte baixo kkkkkk,0
AISTAS INTELECTUAIS ACHAM SUPERIORES MUNDO DONOS VERDADE POVÃO TA CAGANDO PRA MERDAS,0
unicornio,0
feminismo defender pauta esquerda esquerda perder protesto protest,1
refugiado imprensa mostrar,0
criticar alguem lei PUNEM rigor estuprador pedofilo,1
SÉRIO pensar q ter elogio,0
ver coletivismo lutar direito mulher islamismo massa manobra d,1
legal proselitismo barato muçulmana ir falar mutilação vaginal direito Islão,1
mulher sujo porra,1
estuprador garantido defesa Maria rosario igual champinha menina esquerda,1
comunismo Venezuela lindo ne pra vc nao pro,0
teoria tambem,0
Trump demitir cara audiência Aprendiz tar cair correto,0
usou pensar morar dia dia comum sofrer violencia pq d,0
Segurança Privada Portugal,0
feminismo massa manobra esquerdae nao negar issotb ver F,1
stf vergonha,0
matéria explicar conteúdo BIBLIA INFANTIL ridicularizar personagem acontecimento,0
estar crescer continuarer,0
estar olho 2milhoes assinatura hoje descontente roubalheira,0
estar refugiado pessoa consumismo ato comprar preciso,1
notícia DEZEMBRO notícia VelhaMas assunto publicar novamente difamar,0
aberto inscrição turma 2017 Atinuké estudo pensamento mulher,1
totalitário Correm proibição extorsão dogma tabus Mundo louco,0
perguntar VETO Chame querer objetivo manter marginal péssim intenção país,0
acabar graça presidente afecto certo,0
ACORDADO SÁBADO MANHÃ CARNAVAL SEPARA HONESTO DIGNO DELES FICARAM MADRUGADA DROGANDO RUAS,0
ACORDADO SÁBADO MANHÃ SEPARA HONESTO TRABALHADOR DELES VAGABUNDOS DROGADOS CORRUPTOS DIA BRASIL,0
senhora completamente obcecar Trump Haverá algum explicação freudiano,0
poeira vindo norte África entrar impunemente Portugal sujar carro construção muro,0
boca propagar nazismo chupar pau,1
gente queixarse tremer frio GENTE gente doente Parkinson 5ª feira,1
passar casal fufa luana gritar HA BUE FUFONAS ALMADA,0
mecher baú avô falecido achar foto,0
ano ir comemorar dia Restauração Santa Maria Feira,0
aquecimento global severo,0
realmente vergonha facto tornase claro to,0
1º País Mundo proibir islão fechar mesquita,0
fimdesemana caravana andar 10 Fev VILA REAL 11 Fev COVILHÂ Bilhetes FNACbilheteira,0
plot twist cerimónia escrever George R R Martin,0
2 golo respetivo jogada prova Benfica claramente levar colo Taça Liga,0
Zivkovic pequeno maravilha,0
Estimar idade argumento refutar falar fato lógico verdade,0
convite préestréia documentário coprodução Coopas Canal,0
pensar íntegra sentimento consigo essência,0
Estocolmo capital violação mulher andar medo mudar hábito vida Welcome Rapefugees,1
aguardar algum pedido c burca ser Mulheres usar deserto haver tempe,0
cansado palavra homofobia racismo gordofobia feminista querer voltar pro ano 90 ouver,0
LANÇANDO MARCA CAMISETAS ESPECIAL PRO BELA OPÇÃO PRA PRESENTEAR,0
ler preço MURO fronteira custar governo esperar inicialmente ain,0
sentir jundiaiense pra faculdade perguntar coxinha frango mulher faltar chamar burra dizer,1
dúvida SIC Desafio TVI balde ácido retina,0
orgulhoso filha Ivanka Abusada maltratar mídia manter cabeça erguir,1
trabalhar haver competitividade Indústria Remédios preço americano s,0
estranho ser dinheiro receber pra desviar recebi,1
estudar graças feminismo ENEM 2018 invés redação fazer textão inventar abuso sexual banheiro balada,0
pra cuidar família problema pra mulher pra qq pessoa trabalhar filho,1
suposto religião critério discriminar refugiado negativa positivo,0
caloura sapatão apresentação voz violão cantina durante intervalo,1
calor to começar gostar falar cuspir,0
tar reclamar gordo feio ir continuar,1
tbm refugiado qm casa q passar fome qm abandonar pai familiar enfim q sofrer,0
evangélico fazer fantasia evangélico tirar roupa carnaval parabéns,1
nordestino manaura achar ruim piadinha regional vcs ser zuar msm certificar acostumemse,1
abrir olho perceber estar governar amigo terrorista,1
achar q nascer c bichinho matrafonaouvido SIC desculpa q homem família pra justificar vestiremse d mulher,1
achar Movimento Negro realmente ter humildade seriedade movimento MÍNIMO,0
desmascarei argumento cara,0
apresentar fato lógico verdade olhar argumento ta passar vergonha conseguir refutar,0
argumentar sujeito acreditar crise refugiado pobreza projeto califado Desisti argumentar,0
arroto pq engoler gás judeu,0
lindo Branço,0
4 seguidora fds,0
cresci ouvir mulher filho alguem amar ficar pra titia ver sapatão,1
usar droga vc sentir fome hahahaahahaha,0
dever indignarme c discurso d dono d Padaria Portuguesa porraaquels croissant brioche fazer mão q ganhar 500 bom,0
dever mt feio pq gordo,1
dever jogar Angry Birds Cruz pra merecer,0
ficor indignado vejor brasileiro desmerecer refugiado imigrante achar q nao conhecer história BR ne mor,1
ganhar sr q ganhar 33 transferir salário Grato,0
gostar ereção esconder ver vestido noiva,0
GOSTO MULHER BONITA CHEIROSA CUIDADA RESOLVIDA CANHÃO PROBLEMATIZADOR SUVACO PELUDO,0
honestamente emocioneer ler Vale pena,0
IA VOLTAVA VÁRIAS RESPEITO,0
sinto tao feio gordo pessoa vc bonito ta gordo tiro fdp,1
homem achar orgasmo feminino existir riso pesame mulher transar,1
absurdo certos tipo Cultura criança casar obrigar burca,1
mentira escandaloso tenhamos tentar invadir sede,1
mandar argumento basear fato lógico verdade reponder hahahaha putz,0
certo partido ai perder 400 prefeitura lavar dinheiro,0
arrumeer exato 3 min pra trabalhar,0
afilhado,0
Nacionalista confessar,0
defender bandido impeachment pro temer entrar cunha vice,1
nao definar Angolano cor ser branco preto mulato definar Angolano amar Angola,1
importar pessoa magro gordo feio bonito humano exato tratar ir retribuir mesmo,1
mereçar estuprar banheiro feminino mulher trans lésbico ideologia gênero,1
preciso resolver mostrar verdade viver esconder mentira,1
FILHOS PENSO FILHOS NENHUM PROBLEMA NISSO,0
saber dia mulher vir gente burra falar bosta Internet,1
querer trabalhar voluntário p refugiado afim,0
nao homofóbico,0
6 ano sentiame rebelde chamar amiga Fufinha ficar feliz qd vdd insinuar q ser fufa,1
sentir gordo feio,1
odeior dia d tpm pq sintar feio gordo pessoa amar n ai p eu mau q dia real,1
PAGO CONSUMO NOME LIMPO PRAÇA,0
preparado,0
feio gordae concordar issoposso chato precisar eu smp tô,1
PREFIRO MEIA BOCA TOTALMENTE LISINHA FIDEL CASTRO GUERREIRO FOGE LUTA ENCARO VIER,0
prezar igualdade gênero femimimismo,0
querer namorar teto perguntarer CASA ai gente ir rir rir rir beber pinga R050,1
belo fera estreie pra PARAR propaganda filme socorro aguentar,1
respeito homossexual so n concordar q filho beijar público,1
corrigir cagada esquerda Europa último 20 ano,1
saber ter ver destaque carnaval,0
saber manifestação nao ser corrupção querer tirar dilma,1
nota real ta escrito deus ser louvar laico,0
bonito precisar magro coloquei fucking cabeça gordo feio,1
servir café manhã pra irmã gostar leite quente ovo,0
sofrer preconceito igreja evangélico ngm liga ne jogar pedra macumbero Ooooh mds triste,1
feliz Zuar barriga orelha nariz orgulhar cortar bolsafamília botar pobre pra trabalhar,1
mulher burro Brasil,1
mulher escalada montanha vida remover pedra plantar flor,1
bi sapatão ser ninguém,1
amigo q grosso,0
demasiado Demasiado alta demasiado gordo demasiado feio demasiado paciente demasiado sentimental puta parir,1
gordo cabelo cara feio,1
mt burra menino falar feliz dia mulher ai pra percebi,1
oficialmente mulher burro mundo,1
tô surpresa gringo saber caju ver,0
tô inconformado chorar pude burra pensar Solange avião mulher Xand ir conseguir superar,1
PENA MULHERES HOMENS HOJE ACHO VIRARIA SAPATÃO OLHA VERGONHA RAÇA,0
problema psicológico causar excesso corrupção petista,1
livrinho cabeceira passar pano branco pra político,0
ter pra twittar hoje acabar esquecer,0
tocar coração irmã,0
tomo decisão amplamente embasar dado coletar saber jornal NOTÍCIAS FALSAS pr,0
to sapatao scrr,0
to passado cara achar mulher obrigação conversar tinder dar like chamar puta,1
vejo torcer pra Emilly historico torcida igual gente feio gordo padrão,1
volteiiii pra ficarrrr,0
VOU CANTAR PAIXAO SENTIMENTO VERDE BRANCO GRENÁ,0
vc ae tentar amiga,0
vc franguinha dessossar reclamar vida chorar porra,1
vc mulher chutar bola direito,1
verdade CND permitir FBI verificar servidor equipamento descobrir hackead,0
Evitar carne ganso quizila Oxum comer carne pombo galinha dangola casa pena pavão pq tirar sorte,1
fazer cena filme Lista Schindler Impossível emocionar,0
escolher presente mulher dia internacional mulher sugestão garota,1
Exativista LGBT tornar pastor inspirar filme honrar Deus,0
Excandidato PSOL prender estuprar cão portar droga piores PT aberração Vídeo,1
excelente perguntar Cidade abandonar centro completamente dominar camelô agente CET Rio sumir tr,1
PAI SOE FILHAS CHORAR BANHO,0
Nizan Ganaes Bundão,0
Ex Gays existir,0
existir tipo casal,0
Existir mulher ladra canalha safar dissimular sinto voce saber Feliz dia m,1
existir negro nazista,0
Existir pessoa jogar Perguntados 2017 admirar mundo ir acabar hoje,1
Existir várias forma noticiar assunto Infelizmente escolher mau felizmente,1
explicado Diria deturpar diabolizado insurja odiar,0
revogar ordem retirar banheiro transgênero escola parabéns,0
novela 9abordará transgênero infância Lembrese associação Americana,0
Fábio frente sapatão masculino,1
Miga nao livro estudo promoçao mulher burro,1
churrasco carne dia inteiro,0
FAKE NEWS gente branco praticar escravatura Islão religião paz propagar,1
falar ae esquerdopata,0
falar ai mariquinha afim culhão resolver coisinha,0
falar squad bando fufa querido 333,0
falar eu estúpido feio gordo chato curto ti,1
Falam Trump país aceitar refugiado DexMag ver,0
falar tpm menstruação ta atrasado 2 semana ser sapatao ir preocupado,0
falar odeiar PM,0
falar verdade incomodar,1
Falei macho DIA MULHER tar falar de ele burrar n msm,0
falar q chamar pessoa burra pq ficar casa fazer papel mulher LAVAR LOUÇA,1
Falou populista turma Fake news RETARDADO,0
falar FEMINISMO capacho esquerda,1
Faltar 1200 Guardas Prisionais cadeia,0
dia finalmente mete foto,0
Famel caber quechua,0
colchão,0
deformidade excesso gostosura tar lindo Pq gordo feio,1
farto procurar trabalho metar trabalhar bar fufa valer,0
fascista machista nazista trapezista taxista maratonista eletricista corrupto kkk,1
fascista machista mimimi mimimi,1
Fãs Justin Bieber acessório,0
Fátima Bernardes párar repetir estrago homem branco causar chegar Brasil estudar besto,1
outro jogo casino Casa ter ganhar Santa,0
Santana topar,0
FATO estar pleno extinção mundo ser dominar bibasexual creminhosexual saladinhasexual metrosexufranga,0
Fato ocorrer YORK reduto DEMOCRATA Trump perder lavar agressor trumpista sã,0
ixquerdo desconstruir pedofilia,0
FATO muito mulher mariquinha fresco ai,1
FALA MAMÃE OFERECER PASSAREI LINGUIÇA NELA HONESTIDADE CAMIN,0
campeonato peido amigo,0
pra gente,1
chegar,0
pontaria qlq q der telha jato mijo,0
SUCESSO POSTAGENS INSPIRADORAS imprensa brasileiro,0
ahahahahah média vergonha manipulador tendencioso continuar pensar Trump Livra,0
estadista nervoso,0
pensar Trump,0
muitíssimo,0
Pesadelo Naaaa sonho tomar contorno realidade,0
pesopesar gangue comunicação social apesar censura cobarde ridicularizarem opor começar tremer,1
pensar Trump falar Donald Algum fetiche claro esperança amanhecer variar tema,0
tolerante democrata saber perder hipócrita ressabiado esgotar medicamento,1
fuçado livro amiga revisar,0
excelente post históriar tb,0
fd eu hj dia mulher tastar fzr burra pessoa escrever título,1
FECHEM JUDICIÁRIO BRASILEIRO FALAR VERDADE MULTA,0
Federer enorme Rei voltar,0
Constantine foda,1
Feia Bonita Gorda Magra Mulher Feita pra Respeitar,0
Feia bonito gordo magro ser mulher nascer respeitar,1
Feia bonito gordo magro ser mulher nascer respeitar Feliz dia Mulher,1
perceber militante feio gordo falar homem,1
massa manobra esquerda cara,1
feliciano estuprador gente marketing esquerda,1
kkkkkkkkkkkkkkk abelha voltaaao rsrs,0
completei música Rs,0
viajei mochila tb 4 Dias,0
desespero pra ganhar foda tar,1
Felipe Neto foda meado 200920102011 mandar humor negro Virou personagem bicho pra ganhar money gayzada,1
FELIPE NETO X PASTOR MALAFAIA IGUAL ARGENTINA X ISLÂMICO ESCOLHER SANGUE,0
gordo feio ter bêbar,1
Feliz dia Gorda feio magrela bruxa velho frágil empregada,1
Feliz dia mulher MULHER FELIZ DIA MULHERES Dia Internaci,1
Feliz Dia mulher,1
história merecer rever,1
feliz dia mulher pra eu aguentar gente ignorante machista burro sorriso rosto cara ninguém,1
FELIZ DIA MULHER usar feminismo esquerda,1
Feliz Dia Mulher p mulher brancaspq dia mulher negro latino americano caribenhaé dia 25 julhoSegregação esquerda,1
feliz dia mãe pr mãe verdade,0
Feliz dia mulher voz ato Brasil país bom,1
Feliz Dia Mulheres Femininas,0
Feliz dia mulher,1
feliz dia mulher Beatriz Vitima estupro coletivo 33 cara RJ algum gente duvidar de ela,1
Feliz Dia mulher pra,1
FELIZ DIA MULHERES PRA NASCEU HOMEM aCHAr PRA MULHER BASTA COLOCAR SAIA DIA 1º ABRIL,0
Feliz pr verdadeiro guerreira trabalhar cuidar lar vagabunda lutar pra abortar andar pelar,1
Feliz dia mulher pra Tammy Gretchen várias alteração chassi continuar ser mulher,1
Feliz dia mulher pra depilar textão Facebook,1
Feliz dia mulher vier embalagem certo,1
Feliz dia mulher principal voz feminino tv,1
Feliz Dia Valentim,0
Feliz dia amigo escolha errar,1
Feliz dia amigo comer gordura Picanha,1
Feliz dia amigo tomar pinga,0
Feliz dia puta vadia feio gordo huuuuum gostoso Feliz dia,1
Feliz dia achar engraçado,0
Feliz dia achar engraçado,0
feliz dia to gordo feio inchar feliz dia TPM menina,1
Feliz dia internacional mulher,1
Feliz pra possuir cromossomo XX,0
Feliz dia internacional Kiridinhas,0
Feliz dia MULHERES SENHOR protejer islão Brasil,0
FELIZ DIA PRESIDENCIAL VAMOS TORNAR AMÉRICA NOVAMENTE,0
Feliz homem gostar mulher,1
Feliz ser dia mulherada feio bonito magro gordo mulher merecer respeito,1
feminismo defender pauta esquerda esquerda perder eleição protesto prote,1
feminismo amor confiar,1
Feminista comida,0
feminista defender uso hijab fosseEMPODERAMENTO mencionar q mulher marido Espan,1
feminista dever passar 18 hora dia lavar louça descanso,0
Feministas mundo bom,0
Feministas sindicato protestar,0
páginad Flavio live explicar,0
jamais superar Cesar Romero,0
calhau olho,0
FHC amigo Lula pra implantar comunismo Brasil Foro Paulo pra virar Venezuela,0
ficar mensagem seguidora,0
Ficámos preço electricidade água sofrer aumento ano,0
Ficar definir significado tatuagem mulher tcholas,1
FICA TRANQUILO IRMÃO VÁRIAS TRANZAS ACABAM CHORO ZOAÇÃO PAE,0
Fico imaginar realmente achar mulher negro q chegar sofrer racismo vitimista,1
1613 FILHA FAMOSA DEPUTADA BARRADA ENTRADA POAR DROGAS IDADE AVISAMOS MÃE PROMETEU PROCESSAR,0
lutar ai raspar cabeça ta mto sapatão ta acabar cmg,1
Filha zé droga exmarer traficante cunhar pedófilo pessoa rodeiar deputada q,1
filho peixe Aprendar locupletar pai ladrão,1
filho condição moral carteirada ninguém,0
filho segurar segurar macho mlq vidamulher q engraver saber q cara safadoé burra,0
Filhos pai incógnito quase duplicar 2016 andar desconfiado haver filho put,0
filme ex ativista gay tornar pastor causa polêmico,1
filme País Iraniano apedrejar gay degola cristãosganha Oscar filme estrangeiro diretor crítico,1
FILMES PORNÔS MASTURBAÇÃO PUTEIRO PERGUNTA,0
Filtro Branco Coador Hario V60 02 R6200 Acesse,0
Mundo cancelar pq Aeroporto Portela capacidade receber asteróide devido saturação espaço aéreo,0
semana fodase,0
dia mulher vc ja feliz MARXISTA ja nao feminista né q pegar,1
finalmente gordo velho sair esperar dólar abaixar pra pra disney preocupação,0
finalmente problema Brasil resolver governo querido amar Michel temer,1
finalmente presidente jeito esperança forte realmente começar mudar Força Tr,0
Fiquei Internet dia inteiro descobrir q pessoal casa sentar mesa achar q família,0
Fisco deixar sair 10 milhão p offshor qq controlo pai transferir p eu 5 Banco Portugal alertar,0
fizesteme sentir especialfizesteme pensar talafinal umMagoasteme,0
Fiz pequeno ajuste capa,0
insinuar algarvio alentejano comuna facho passar cambada rabeta,0
Fla Flu decisivo título Fluminense comprovar q saber política futebol,0
Flamengo x Lanús Equador ideia,0
responder crítica falar verdade,0
FGTS,0
feminismo defender pauta esquerda esquerda perder protesto prote,1
prova evidência,0
Fodase Samira 9 ano vendir pro Mohamed pedófilo 70 ano ir falar Patrícia atendente ganhar gerente,0
Fodase Esquecime feminista fufa,0
FODASE importar direito medicina biologia p ex,0
FODASE ceder qq tentação trabalhar virar cracuda moradora rua,0
Fodase Rafavaleu pena esperarque MARAVILHA,0
nadar amputar perna Melhor inválido incompetente,1
criança issopovo maldito,0
lamentável assustador ouvir Mr Catra seguinte afirmação realidade branco,0
desrespeito deixar pessoa humilde esperar consulta FUNCIONÁRIO trabalhar Medico n Deus,1
burro mulher levar pra vc Amanha,1
FONGAS FUFAS SAPATONAS LÉSBICAS Capazes,0
franga Bombadinhos chiliquento gay explorar condição pedaço carne massa carcerário,1
FORÇA IRMÃO VOLTAREI PRA BEBEDEIRA PUTARIA AFINAL CA,0
forró ouvir homem chamar mulher pra dançar agarradinho boiola mulher aceitar sapatão,1
Fotos inédito rapaz desavisar ver metade programa desligar tv,0
eito Alemanha avançar restringir uso burca ver,0
FRACO FOLIA BLOCO pORÃO DOPS,0
feliz dia pra tambem,0
franga plantão VOLTEI CHHUUUUUPAAAAAA,0
noite esquisiter legal Rsrs zzzzzzzzzz bjuu zzzzzzz,0
Cheirossssssssssssssssssss noite,0
tar morrer né Liga naum cachorro prédio confur foda rs,1
hahaha ver forms,0
Pronto nui tb,0
fuçado mãe livro amiga revisar,0
Freezer Horizontal 439L EFH500S Branco Esmaltec Cupom Desconto RCA27231,0
Freixo perder Bandidagem chorar,0
freixo legalizar Maconha gente nao deixar acontecer,1
2 FUFAS PRETO BACA,0
Fufas decente hj dia mulher,1
Fufas merda atiramse mexer,1
praia hj voltar neguinha rsrsrs,0
DIGITAR PALMEIRAS GOOGLE GOOGLE CAIU,0
25 março hj gente difícil índio Brasil ver ate q vender pulserinha,1
CPS JBE RPRDOB Caralho porrar sapatão Jabuti branco educar Rato paraplégico rondoniense doença oval bruto,1
Fuleco nome traficante Jair Cláudio Rocha Maciel Fuleco,0
Furos furo confidencial ilegal ser problema Washington haver ano falido outr,1
problema estrutura pra acolher refugiado ilegal aportar estar próximo mendigar,1
dia hoje fraco haver indignar,0
noite resultar,0
avençado ter agenda carteira,0
qq dia vender contato gourmet,0
chover Allgarve,0
ai deixar tar voltar aparecer carro branco antigão,0
pensar horroroso gordo tosco feio chato ngm querer n mereçar ngm alem pessoa,1
Angola,0
to falar refugiado Síria nao pra ca milhao abrigo pais acolher,0
vc n entender falar nao refugiado nao pro Brasil mt,0
pegar pau arrombado ta defender cara pq advogado maconheiro,1
ow preocupar tampa,0
,0
atra linha inimigo tbm legal,0
caralhar to lembrar sextafeira 13 Jason mascara né,0
pra passar conteudo,0
legal pq mostrar Jason morrer,0
gostar gambiarra kkkkkkkkkkkkkkkk,0
Mitomania fã Bolsonaro hahahahahahah zuer,0
olhar hahahhah atriz hollywood 80s,0
porra Patriota tbm né,0
assistir Serbian Film vomitar passar teste,0
mostrar matéria,0
mandar mundo Venezuela,0
branco privilegiada trabalhar querer cor pele impedila conseguir job,0
to explicar racismo inverso existir aprender sozinha branquelo,0
miga cê achar vida negro fácil preconceito,1
mundo real conto fada vida negro fácil,1
to ocupar denunciar racista q achar vida fácil,0
poxa cê tar medo ficar enrugado tá medo filho empregada sala Facul,0
dó branco privilegiado conseguir passar engenharia papai pagar,0
falar processo amigo fia,0
racismo inverso mimimi branco Deus palavra existir deus existir miga,0
rir racismo d,0
vamo parar reclamar cota estudar,0
vc achar racismo culpa negro,0
Galera Rio mulher sequestrar sair bloco AGYTOÊ amiga de ela precisar ajuda,1
galera notar dono labrador acabar ficar cego COMPREM LABRADORES GENTE,0
galera p comemorar Dia Internacional Síndrome Down priminho mandar recado pra vcs proximo tweet,0
Galera DEMOCRATA defensora DIREITOS reconhecer resultado eleição LIVRES DEMOCRÁTICAS,0
Galera foto pra mostrar terça Sra dar entrevista pra revista vestido micro,0
galera ir ajudar léo ta perdido hoje ninguém ver ai,0
preconceito ilegalidade Drogas entrar México terrorista travestir refugiado,1
garota tratar esfregar argumento lógico fato verdade cara mostrar vc ingênu,1
ai senhor pra guerra policia chegar sr voltar RJ sair carro blindar,0
levar pra casa Maria rosário,0
Gay expulso casa gay expulsar ser héterosem fazer preconceito desculpe p amor,1
Geisy Fantástico dar nota 8 más noticia Geisy ilegal gente nota vc 4 ruim,1
gente mulher Cdf cozinha vir texas formar,1
gente mulher tia ficar cozinha verdade gênio físico,1
gente pec 241 pra reduzir gasto aumento salário deputado CULPA PT,1
aproveitar BBB denunciar,0
to print sério gente,1
perguntar fazer pra passar vergonha Internet,0
negro pintar cabelo APROPRIAÇÃO K,0
perfil de ele contémr machismo,0
negro tar querer,0
rts dou link tweets postar ficor esperar vcs ajudar ensinar passaran,0
mimimi cota amor branco melhorar,1
