mensagem,odio
USO GOSTO TÉTE TÉTE CHEGA ENCOCHANDO CHAMANDO DELÍCIA AMANTE MODA ANTIGA,0
ver merda Crepúsculo pra cinebiografia Chuck Norris,1
vejor hora gordo feio Roberta ralar,1
vejor errar achar existir idade próprio pra introduzir certos conceito família deci,1
nao culpar nao votar Aécio,0
ver feminista esquerda dar parabéns Dia Internacional Mulher FELIZ DIA MULHERES,1
ir arrumar treta Twitter juro,0
ir orar ateu,0
ir pro céu,0
pai mãe amor Sérgio Angola veia culpa Toni ir Zulmira querido,1
opinião seguir normal fazendo piada estupro coletivo garota 33 q mídia parar falar esquecer mau,1
Principais Nações UE Veto EstiloTrump pesquisa 10000 pessoa 10 país,1
rede social ativista criar vaquinha ajudar pagamento dívida publicação,0
Suécia,0
feio leitoa tar gordo igual porca,1
mandar,0
UÉ dizer projetinho sapatao,0
ideia razão Nat podes entrar conversa tiver ideia aprender dia,0
liberal conservador trocamos ideia ditar educar,0
Ñ conhecer Putin ñ negócio Rússia hater insano Obama negociar Iran t,1
Negociação salário mínimo Portugal,0
negociação design envolver F35 FighterJet programa Air Force One preço V,0
negro queimar sutiã apropriar cultura branco norteamericano,0
negro,0
83 negro morto dia Brasil branco morrer,0
própriAs candidatAs votar nelAs MesmAs,0
tô reconhecer Eita mulher burro,1
gostar comam Façam viagem,0
denúncia estupro verdadeiraInfelizmente descobrir issoapós vida suposto agressor ser destruir,1
STF ver,0
outro Refute falar fato lógico verdade,0
ne nao comunista cês,0
ditadura militar 64 livrar Brasil cubanização,0
NENHUM FIQUE CLARO SOBREPESO SAÚDE ÁCIDO ÚRICO GOTA DEVIDO,0
neoliberalismo Temer Brasil crescer governo Collor Sarney,0
ir visitar Tatuapé Ansioso,0
dia mulher parar retratar mulher loucaciumentaburrafrágil,1
Dia Internacional Mulher experimentar pano prato algum feminista amar,0
período ASSASSINADOS 2720 cidadão brasileiro comum falar algum,0
diriar Trump Califórnia quase México,0
olhar sofrer metamorfose regressar dia seguinte escondir ovo,0
new post União Europeia ameaçar sanção país receber refugiado,0
NEYMAR FAMOSO GOL OLHO AZUL GORDA BONITO SERVE PRA,0
Neymar jogar Kkkkk,0
Ngm cmg noite branco,0
questão d adaptação meter inglês branco neve Angola ver qnt apanhar escaldão,1
ninguém chegar casa falar mãe hétero chegar mãe gay BY,1
ninguém matar razão coragem medo passar,0
1 Brasil assassinato muito arma bandido,1
capitalismo pokemon,0
centro trânsito lento Rua Pedro Ivo Rua João Negrão proximidade Terminal Guadalupe Rua Barão Rio Branco,0
10 junho habitual arrancar campanha autárquico Venha connosco,0
dia mulher nao ver 1 palavra movimento feminista pra defender mulher ISLÃ Ja pra defender co,1
dia 10 junho 2016 caminho Largo Camões,0
Dia Internacional Mulher juntese eu honrar papel crítico mulher América redor m,1
bastar mostrar externo,0
Portugal seguro,0
texto capa colorer branco dar pintar,0
futebol atacante Acha meiodecampo vear,1
4 noiado vaiar virar notícia,0
Iraque Call of Duty The Sims,0
nojo de esse omi sapatão,1
livro Bestseller New York Times Máfeminista ensaio provocativo ativista desastroso,1
março regularmente celebrase Dia Internacional Mulher Federação Sul Americana Krav,0
Nomes faltar vigarista corrupto aldrabão assassino vendir traidor pedófilo aberração,1
Nonie Darwish escritoro exmuçulmano egípcio esconder verdade islão lançar,0
trocar,0
Noruega refugiado aceitar apartamento popular exigir casa,0
sábado dia 24 setembro 20h00 PNR realizar Jantar Reentrada Política Lisboa,0
EUApuxou arma pra policia igual DIREITO BALEADO impressionante video,0
hetero dever unir ditadura minoria abaixo,0
eleger MP ser legislado absurdo processoO prefeito vereador,1
poder viver mundo conflituoso problemático vista situação social,0
primeiro 30min Red Carpet ver malta ninguém lembrar Portugal vencedor Ídolos,0
companheira preferir Europa tomado terrorista querer,1
nossaEsse whats comer dormer viciadosJesus amar,1
G1 preconceito Ta dizer mulher incapaz curso complexo Pq existir ne,1
feminismo necessário hoje dia,0
gostar camera rs live on,0
Jênio ateísta esquerdista cristão perseguidor religioso,1
livro tar 20 desconto percar via,0
livro tar mega desconto Sai R 1794 ver,0
maravilhoso plano saúde público revisão negociação ObamaCare total completo desa,0
ultimo 5 ano fugir 52 recluso prisão português curiosamente nenhum de eles banqueiro exgovernante,0
10 notícia provar feminismo necessário,0
Novela CGD II,0
livro Nick Adams Guerreiro Green Card leitura obrigatório meritocracia Canadá Au,0
16 dj galere,0
trailer OVERDOSE TOURETTE ON THE ROAD hoje explicar Rui Cruz,0
N racista pq racismo CRIME crime pretokkkkkk,0
conversa normal amiga Mae dás fufa bis,0
PENSEI ISSOMASVAMOS COPIAR EUA PODEMOS ação,0
ver imprensa nacional descarado parcial Virou torcida arquibancada Patético aliás democrático,0
ir conseguir emagrecer ir gordo feio fracassar,1
Nutella provocar cancro esperar notícia ajudar diminuir taxa obesidade Basta gorditos continuar mamar Nutella,0
N ir aguentar sapatão sala ficar encarar,1
considerar bonito George Cloney,0
pessoa anorexia considerar GORDO MAGRO voce considerar quiserma biologicamente so XX XY,1
volta terra,0
Oh fds ucraniano merda voltar terra fdp,1
amigo passar ano inteiro dizer puta gordo pegar pq feio feminazi HIPOCRISIA,1
Ia puxar emoji cão triste preciso,1
argumento abrir bueiro refutar linha falar verdade torturo né,0
argumento retardar mostrar ler refutar falar fato lógico verdade,1
arranque Tour Overdose Tourette OTR caravana seguir dia 10 Vila Real dia 11,0
arranque doOVERDOSE TOURETTEON THE ROAD prestes acontecer 4 FevFigueira Foz INFO reserva,0
atentado orlando nao discurso preconceituoso trump bolsonaro culpa islâmico,0
esperar ganhar amigo Sporting ficar difícil falar distância 13,0
balanço divulgar Polícia Militar revelar mulher agredir minuto,1
Barça ver PSG branco pensar ser Real dar dar né kkkkkk,0
Barcelona empatar campo Bétis golo ser validar óbvio,0
Barcelona vencer PSG graças feminismo,0
Batáguas Joana,0
Obg Xerifes Chefes Polícia serviço liderança verdadeiro amigo,0
pontadelança cultura morte legalizar Eutanásia eu defender Vida dignidade,0
promotor eutanásia ter tema programa eleitoral honesto,0
BLOCO PORÃO DOPS ANIMADO VENHA CAIR FOLIA,0
bolsonaro nao parabenizar cunha vdd gente culpa edição video,1
nao refugiado oriente médio pra k cara nao sao burro,1
brasileiro cansado enganar sos regime militar get out dilma,0
Brasil crise drogado droga,0
BRASIL LEGALIZAÇÃO DROGAS Legalização droga rejeitar população,1
amigosJá passar 600 inscrito 24 hora Inscrevase canal entrevista ir,0
20 bilhão investimento criar 45000 emprego indústria c,0
ministro Austrália falar verdade educado conversa mídia NOTÍCIAS FALSAS distorcer Ótimo,0
Brian Krzanich CEO investimento 7 BILHÕES INOVAÇÃO EMPREGOS Americanos,0
Eli Lake Bloombarg View NSA FBInão dever interferir políticae situação mu,0
comício país Tremendo ir Tornar América novamente,0
elogio Conferência Imprensa Rush Limbaugh dizer bom m,0
Porto hoje seguir Aveiro Teatro Gretua 22h00,0
Adoraríamos têlos SAMSUNG FÁBRICA EUA,0
MUITAS PERGUNTAS PRA RESPONDER 1130 VOU FUMA CIGARRO BEBE CAIPIRA COMPRA FRANGO ASSADO,0
OBSERVAÇÃO ESTAMOS QUARESMA SUBSTITUIR XIS BÊICON PEIXE FRITO RESTO TÁ LIBERADO,0
OBSERVAÇÃO IMPOANTE,0
Catarina Kinnvall similar islão radical extremadireita,0
bullying hipócrita comunicação social diverso sector sociedade Força,1
Canadá receber 40 refugiadosresumir 40 desempregadosIsso explicar população,0
canalha ditador conseguir destruir Venezuela Venezuelanos fogir Brasil país d,1
capitalismo realmente perdoar único salvação ideologia sanguinário comunismo Hipocrisia,0
CARA FODA tomar posse criar emprego Obama sequer sonhar,0
cara mudar turma manhã virar relator Lava Jato treta imaginar,0
cara promover celebrar ASSASSINATO BEBÊS INDEFESOS VENTRE MÃE existir grau podridão,0
cara tar carro ROUBADO parar sair ATIRANDO PM com si arma GRANADA SUSPEITO,0
CDS plantar moralismo vida político português demissão irrevogável demissão prazo Aprende Centeno,0
CDS avisar Centeno consequência penal mentir Parlamento algum exdeputado CDS prender,0
cerco fechar pro Obama,0
cerco fechar,0
ciclo retardo pessoa pôr merda zuar aguentar proteger conta,1
chegar poçoVejam cartaz colocar unidade centro RJ,0
1 criticar governo 2 entrar CQC 3 CQC acabar 4 hj defender PT Crític,0
prefiro magro feio gordo bonito gorda arrumar ñ adiantar d elegancia porte físico,1
Odeia Bolsonaro ai projeto de ele discordar ir inteligencia i,0
Odeio feminista falar merda ir q perfi falso zoar coisa q disseramkkk KKKKMitar,1
odeior gente falar so pq iggy eh branco n cantar rap mano,1
Odeio mulher burro,1
Odeio sapatão desapegar ex nunka,1
desejo homem mulher desejo mulher desejo homem,1
dia 17 dezembro dedicar íntegra autêntico maratona reunião sede PNR Lisboa,0
dia bruxa noite solteiro,1
dia muçulmano Morrercerteza inferno sobrecarregar,0
diminutivo INHO acompanhar trajetória HOMEM VERDADE,0
discurso ódio valer DireitaEvangélico pra lacrar,0
discurso socialismo bonito capitalismo comida iphone viagem pro exterior etc,0
dono twitter autista kkkkkkkkkkkkkkkkkkkkkkkkkkkkkkkkkkkkkkkkkkk,0
ECA fechar olho estatuto afirmar sexualidade ensinar criança,0
eduardo Bolsonaro nao cuspiu jean truque vídeo manipular,0
Eduardo Lourenço de aquele pensador descoberto unicórnio conciliar Deus,0
engraçado err correção estúpido gastar falar feminismo pauta considerar imaginário,1
ESQUERDOPATA imbecil GOSTA COMUNISMO morar CUBA CORÉIA NOE ANGOLA ser país COMU,1
justiça Portugal,0
estranho caso TSU,1
Facebook cair justo ir compartilhar imagem pra doar 0056442 centavo pra coral criança muda cabelo,0
FACEBOOK CAIU VAMO VOLTAR PRO ORKUT GALERAAA,0
Facebook usar hijab homenagear mulher hijab símbolo opressão islâmico,1
falido criar NOTÍCIA FALSA China dizer Sr Xi falar Sr Trump nov 14,0
falido forçar desculpar assinante pobre cobertura fazer vitória elar,1
famoso argumento,0
fascismo esquerda print,1
FBI totalmente incapaz parar infiltrado segurança nacional permear governo,1
feminismo fazer acontecer variante feminismo empresarial falhar esmagador,0
feminismo importante ficar mão feminista sair pleno 8 março,0
feminismo capacho esquerda nazista hahahahahaha retardar Refute falar,1
feminismo Brasil mero cooptador mulher militância esquerdista defender mulher,1
oficialmente mulher burro mundo,1
foco resistência gostar mulher pingar rock n roll futebol gostar churrasco carne sangrento,1
FUTEBOL RESPIRA,0
mulher pq transar cara vadia burra garota escroto nao,1
gay assumir resolver franga arrogante dissimular enfrentar próprio cara espelho,1
adorar passar vergonha,0
PM usar mesmo segurança Ne esse hora fascista virar heroína,1
General Keith Kellog conhecer há chance pra NSA 3,1
Henrique Raposo ter dizer comuna facho amigo coisa,0
deixar Algarve,0
vento,0
hino cerimónia tomar posse presidente reality showfoi cantar miúda q reality show dizer,0
haver esperança pra,0
Oi amor vcs noção Correriaaaa Aff Xeru,1
merecer parabéns série vivo,0
Oieeee Amoresss Tô Mtooo Emocionadaaaa SOBRINHA LINDAAA NASCEUUU Parabéns Kilma Lipe Mano amar Karol,1
oi lembrar eu nao lembro comi rsrs voce comeu,0
ir torrent Pearl Harbor tbm bom quase 3 hora,0
ver ir vencer preconceito hahahahaha,1
filme longo,0
imbecil realmente diferença casal amar PORNOGRAFIA INCENTIVADA tv haver 100 ano at,1
imbecil ironia figura linguagem responder conseguir refutar falar,1
Oi sapatão KKKKKKKKKKKKKKKKKK,1
intelectual k chegar mesmo conclusão ano atraso,0
Oi pessoal Marisa Lobo preciso ajuda assinar canal YouTube preciso,0
Oi pessoal Marisa Lobo preciso ajuda inscreva canal YouTube,0
Irã ADVEIDO formalmente disparar míssel guerra Dever agradecer ridículo acordo EUA,0
Iran brincar fogo agradecer quão legal presidente Obama ser,0
Iran dominar Iraque EUA desperdiçar trilhão dólar Obviamente haver,0
Iran último suspiro pronto prum colapso EUA vir salvavida acordo c Iran 150 bilhão,0
Oi vc sapatão n,1
assumir causar chorar pelegada pleno começo 2017 Imagine ser ano,0
lixo acusar mandante exposição filha Maria Rosário,1
Jorge Jesus acusar regresso Kelvin Porto,0
Jorge Monforte bué burro ya filho mimada Bia mulher pedir abortar Ahahahaha burro,1
jornalismo censório manipulador tendencioso tanto mentiroso afinal mundo viver,1
fé funcionar achar colocar tb pombinha branco bandido,1
conseguir mesmo matéria cara entrar armar roubar chamálo SUS,0
José Manuel Coelho pedir asilo político principado Pontinha dever pedir vila Cascais Salgado resultar,0
juiz abrir país possível terrorista objetivo bom interesse,1
acordar sapatão hj,1
país data cheio muçulmano hoje mau,1
Olá Gatas gato hahaha,0
Olga Benario vagabunda comunista safado Getúlio Vargas entregar pro amigo Adolf,1
OLGA BENARIO tomar cu,1
Olha canalhice chamado culpa ser lei criminoso,1
Olha cara qm tar ligar cu sujo fazer,1
Olha ae oportunidade q vc querer ganhar respeito tico Imperdível,0
Olha explosãooo qdo Portugal chegar Islão,0
Olha DEP ExBBB pressionar procuradoria prejudicar prefeito Ariquemes,0
olhar dizer repetir chavão militância mandar xingar oponete refutar,0
Olha lógico kkkkkkkkkkk nao feminista virar feminista obrigadakkkk,0
olhar vagabunda mostrar cara,1
olha mulher ir sincero branco altar,1
Olha apagar printei,0
Olhando bunda Ellen Roche,0
olhar Bruno jogar mostrar bom goleiro penalidade máximo,0
olha noticiário grande jornal país sério gente PAGA pra ler,1
olha processinho pistoleira,0
olhar q falor Intolerância religioso termo usar Esquerda pdiluir religião cristã atrocidade,0
olha pro peito mulher,1
Olhem MEDO mídia presidente,0
Lula falar bom Marisa ficar submisso palpite platéia repleto femini,0
Lula bloquear twitter Alguém ler pra piada,0
lula acertar nota azul guitar hero,0
mail reserva reservasparccom,0
prazer mulher inteligente Fazerse burra perante burro inteligente,1
PSG jogar Branco Barcelona eles confundir Real Madrid,1
Marlon Brando né tbm foda,1
Omã seguir ramo islão diferente resto Médio Oriente,0
bom Angola Angolano haver dúvida,0
dia ganhar capote,0
trabalho Refugiados resumese Lady Gaga sentido,1
verniz branco feio corretor,1
ministério cultura nao servia pra bando vagabundo fazer merda palco ganhar pra,1
movimento levar hashtag trend Twitter começar hoje Porto,0
movimento gordo praia funcionar,0
mundo Sapatao imaginar,0
Murilo deixar prova branco ir bater em ele,0
classificar ter concordar habituer Tratase devassa grat,0
FEMINISTAS,0
de este senhora exigir respeito,0
claro crise econômico último 20 ano resolver 6 vc perfil comédia né,0
regresso prometer,0
bater recorde utilização palavra nabo tv Portuguesa acreditar,0
representante dirigente causa cabinda traír,0
lembrar q Mttttt tmp Atras achar q 7 ano professora sapatao descobrir q hj possuir nome Allan,1
perfeito entendi monte legalizar maconha país dominar zumbi larica cérebro,1
Benfica noite entrar casa mulher decidir imitar Ederson,1
Gabriela Moura integrante agência P3 K comunicação ministrar palestra,0
intervalo almoço excelente reunião Nacional Ambiente alegria ânimo,0
NYT médico tar roer insignificância,0
falido escrever total ficção eu cobriram errar 2 ano inventar fonte,1
Obamacare continuar falhar Humana sair 2018 Iremos revogar substituir recuperar plano saúde,0
ocidente suicidase governante primeiro culpado Portugal excepção,0
2o nirvana,0
orçaminto NIM,0
orgulho hetero válido orgulho homo orgulho outro,1
opa certíssimo Vida humano valer belo ai quebrar ov,0
Bilhetes disponível,0
juntar assustar fogo artificio,0
Pensamento masculino rodeio homem mulher Aguarde,1
mau cego escutar,1
mau cego enxergar ranço mulher burro,1
mau MULHER defender filho puta assumir abusivo DEFENDE CARA MIGA VC TA SENDO BURRA,1
plano recapitalização CGD custar milhão euro,0
PMDB democracia,0
contrário desinteresse partido órgão soberania justo luta cabinda,0
apresentase autárquicas Força,0
PNR congratulase redução TSU colocar interesse partido frente interesse nacional,0
PNR Dia Portugal,0
calar ante marxismocultural censura tolerante hipocrisia fazdeconta,1
solidarizase dor família enlutar morte Agente serviço Nação,0
politicamente correto completamente doentio cogitar homem menstruar,0
politicamente correto tar fuder,0
porteiro Massagear EGO mulher elogiar bunda peito porteiro,1
encontro Jeff Sessions emb russo organizar governo Obama programa educacional pa,0
problema Islão etnia ideologia visar destruir Cristianismo referi f,1
problema piada esquerdista zombar PM tar lindo hora,1
PSOL seguir ideologia comunista coreano comer cachorro levar pé letra,1
q mulher d bonito d puta burro mentiroso N q ta passar mão amigo,1
adiantar vc sentir pena conseguir refutar linha falor tática,0
junto chamar jornalismo chamar mico militância derrubar picareta,0
clodovil querer aprovar PL reduzir 513 250 politico congresso DEIXARAM,0
intervenção CÍVICO MILITAREste vídeo pensar,0
Globalismo Lauren Southern Muita gente compreender,1
juventude fazer liberdade Confundir libertinagem,1
mulher falar tô esperar comida falar sla sentir burra,1
incomodar trabalhar G1 escrever hajir ser verbo conta verificar,1
Barcelona acabar ficar história futebol remontar incrível,1
feminismo muçulmano,0
lavar tênis branco,0
exatamente,0
válido Feminicídio Estupro Mercado trabalho Falamos dia Poderia dedicar coluna,0
islâmico falar,0
racismo esquerda passar tl politicamente correto protesto Imagina,1
racismo mulher negro latino sofrer área ciência tecnologia engenharia matemática,1
racismo acabar deixar existir homem branco homem negro passar existir HOMEM,0
estagiário foder em esse,1
passado sujo,1
Raúl José cagar pedir autorização Jorge Jesus,0
começar discurso mandar alô pra moral hein Ahahahahahahahaha,0
repórter lembrar crime ódio cometir imigrante esquecer crime cometir imigrante,0
resultado jornalista falar passar vergonha público,0
retrato juventude atual mostrar dia mesmo presente protesto esquerdista,0
Orfeu XXI Música vida dignidade haver afinal fronteira muro poder conter música mundo,0
orgulho BRANCO,1
ruim chileno branco dia ficar preto,1
bebé adoptar c telemóvel Qd ir buscar desesperar deixar cair Qd ver 1 defeitoabrimo contar OLX,1
benfiquista aguardar ansiosamente reeleição Bruno Carvalho único receio russo decidam interferir eleição,0
bilhete Figueira Faro Lisboa Porto Évora venda sítio costume,0
cara ficar expor trabalho chamar sapatao mereço,0
Oscares Prémios Nobel afim politiquice interesse influência vergonha Seriedade mérito,0
democrata ter criar justificativa derrota eleição inventar história RÚSSIA,1
europeu acordar reagir Europa Nações Nacionalismo mundialismo opressor,0
funcionário matar menino Habibs pq negro pobre Hahahahhaha funcionário Habibs ser rico,1
guri nutrição faculdade igual Branco musculosinho tatuagem maori braço,0
HEITENS ODIADORES INGLÊS ACUSARAM GOLPE TRISTE CULTURA ÓDIO RESPEITO,0
homem governo Suécia bola afeminar acaso refugiado deitar rolar naque,1
homem igual deixar último hora Dia Namorados amanhã hoje começar assaltar relojoaria,0
dose diário antitrumpismo reportagem 16 país proíber entrada israelense,0
idiota cancelar conferência d Jaime Nogueira Pinto pequeno sala FCSH arriscamser vêlo esgotar pavilhão Meo Aníbal,1
islamico moderado filmar tirar fotoos Islamicos praticante alertar ocidente,1
jovem,0
média pilar combater Deles poder esperar mentira eou omissão,1
meme Nana Gouvêa divertir kkkkkkkk,0
muçulmano bemvinr,0
muleke liso governo,0
negro estudar estudar,0
sonho liberdade expressão exercício democracia de eles China Cuba conservador presidência Jamais,0
sonho telemóvel rede forte pescador Nazaré arrastar bomba 200 Kg rasgar,0
país solidário pobre aberto refugiado Europa fechar Velho Mundo,1
Sporting continuar Europa futebol,0
português Passos Coelho ter coragem Salgado stresse Ricardo levar guito pró Panamá,0
português hoje conseguir dormir,1
português pessimista acreditar c música Eurovisão Salvador Sobral superar votação ano passado,0
preto criminoso gaja decote sluts bissexual indeciso refugiado merecer oportunidade vida,1
reflexo guerra trouxer mudança vida de ele Conheça história,1
refugiado classe político traidor,1
refugiado estao vir terra notor nao sentar acolhir,0
Resistência voltar concerto Bataclan raio cair 2x sítio deixemme sonhar,0
responsável,0
SR NETO LÁGRIMAS FORÇA GUERREIRO,0
2 robô NASA superfície marte,0
tema resultar visita efectuar Incluída mesquita submissão,0
macarrão Goleiro Bruno Champinha,0
fazer conluio moça maluco psicopata,1
tolerante dono carneirada submisso contrariar ofender tentar ridicularizar Hipócritas mau perder,1
SUS sucateado conseguir atender cidadão problema grave saúde medicamento,1
tao amigo á praia sentar areia apanhar sol falar cena,0
inacreditável totalmente imprensa cobrer Obama,0
terror esquerda,1
pai nao Angola Luanda,0
texto velho ladainha feminismo verdade passado hoje dia blablabla deslegitimação básico,0
Ótima,0
Ótima sessão audiência CEOs Associação Líderes Indústria Varejo manhã,0
Otimistas pessoa informar,1
Tambem tm video Bruno namorada mao dar nao natureza de ele tratar mulher kkkkk,1
pra cara BB jornalista,0
perfil ta apurrinhar mundo postar dia mulher,1
huahauhaauhauha uahuahauhaa ir agenda feminista defender mulher,1
Feminismo movimento q lutar mulher perseguir td mulher q ter opinião próprio,1
islamismo estar praia islamismo tao luto,0
ir mandar pra corrigir post anteskkkkk verdade novokkkk,0
Trump futebol reeleger começar construção Muro 2a Circular Benfica prepare guito,0
TUITER RESPIRA,0
único objetivo família João Victor Guilherme Francisco Santos Alexandro José Silva,0
uso turbante pessoa branco apropriação cultural ver,1
Jênia achar violência mulher Brasil fato país cristã n,1
menino pedir lanche amiga ignorar noer gritar tia vc ja ta gordo hahahahahahahahaha,0
país cobrar empresa americano imposto tarifa EUA cobrar Deveríamos cobrar,0
ouvir Chorão sair Charlie Brown Jr entrar Sepultura vdd D fé Brodi,0
ouvi rede tv Hungria fazer cerca eletrica evitar invasoes refugiado nao dar IbopePesquisem,0
Ouviu Militar sair disparar esmo,0
verdadeiro escândalo informação confidencial passar ilegalmente inteligência doce,0
OVERDOSE TOURETTE ON THE ROAD comboio chegar cidade,0
video sapatao tocar siririco,0
ovo Páscoa petista,0
nunes merecer título youtuber Brasil respeito parabéns,0
ow gráfico problema curva exagerar,1
esquisitar tar imitar tt pala hahaha,0
oxente Pq santo rs oooooooooo maluco,0
pooor otimista hein,0
PAGANDO CONTAS,0
PAI FEMINISTA SAIU PRA COMPRAR CIGARRO 2º GOL ZIDANE 1998 VOLTOU,0
país quebrar desemprego pra violência comer soltar falar FOLIA PQP VTNC merda,1
palavra dia homem homem Fragrância,0
palavra presidente Trump Assinatura Resolução HJ 41,0
palhaçada puro achar perder sono causa voto,0
Aprecio humor,0
Aprecio humor calmo abuses vontade,0
cara grau total ir morrer,0
sapatao super indico,0
Papa Bergoglio pedir cristão ter filho,0
tme gente tattoo pra filho ajuda ne passional,1
parabéns ae Gabriel vc merecer chorar aq,0
parabéns menina kkkkk,1
parabéns Conselheiro Segurança Nacional general HR McMaster Vídeo,0
parabéns Procurador,0
parabéns Dr David Shulkin Hora cuidar veterano lutar proteger,0
parabéns Secretário Tesouro Steven Mnuchin assitar,0
parabéns jornalista reportagem BNDES Investigação corrupção governo,0
parabéns Rex Tillerson tomar posse Secretário ser estrela,0
parabéns Stephen Miller representar manhã programa matutino domingo Ótimo trabalho,0
parabéns Thomas Perez acabar nomear líder CND poder feliz pe,0
parabéns mulher mundo Ser vc feio lindo velho gordo magro qero q saibam Q respeito faltar,1
parabéns mulher abortista aborteira gente,1
Parabéns Beyoncé estar fevereiro ganhastir prémio foto absurdo 2017,1
PARABÉNS CHORÃO 4 ANOS DROGAS,0
Parabéns Cidade luta ideologia GêneroA sociedade organizar apoiar,0
parabéns deputado Brasil colapso cultural inversão doentio prioridade,0
parabéns deputado Roberto Lucena proteger povoSe pagar imposto pagar,0
PARABÉNS ESPECIAL PRAS MULHERES SEGUEM MULHERADA GUERREIRA BATALHADORA PRA MIMIM QUERIA BUQUÊ DI FLOR PRA,0
parabéns guerreiro gritar peito rua em un país mulher livre fácilquero lut,1
parabem hugo Chavez morte,0
Luciano Azevedo PPS prefeito passo Fundo RS resolver verba R 400,0
parabéns notícia Desconstrução filme Bela FeraNosso irrestrito casal dono,0
PARABÉNS ESTAGIÁRIO MELHOR,0
Parabéns Mulheres verdade mulher inteligente drama verdadeiro história mulher burro his,1
parabéns,0
parabéns Patrícia Mamona,0
parabéns pra eu cheguei atrasado,0
parabéns pra sapatão piranha Santaa Cruz 19 ANOS NÉ PORRA Teeeeeee amooo vir sábado bebê,1
parabéns pra mulher parabéns pra feio gordo cuidar coitado arranjar,1
parabéns pra mulher parabéns pra feio gordo cuidar coitado arranjar,1
PARABÉNS PRESIDENTE EDUARDO CUNHA,0
parabénsQue mundo copiar permitir insanidade,0
parabéns esperança reforçase,0
parabéns sinal inequivoco certo,0
PARABENS SAPATÃO SDDS,0
parabéns VIDA básico inegociável pessoa,1
chamar fascistavc fascismoseu filho puta,1
falar alemão caralho,1
desconcentrar homem decote necessário peito,0
ler Islão problema mulher,1
Dia Internacional Mulher P3 K preparar encontro cheio significado aprendizado troca,0
PESSOAL CONHECE FUTEBOL EUROPEU CITI X MÔNACO ESPÉCIE MARÍLIA X OESTE BRASIL,0
sportinguista Bruno Carvalho valir Sporting Clube Portugal valir calado,0
AMOR SEXO PROGRAMINHA LACRADOR APANHA PRAÇA AUDIÊNCIA,0
simples fato apoiar xucra Conversar cara de esse Babaca total,0
urgir desparasitar classe político dirigente Árvores podre fruto podre,0
