mensagem,odio
hoje talho Mota vandalizar encontrar porco presunto embrulhar papel azul,1
Barça ver PSG branco pensar ser Real dar dar né kkkkkk,0
programação fortaleza,0
BNDES emprestar país prazo 15 ano companheiro Castro Cuba regra quebrar emprést,0
eleição ser hoje 2º turno ser João Dória Jair Bolsonaro votar presidente,0
lei imigração abrir fronteira Brasil refugiado liberar ONU emitir visto tirar,1
jogo duvido Angola ganhar 4x0 80 minuto Angola 4X4 Mali 10012010,0
tbm refugiado qm casa q passar fome qm abandonar pai familiar enfi,0
vejor alguém falar racismo inverso existir,0
angola Europa xD,0
Angola considerar bom destino europeu 2018 desistar vida,0
faltar dizer Angola cidade xD,0
q mulher qd decidir eu mesmo filhasim planejar ouvir q mulher burro desestruturar,1
vestir vermelho branco podes Vence Vence VENCE TI,0
acordo conta trabalhador Disney americano educ,0
amor sexo lacranteeee chorar família tradicional mundo real pai tar ver praça,1
Tadinho de ele faltar oportunidade Tentar 4 roubar casa gente Pais chacina massacre,1
quebrar Tabu tar pedir desculpa nego confirmar história Homicídio,1
mulher burro nojo,1
sapatão inferno Jakakaka,1
Oi Aguardo opinião islã massacrar mulher,1
interpretar bandido defender bandido,1
Retweeted MARISA LOBO Comece cinema rejeitar compartilhar h,1
Dê sentimento dinheiro dia acabar maquiagem sair água,0
DÓI OUVIDOS PT FARSA manifesto concebir livrar Lula cadeia torturo verdade trucer língu,0
Brincamos doutrinação ideológico ensino mídia inimigo Fabricam ti,0
Odeio Carnaval bom carro alegórico ver vida,0
s atender imigrante português Vzla pronto refugiado algum país caso,0
haver cozer portuguesa ter farinheira greve Função Pública ser sextafeira,0
criança educar muito gente ter ser educar pensar criança vir homossexual,1
acabar apresentar senado projeto lei p obrigar preso indenizar vítima,1
ir bingo neurônio galera achar desmilitarizar PM acabar polícia,1
td dia msm post ldrv perguntar cade sapatao,0
vídeo bom,0
esquerda inventar problema incutir cabeça pessoa problema existir repetir mentira acreditar qu,1
Reinaldo Azevedo lavajato queda PT passar atacar moro chamar ditador,0
Temer ser apedrejar elogiar mulher jeito esquerda pirulito aprovar exaltar qualid,1
Destrinchou problema cabeça esquerdista,1
vitória ES Praça 8 8 hora dia 8,0
intérprete língua gestual traduzir bom maneira belo figura Passos Coelho parlamento,0
Esquerda trabalhar vapor aprovar legalização agressão universo feminino aborto,0
gente xingar mídia continuar xingar hoje,1
violência mulher acabar lindo ato Prender homem violento pensar,1
Cynara Menezes hoje sonhar Reinaldo Azevedo repetir discurso de ela Joice,0
lavado Rachel Sheherazade dar falso ativismo feminista merecer ouvir,1
Levy Fidelix pagar 25 trilhão aparelho excretor continuar igual,0
concordar familiar atacar adversário político bandeira educação,0
dia acusar pedofilia defender Bolsonaro errar acontecer Bolsonaro,1
ato feminista 2017 Marine Le Pen recusar curvar imposição machisto islâmi,0
ruim falar Papa Francisco pra acompanhar política mundial vc acabar ser chamar doido,1
fã Lula mentira,1
Ó Patrícia Lélis acusar Feliciano estupro fazer aborto filho Eduardo acre,1
andar preocupado candidatura Jair Bolsonaro,0
Pensando textão machismo postar facebook,0
PSDB perder título Brasileira Jair Bolsonaro muito humilhação,0
querer igualdade querer igualdade empoderamento feminino querer igualdade Ops Pera ai,0
Bolsonaro eleger engraçar assistir manifestação organizar MBL junto UNE Machistas passar,0
achar lindo achar arte vc fascista,1
teresa quintal gente excepto ignor Teresa sitio fufa gente BORA1,1
Japão política imigração restrito entrar refugiado porta frente passar po,0
feminista feio gordo Pagar peitinho passeata peludo odiar homem achar q diferença,1
Deus tar ver turma reclamar boçalidade petista relinchar Trump Hitler Dilma sugerir,0
mentira Trump divisor água imprensa oficialmente perder compromisso verd,1
feminismo 2017 1 Homens ocidental usar saia batom 2 Abram fronteira muçulmano Liguar,0
Legaliza cobrar impor q diminuir crime vc q imposto roubo crime aumentar certo,0
Mulheres minoria curso engenharia denunciar feminazi escolher profissão,0
problema mundo branco velho europeu raiva militante ideologia criar branco velho euro,1
resumi pronunciamento sensacional Bill Whittle fazer dia eleição ano passado,0
Vejam participação audiência Escola Partido Parabéns dar show,0
doença terminal precisar deixar 3 filho pequeno alguém cuidar De esse opção escolher,0
Chegamos 120 amigo programa gravata mulher Bemvindos ir frente,1
enter pessoa confessar crime chamar suspeito,1
brasileira estuprar 11 minuto reagir escandalizamo preocupar American,1
eito Alemanha avançar restringir uso burca ver,0
casa aceitar refugiado aka Mónica,0
Concordo Venceria eleição,0
comer lixo prosperidade comunista bolivariano Luladrão ORCRIM apodrecer cadeia htt,1
Macho Tuga,0
nao entender mto nicki minajr achar livro dai ler transformar bella crepusculo q doideira,0
Folha S Paulo omitir 20 milhão morte fazer Revolução Russa reportagem surpreso htt,0
destrua comunismo cobra morta nascimento mordida letal praga vermelho,0
Foto casamento infantil forçar casamento infantil comum Oriente Médio islamismo,1
Lembrese Brasil precisar próprio ousadia garra força ir combater praga,0
Manifestação pró Trump acontecer EUA mídia ignorar foto vídeo,0
refugiado iraquiano estupra menino austríaco 10 ano alegar emergência sexual,0
Zoofilia PSOL lixo podre PT doença,1
Prefeita Calais moderar partido Fillon proibir comida refugiado,0
rir tweets kkkkkkk,0
dica 1 6 incrível valer pena ler 3 hoje querer imprimir 9 colar testa,0
overdose tourete hoje Porto,0
ser consolar fato amanhã,0
feio gordo casal,1
Fufas decente hj dia mulher,1
noite,0
líder ser líder,0
tô chegar You Ei levar Trumpão massa,1
Angola wi,0
liga manar claro carimbo passaporte rs vir p brasil refugiar an,0
Banir refugiado cruel prejudicial economicamente,1
gente comemorar Levy Fidelix multar achar aparelho excretor começar rep,1
mulher engenheira nuclear conseguir cozinha puto merdaaaao,1
data comemorativo dia conscientização luta diário mulher busca respeito,1
vc achar obrigação receber refugiado Islâmico né reclamar,0
mostrar pagar politicamente correto Internet MODINHA amar,0
lobo pele cordeiro hipocrisia neles,1
doença comum Angola catingar paciente entrar Médico catinga filhonão t,1
homossexual ninguém homossexual criança ficar preconceituoso respeitar orientação sex,1
achar primeiramente criança dever cena beijo independente génerosgays hetero,0
homossexualidade pensar normal apesar dhaver criança criar gay u,1
completar mulher útero gerar filho Homem,1
acorda mulher burro feminismo afrontar nudez respeitar corpo homem depoi,1
Mitroglou 0X1 brigar bola Benfica vencer Braga manter liderança Campeonat,0
ajudar CENA REPITA dia 26 março Dê ENTUSIASMADO,0
Entenda portalzinho merda controlar vc pensar falar passado,1
Passando Camp Rock Disney ver gordo feio ter dinheiro,1
pq feminicídio noticiar chamada amor ciúme crime passional cer,1
Sócios GNV Prata GNV Branco continuar venda ingresso Atlético x Tupi Vá Horto torcer,0
orgulho chamar ultra mega conservador ficar radiante,1
Evitar carne ganso quizila Oxum comer carne pombo galinha dangola casa pena pavão,1
cl ex 2ne1 sofrer ataque debut considerar padrão chamar gordo feio várias rev,1
racismo pos Anoes preto fufa gay shemales Simao,1
idiota protestar qdo país de ele sair rua haver 2 pedir morte Trump aniquilamento,1
20 cm conseguir curar,0
poliamor desculpa vagabunda pra rodízio piroca,1
Autoridade Tributária Banco Portugal ficar giro finalmente começar perceberse trapaça galifõ,0
Carlos Costa ter informação BES chegar hoje haver informação Carlos Costa tb,0
Pssst gente histérico perceber voto decidir anónimo,1
Emilly pedir tirar caixa leite casa beber leite saquinho desabafar sister,1
gosto sair casa,0
viva Islã Religião bater mulher apedrejo decapta mandar cobrir pé cabeça q feminista,1
sapatao super indico,0
querer dedicar tweet sapatonice vida sapatão bjs,1
Façam zoom pescoço Éder,0
assassinato 65 dias Desarmamento sucesso,0
democrata boicotar posse Abraham Lincoln ter ideia maluco acabar escravidão,0
realmente difícil entender doutor Marisa enxergar nenhum benefício Carnaval país,0
dizer vcs atender necessidade público essencial expor hipocrisia politicamente correto,1
Gabriella pq Gabriella SAPATAO puxar fole fi rapariga,1
Guia Politicamente Incorreto Filosofia Pondé explicar trabalho Leiam,0
hoje dia almoçar amante jantar mulher restauração agradecer,1
filho segurar segurar macho mlq vidamulher q engraver saber q cara s,0
Leiam semana,0
amar temer,0
fato 44 vc menina algum garoto chamar gorda feio vc fingir n importar chorar,1
psd candidato cml q anónimo,0
chamar branquinha ir falar bastar namorar branco ter orgulhar,0
bom twitter,0
certos problema sapatão precisar preocupar tomar açaí paz,1
Marcelo dizer reunir 100 Dilma insultar honestidade Dilma insult,0
Justiça sequestrar cobertura R 15 mi ocupar Lula apostar lulista cogitar vaquinha pag,0
Gente comum frequência deixase levar histeria esquerda preciso descrever íntegra quão ridículo M,1
haver esquerdo criança haver gente comum alheio batalha Parem achar explicação esquerda,1
Odebrecht pagar 100 dólar mensal Farc 20 ano Rock In Rio confirmar Guns nRoses Música dia Welcome,0
Relembro texto denúncia ativista flagrar ato petista Bolsonaro rebater xingamento,0
tucano distinguir PT,0
campanha pq luta transfobia tbm luta feminista,0
8 março ir junta Dê dizer,0
30 arrecadação Previdência Social desvincular desviar Seguridade Social,0
Desvinculação Receitas União DRU permitir governo federal livremente 30 tributo federal vincul,0
justo poder arcar tamanho sacrifício cortar reduzir assistencialismo,0
empenho famigerar reforma Previdência causa DRU 30,0
Ederson apesar tocar bola atropelar adversário Penalty assinalar co,0
feira,0
Zumbis tentar escrachar Universidade Presbiteriana Mackenzie,0
ter buscar foto criança jogar vídeo game provar papai vídeo gamefóbico Pqp,0
alô STF ir indenizar equipe trabalhador Brasil vítima pr,1
audiência custódia prender esculhambar juiz certo desacato liberdade expressão crime,0
Bancada feminar aproveitar dia internacional mulher p aprovar lei proibir gestante luz algemar mulher,1
bancada feminino aproveitar dia int mulher criar fundo nome bonitinho financiar ABOO Legal né,1
SINAL PADRE PETISTA JÚLIO LANCELOTTI DEMONSTRA DESESPERO DESCONHECIMENTO BOLSONARO,0
DEPUTADAS BANCADA FEMINISTA TIRAM PROVEITO DIA INTERNACIONAL MULHERES,0
eis valetudo tachar nazista blog Rodrigo Constantino desvendar farsa,0
padre petista acusar pedofilia Júlio Lancelotti atacar gratuitamente moral p,0
acusar racista águia informar absolvir mudo entrevista vivo gravar po,0
PSDB pró desarmamento redução maioridade penalnunca nomear MinDef melhorar segurança sab,0
PSDB votar privatização CEDAE contar né ser caso privatizador x estatiz,1
6 página Repórter acompanhar ida Campina João Pessoa semana passado,0
Bolsonaro,0
galinhr Angola,0
dia passar crescer aindamal adepto Marcha Orgulho Hétero pouco hétero restar,0
regrann LUTA SÉCULO UFC Bolsonaro X Borrachinha FortalezaCE 11,0
Emirados Árabes Marte construir Dubai 2117 UOL usar grana ajudar re,0
finalmente Itamaraty fechar embaixada inútel criar Lula Dilma país miserável consomer US 3,1
Gostaria OABSP responder perfi facção criminoso atuar livremente Twitter rede sociar,1
ver popularidade despencar debandada seguidor Reinaldo Azevedo afagar esquerda co,1
ex obra Angola vier nao BNDES entender htt,0
Raiz Nutella pra vc,0
mulher ehr mega inteligente doutorar ate casa caraí cozinha porra,1
tipo d pessoa concordar Bolsonaro q entender discurso q compactuar c coisa errad,1
Existir mulher ladra canalha safar dissimular sinto voce saber Feliz dia mulh,1
Gente Trump sensacional mulherEssa mulher MITO,1
vcs grupo amigo bom nenhum sapatao,0
lindo vermelho branco,0
chegar Ponte x Bernardo,0
fudar cara retratar jesus retratar cara branco cabelo sedoso olho azul etc cara nascer oriente médio,0
haver crise Angola,0
mundo dorviolência injustiça orgulho marido tanto amigo talentoso q esforçar p f,1
3700 adepto Benfica Alemanha LINDO VERMELHO BRANCO,0
ir perguntar dia Internacional mulher mundo parar pouquinho pra pensar to sentin,1
Ensinar criança pessoa homossexual eu indiferente propaganda dra,1
assistir,0
marido Maria rosário oferecer,1
ha ninguém machista feminista feministo,0
Feliz dia mulher 1 mãe tb mulher Tw,1
direto vida aborte,0
parabéns mulher q merecer respeito hj dia ano homem Unidos ter s,1
ninguém ate hoje chamar fascista ta fazer errar,1
cromossomo xx rola perna,0
Fufas merda atiramse mexer,1
Normal pq esconder criança q homosexualidade existir irás ensinar criança respeitar,0
Portugal ÚNICO País líder partidário achar elevação carácter fuga político apanhar,0
haver sonso canalha ar pSDBista resolver criticar Bolsonaro posicionamento q PSDB Iss,1
Homem esfaquear matar saída bloco Ipanema Banamse faca beatifique criminoso chamar Bolsona,1
político padrão desdenhar recado população política insosso oposição amado,0
OSCAR 2017 derivação GOTA LUCIDEZ OCEANO,0
Tentam homofóbico racista misógino xenófobo colar videogamefóbico,0
aliado armar cidadão indefeso canalha falar moralidade desarmamento mesmo,1
ter piada Carlos Alexandre Sócrates partilhar cela,0
Glória Deus,0
produção literário nacional activo Yronicamente,0
conhecer fufa comprar bom frase dizer hoje fds,1
Rosa parks costureiro negro americana recusar branco ônibus marcar início luta anti,0
Serviço contenção vazamento Barreiro bomba flutuante começar jogar água reservatório Campos Barro,0
IGREJA Católica Plena Decadência Padre Júlio Lancellotti Acusado Pedofilia mete POLÍTICA Ataca BOLS,0
Feliz Dia Mundial Rádio,0
Alguém ter perder Samsung Branco hoje,0
normal haver heterossexual mundo,0
Descobrimos Rui Cruz chorar filme romântico,0
salto ehr 10 pé paraqueda andar prancha tubar branco espera,0
UNIFORME OFICIAL CAM preto branco listadoSó jogar branco merdar,1
pro construção resumir coisa concreto Madeira,0
segredo bastar explicar q amor n limite raça etnio género físico etc,1
amor,1
URGENTÍSSIMO Assine campanha pedir PL 7371 ser pautar,0
Assistam Hangout ht,0
regicídio parricidio genocídio etnocidio aparentemente difícil aprender português lamber b,0
amar sorriso,0
ter mosca tirar tela pra sair saír vc burra filha mulher passar,1
pena capital pena morte político corrupto bruto,0
KOOK 1 BOLSA EXÉRCITO SUPER TENDÊNCIA TD GÓTICOTÊNIS BRANCO PQ ALÔ CARO http,0
tempestade chegar continente,0
União Europeia multar país abrigar refugiado Entendem ruir,0
padre pedófilo abusar moleque proteger dinheiro igreja bancar,0
Franceses rua Marine Le Pen golpe q poder retirála disputa presid esquerda agonizar mund,1
mulher burro machucar braço,1
realmente defender mulher Simples momento atacar ferozmente mulher estar seguir cart,1
dossiê Sapatão revolução existência resistência lesbianidade encruzilhada subalterno 2603,0
Fufas trocar alma pão fofo,0
bonito estupra merecer ficar triste imaginar var nú,1
hoje atentado terrorista perpetrar refugiado muçulmano Adivinha dizer encher Brasil refugia,1
sentido q angola colônia,1
ya,0
adorar,0
João Kleber Rede TVPutaria Mau Gosto Baixaria GloboOusadia Arte tapa soc,0
apaguar nordeste levar brincadeira vejor motivo nenhum pra revolta,0
to dúvida mina sapatao falar gostar Anavitoria,0
família tradicional assistir praça bosta,1
ENGENHARIA Barragem obra Transposição Rio Francisco romper divisa Paraíba,0
soltar assassino Bruno tar bom né STF,0
Agradeço ultimamente insistentemente citar criticar tweet sinal q estar c,0
,0
Dilma mente tantoque estar aprender identificar menteBasta mover lábio,0
esquerda odeiar capitalismo abrir mão capitalismo produzir iPhone MacBook 30 fato mostrar,1
dar lógica racista justiceiro socal durante calar,0
pro socialismo dia enganar trouxa cair discurso noite camar,1
to dar berro,0
pessoa hoje dia falar td hora pra vc amar vc aceitar vc BRANCO HÉTERO VC,1
meudeu FARDO nascer hétero branco aff tragédia grego,0
artigo atualizar gay negro judeu MEXICANOS Trump,1
presidente África Sul pedir confisco terra pessoa branco,1
chegar 2018 bolsonaro ganhar perder pesquisa perfil filho amigo vida,0
Cleo Pires tirar foto fumar maconha pq n tirar tbm exato conseguir,1
Feliz dia mulher pra Disse fernanda menstruar engraver prestar alistamento militar obrigatório,1
pra estimular compra carro elétrico Brasil Bjs,0
perceber orgulho de este fufa,1
solidariedade Rio Sergio Cabral estar junto enfrentamento crime organizar,0
Solinho de este 8 manhã gnd mimo lembrar mt verão gajo aguentar tar fechar sala aula,0
deus ser Louvado,0
Fátima Bernardes párar repetir estrago homem branco causar chegar Brasil estudar,0
Aeeeee dilma cair ja viajar pra Miami,0
maconha rir mesmo mãe chorar,0
Deus criar Adao eva nao Adao Ivo,0
escola marxisto doutrinadora esquerda saber alienar futuro cidadão,1
heterofobico passar,0
hj ir prestar queixa ser vitima racismo inverso chamar branco azedo,0
tar hora acabar ciência fronteira bando pobre ir viajar pra Europa avião,1
meritocracia existir n ta ver nordestino pedalar 29 km nadar 41 km formar direito,0
morrer fome pq carteira trabalho graça,0
MOE ESTUPRADORES amigo bancada tar tranquilo,0
mulher ate amiga sao,1
sapatão errar travecar mó pirocão,1
paulista parar sentido Consolação protesto Lula,1
achar correto estar poder go back assunto re,0
mundo sapatão viagem mundo pegar mundo credo YCYFUGUG,1
achar Kids precisar show Deixem criança ser criança inocência descobrir mundo,0
orgulho q reprime qm,1
DrÁrbitro Luís Ferreira advogado defesa árbitro corrupto condenar Apito Dourado,0
último pra passar branco Libertadores time pênalti diferença Flamengo aquém,0
Imprensa Viva Lula Dilma credenciar Marcelo Odebrecht assaltar Petrobras revelar justiça americano,0
dia sapatão,1
olhar achar q pessoa aceitar racismo pq simplesmente saber q racista estupido dema,1
saúde futuro sociedade depender basicamente realidade,0
verdade rua,0
Amor Sexo Encontro Fátima Bernardes ligth,0
antigamente ter várias gostosa carnaval encontro sobrevivente Chernobyl,0
Bolsonaro entender economia,0
Cebolinha PSOL,0
certo pico,0
futebol feminino eim Alguém algum jogo olimpíada pra esperar 2020 pra reclamar d,0
Feliz dia internacional mulher,1
Geraldo Alckmin vs Jair Bolsonaro esquerda escolher ficar merenda cu,1
Gostaram,0
haver 5 ano estear Internet,0
ressocialização,0
PT receber 40 milhão Itaipava Lula alegar pra consumo,0
voto turno,0
Moro peçar depoimento Lula escrever mão zuer,0
ter filho gay ser duplamente presente pra precisar expor pra chamar atenção,1
turno alckmin vs Bolsonaro Alckmin Vc homofóbico Bolsonaro tô falar vc,0
pai tratar vc gay pai tratar pq vc tá desempregado 30 ano dançar pop c,1
mulher respeitar independente feminista feminista lutar mulher nã,1
vagabunda,1
de aí pelego,0
pra eu irrelevante querer pegálo mentir conseguir,0
desmascarando março 2016 dúzia Dilma Lula Cardoso Mercadante agir Lava Ja,0
Dilma Lula agir Lava Jato Reinaldo Azevedo 2016 PT agir Lava Jato R Azevedo 2,0
Fãs selfie Bruno 400 intelectual Lula presidente Entenderam,0
Ganhar elogio ganhar noite,0
verdade 2016 pedir cadeia Dilma Lula Cardoso Mercadante agir Lav,0
defender Reinaldo várias mentir descaradamente defesa,0
canalha desocupar exigir inutilidade aliás Rio sair frente assunto canalha,1
Suplicy implorar reunião Dilma atendir Marcelo Odebrecht 100 reunião D,0
feliz dia mulher Beatriz Vitima estupro coletivo 33 cara RJ algum,1
BARCELONA EXPLICANDO VITÓRIA VIMOS ADVERSÁRIO BRANCO ACHAMOS REAL MADRID,0
mulher esperto homem palma mão mulher burro achar vdd,1
mulher inteligente outro mambo ya Burra bue bonito burra ta gato morrer,1
mulher apanhar homem continuar burro Att perguntar burra acabar,1
achar mó engraçado galero tentar chamar atenção fznd piadinha burro dia mulher,1
mulher lindo haha,1
criança gay assister casal hetero beijar ficar direitoscomo è q supostamente acontecer,1
existir algum pauta feminista ser extremo esquerda,1
mostrar patrulheiroa politicamente correto mostrar hipócrita,1
Votaria,0
Amei provar onda politicamente correto farsa inventar último,0
vaga oferecer democrático direito,1
dizer ver atirar bala verdade manifestação,0
polícia militar acabar tiro pistola pra ninguém contar ver,1
ver desenho idade beijo gay pod,1
Olá chama Angolamas podias,0
ai to pensar VIRAR sapatão pq homem n prestar,1
prova feminismo lixo ausencia Textao de elas pro islä cobrir mulher cabeça pès,1
funcionar feminismo mulher seguir cartilha representar mulher Lixo movimento h,1
cara entrevistar ficar igual putinha concordar lançar legenda canalha arrombar,1
playboy safado fortalecer,0
nois fundo nois tar precisar,0
qnd arreper mensagem mandar,0
amer indústria sapatao brasileiro,0
Incrível facilidade sapatao pra namorar,0
aplauder decisão justiça condenar Levy Fidelix homofobia entender ditadura sobr,0
amar tt,0
bicho sentir burra ouvir mulher falar,1
dia contribuinte haver comissão parlamentar inquérito inutilidade comissão parlamen,0
mídia autoridade local ignorar Rotherham cidade 1400 criança estuprar islâmi,1
achar habibs dever mapeamento ativista falar merda meter famoso,1
jornalismo Globo News correspondente Carolina Cimenti levar fé documento verificação Trum,0
cheguei conclusão feio gordo,1
viajar mochila pq mochila,0
pessoa sensato habitar,1
Alguém,0
Deixei redação enem branco pra falar feminismo,0
hoje ver mulher afogar clube Fiquei incentivandoo roubar protagonismo velóri,1
,0
denunciei haha,0
pq dificil admitir q homem mulher gay n branco negro n q ha gente honesto n r,1
estado excepto cumprir obrigação acolhimento refugiado vindos,0
Mostrar relacionamento gay problema Basta homossexual,1
refugiado ideologia Cultura completamente INCOMPATÍVEIS,0
relacionamento homossexual negativo,1
ir levantar hastag pressão total Copie poste timeline,0
responder pedofilia ser processar calúnia contir igreja,1
dever fizemos visitar Museu Holocausto desdenhar sofrimento judeu pa,0
canal defender PSDBista estimação querer cometer crime,0
fã eleitor eleitor Viva democracia,0
pessoa saber significar PIB 2016 2 ano país 736 pobre souber petista sa,1
quanto robô Pepper precisar tag próPT povão honesto trabalhador meter,1
falar EUA espionar mundo denunciar falar Obama espionar,0
Porto Ferreira,0
islamismo triste realidade imprensa recusar mostrar,1
Terrorista fantasiar refugiar mandar Europa cortar cabeça,0
homenagem Revolução Russa Bancada Psol relógio ser atrasar 1 Século,0
precisar precisar ninguém,0
Eutanásia achar Europa misturar continente,0
primo sapatão primo sapatão,1
8 março rua,0
patrão pedir pra hora extra mulherada inventar tar ate família doente casa pq,0
Operação Research Universidade Federal Delator Odebrecht,0
anónimo temer represália profissional Sócrates exercir pessoa estar,1
rir KKKKKKKKKKKK valer pena,0
olhar pra cara gordo feio Isabelle contar voz irritante de ela,1
hj mulher maravilhoso mulher aquiloamanhã pq mulher burra N dirigir mulher,1
Alguém lembrar Dilma ser grampear Petrobrás governo Obama,0
Arthur sexualização criança,0
feminista Emma Watson causa decote de ela aahahah fazer,0
Ato Trump Miami imprensa brasileiro mostrar,0
Bolsonaro vídeo coibir jogo violento pra criança pequeno cuida filho,1
comentarista Globo News orgulho posar homem organização terrorista q matar m,1
Dória esquerdo admirar adorador maconha FHC,0
cara responsável diplomacia Brasil EUA,0
padre acusar pedofilia pagar família vítima,1
Feliz dia internacional mulher Margaret Thatcher tanque,1
FHC Reinaldo discurso,0
assaltar levar bala,0
Franceses saír pra protestar Le Pen candidato,0
liberal MBL entrar política velho política,0
macarrão solto STF,0
Globo News Trump ruim economia Ué,1
Muçulmanos vandalizar lápide judeu cristão,0
multa 5 real apagar pichação cidade,0
Arabia Saudita Irã Afeganistão ir feminista falar islã,0
existir extremo esquerda pra globo extremo,1
trans estuprador existir ir deixar menina homem banheira sozinho,1
discurso Trump Congresso 43 milhão espectador Oscar 32 milhão espectador HEUEHUEH,1
2012 Olavo falar esquerda bandido,1
Olha menininha Trump,0
moleque MBL levar surra ahahhahah,0
STF ajudar bandido,1
Obama saiar Jornal Nacional imprensa,0
senhora 86 ano reager assalto matar bandido,1
ser Perguntar ofender ninguém ué,0
tá certo afinal criança fazer sozinho mulher HOMEM,1
medo PSDB perder,0
tt bom JAJDKDKD,0
achar adequado ensinar criança relacionamento,0
enfim artista começar manifestar,0
Golpe Troco hora meliante pegar troco esconder nota carteira atendente,0
Jovem prender moto roubar dia completar 18 ano ir cantar parabéns,0
menina voce ta doido apoiar legalizacao aborto,1
preconceito amiga gorda adorar sair chamar atenção rsrsrsrs,1
Olha cara sofrimento,0
putaria dever investigar polícia,1
indignação denúncia Obama jamais grampear Trump Espionou mundo inteiro querer,0
adorar católico lembrar bíblia Deus ser homofóbico Islão religião,0
video idiota ver vida acreditar achar Islão feminista LOL,1
Vou cozinha finalizar jantar marido filho Feliz dia Mulheres pra,0
DEUS JA MORRER FELIZ DPS ENCONTREI TWITTER bom twitter,0
mulher vida nascer mulher ir sapatão pensar,1
sapatão raitella,1
corresp NY SBT dizer nome Obama falar espionagem CIA ser gov Trum,0
SBT virar jornalista Analice Nicolau dizer Bolsonaro falar merecer estuprar porq,1
ja pensar Angola nao ser possessivo so espaço,0
500 mulher vítima agressão físico hora Brasil apontar Datafolha,1
