mensagem,odio
Votaram PEZAO tomar CZAO,yes
cuidado poupanca pessoal Lembram acontecer epoca Collor ne,no
achar engracado governante nao pensar cortar regalia beneficio desnecessario favorecer sera ne claro ate nao enxergar sao estao la defender proprio interesse empresario casso tambem comecar tomar atitude mudar roubalheira pais tendencia so piorar dinheiro investimento nao aumento salario regalia nao,no
Podiam retirar lucro banco,no
CADE GALVAO PRA NARRAR FALIIIIUUUUUUU FALIIIUUUUUUU FALIIUUUUUUU,no
nao possivel deputado ter tanto cargo comissionar dispor precisar cortar,no
Ser honesto aprovar projeto original ir acabar farra Brasil,no
nao pizza anunciar anistia caixa divulgacao lista Odebrecht,no
ja ver bandido fazer lei anticorrupcao,no
olha cara fazer util interesse publico,no
ai MBL mobilizar pr rua ironio,no
teori seguro bronca stf,no
AVANTE MEDIDAS Brasil clamar pra corrupto Cadeia em ele,no
Haver previsao entrar plenario comeco novembro preciso aprovar projeto lei medida anti corrupcao milhoes assinatura necessario tambem preservar conteudo original projeto,no
baguncado jeito de aqui ha juiz instancia mandar grampear ministro stf ja nao acontecer prova colher fe lei magistratura resquicio monarquia tambem precisar revogar,no
politico jamais aprovar lei prejudicar direto indiretamente PEC desdobro crise Brasil devido dezena centena bilhoe real desviar ano Brasil dinheiro amigo diferenca,no
Limitar ano salario politico mesmo cocega ganhar triplo ganhar nao ter patrimonio luxo ostentar,no
problema sao salario PROBLEMA sao verba eventual desembargador receber justica cego cara pedir vista nao ta enxergar nadaou cego ne STF,no
Judiciario Acreditam indice,no
gerar riqueza nacao trabalhador Politicos funcionario publico nao gerar riqueza utilizar de ela caso Brasil roubar inventar medida nao parar corrupcao pai nao mudar so piorar,no
novinha receber alguem salario de ela aivar mandar cortar,no
Renato voce razao acabar desgoverno passado populista inves ensinar pescar peixe perpetuar custo,no
relevante mulher de ele voluntar,no
Diminua salario tbm presidente Coloque teto salario politico Estabeleca aumento salario acompanhar aumento salario minimo,no
nao esqueca justica tb juiz desembargador etc etc,no
voces sao idiota Voces saber executivo interfira poder salario sao vincular texto constitucional informar nao ser santo pra nao passar vergonha falar nao saber,yes
Falar algum mentira,no
voce falar,no
Resumiu operar,no
ver hipocrisia pessoa so Tentando cortar gasto necessidade basico populacao conceder aumento absurdo classe apoiar golpe Sabemos carne cortar,no
Ricos continuar rico pobre continuar pobre retirar dignidade delesisso,no
Alexandre Acioni estudar pra comunista medida Temer sao mau comunismo voce pobre meter besta ficar repetir mazela igual papagaio repeticao,yes
nao cortar gasto politico,no
saude educacao emprego seguranca nao existir pai lamentavel,no
Pec dinheiro terar sair algum ser impor aumento ja existente problema educacao Saude seguranca corrupcao resolver sobrar dinheiro area,no
isencao imposto igrejaschega bagunca,no
taxar dinheiro doacoe Coitar mendigo,no
Unico corte verdadeiramente carne acabar excesso beneficio diminuir salario politico Ahh claro diminuir quantidade de eles tambem,no
Deveriam nao responder perguntar la PF,no
presidente nao ter coragem propor acabar regalia beneficio deputado senador eu continuar presidente caso ser candidato reeleicao nao ter voto,no
Paulo Bertazzi voce ditadura,no
sr presidente Brasil vir reforma chegar mimimi ir trabalhar,no
pobre metido besta ja ja ficar dinheiro sentir bom tempo,yes
Bons tempo Brasil bom tempo entao lembrar ai nao lembrar nao HAHAHA,no
engracar PAGAR PATO RECHEADO GORDO,no
pra ir kkk pra politico ir politico receber,no
Martin Sales deixar idiot ninguem discordar temer Mortadela so pai pobre meter besta defender,yes
viva lavar jato vir delacoe politico corrupto cana,no
Bernardo Cabas deputado federal ja estao movimentar anistiar caixa existir ate dia hoje So condenacoe de aqui Estao quebrar espinha dorsal lava jato delacao premiar,no
Repatriacao dinheiro parente laranja,no
cortar proprio carne ver so ze povinho ferrar Cortar carne diminuir inchaco maquina publicar diminuir ganho politico,no
carne nao receber salario minimo ja aposentado nao precisar SUS educacao publicar unico carne cortar pobre politico rico serao atinginr,no
reforma tributar mercado divida cortarao carne Juros Divida publicar levar cerca quarenta tres orcamento gasto primario nao chegar PEC nao resolver,no
perfeito Marcio Lembrando politico sao donossocio empresa plano saude escolasfaculdadesuniversidade particular preciso desenhar,no
Brasil crise precisar adotar corte gasto populacao aumento salario juiz edeputar tao simples entender,no
verdade ir compreensivo,no
Rodrigo realmente facil compreender compreender golpe mestre ah ah ah,no
pais rico roubalheira atrave seculo acabar quebrar medida arrochar trabalhador nao enganar nao so partido roubar,no
cortar proprio carne reduzir Deputados Federais Senadores gabinete aa consequente reducao mordomia,no
Temer falar cortar proprio carne entao nao comecar cortar aumento q sancionar ministro deputado ja bom desempenho nao preferir tirar gente q de ele mesmo,no
cara velho asqueroso,yes
populacao tao manipulado so entender lado nao dever nenhum Dever lutar locupletar dinheiro ser partido,no
nao verdade governo milhoes funcionario publico sobrar nao cortar mundo estao cortar carne nao carne verme ja chegar Temer,no
Caro presidente Temer Sr falar cortar proprio carne começar mordomia Srs aposentadoria sr previdencia diferenciar politico item observar nao empacotador mercado esquina nao zombe inteligencia gentileza,no
ir cortar gasto publico ir cortar funcionario confianca indicar politico ir cortar funcionario alto escalao indicar governo concurso publico capacitacao tecnico adequado ir cortar quantidade politico,no
FMI ja afirmar paise incluir potencia economico medida adotar Brasil sao DURAS INFLEXIVEIS Alguem ja ler defender ASSUNTO SERIO MEXER VIDA,no
FMI nao mandar economia mundial vao mer rda,yes
especialista afirmar PEC nao principal razao nao atacar problema real rombo orcamento PAGAMENTO JUROS DIVIDA NAO AUDITADA foge logica pagar juro divida arrecadacao so crescer,no
ESPECIALISTA MENTIR PRA,no
SAO QUASE SO PAGAR JUROS DIVIDA reforma tributar PRINCIPALMENTE REFORMA DIVIDA PUBLICA ninguem mexer ja contrariar poderoso emprestar dinheiro Brasil ligar FMI facil culpa trabalhador programa social nao representar fatia orcamento,no
nao implantar imposto fortuna auditar divida ilogico so aumentar apesar aumento arrecadacao,no
nao existir especialista economia funcionar Aumentar gasto publico exigir sociedade imposto cobrir gasto governo incompetente sao DURAS INFLEXIVEIS nao simplesmente querer aumentar imposto nao dinheiro pra gastar sociedade tambem precisar dinheiro pra estimular economia sociedade nao conseguir pagar imposto entao nao aumentar gasto,no
Marcio Oliveira governo dever acabar privilegio STF congresso camara deputado CNJ ser judiciario principalmente auto escalao governo medida tirar costa trabalhador imoralidade,no
Paulo Henrique nao esquerda nao tratar ideologia partidaria pessoa precisar procurar fonte seguro antagonica assunto logica olhar problema macro,no
alem traira hilariona propr carne KKKKKkkkkkkk,no
unico carne q cortar oferecer JANTARESFILE MIGNON,no
TEMER ABAIXO REDEGLOBODECORRUPCAO,no
CONGELAR SALARIO POLITICOS SAO NEFASTOS NACAO,no
batedor panela piscador luz varanda cara de ele,no
Irao sentir proprio carne estar inferno pagar estao fazer,no
haver presidente gastar bom comecar proprio conta,no
Deviam perguntar carto corporativo gastar milhoes outro governo dever zera cartoe,no
PEC cortar carne politico estao intacta salario de eles aumentar regalia continuar desvio dinheiro tambem continuar lavar jato nao detectar ai Brasil politico farinha saco eleicoe procurar vender voto politico nao voto ficar optativo prejudicar tange eleger comprar voto manipular burro educacao saude direito,no
PAULO VOCE BURRO,yes
VAO BATE PANELASSEUS BURROSBEM FEITO,yes
saude Educacao nao gastar investimento acabar farra publicar dinheiro acabar foro privilegiar regalia punicao grave crime corrupcaoPior cego nao enxergar nao sera saude Brasil,no
ser petralha estar criar bolsa ate virarmos Venezuela,no
cortar proprio carne acabar financiamento partido politico,no
cortarsea proprio carne proprio carne nao de ele,no
Ministros farra dinheiro publico,no
vao dinheiro volta sanguessuga,no
cortar carne regalia politico Brasilia ir sacrificio Temer,no
ate so cortar acer file Mignon continuar nadar bracada,no
so conversa mole golpear nao Temer,no
corta proprio carne povao enganar es goto Televisao,no
Impopular ja Mordomo cortar proprio carne nao nao carne,no
To gasto carto corporativo utilizacao avioe FAB subir cortar carne,no
cortar proprio picanha churrasco domingo faltar churrasqueiro,no
nao reduzir salario milionario classe politico nao nao criar lei politico arquar despesa nao acabar foro privilegiar parlamentar nao criar mecanismo pra colocar corrupto cadeia devolvir roubar,no
concordar PEC ver reportagem hoje G farra ministro Aviao FAB fiquei revoltadoEsse pai nao conserto nao,no
farra ministro POLITICOS gente governo Aviao FAB pagar conta corte carne nao existir viajar Aviao carreira ai acreditar,no
ahhh cortar proprio carne Vou ficar medo entao cortar carne,no
assumir so Falafalamas Resolucao,no
sr presidente Brasil vir reforma chegar mimimi ir trabalhar,no
aumento amiguinho ferro,no
precisar reduzir custo Brasilia Reducao privilegiosreducao numero deputado senadoresreduzir numero instancia recursal judiciario,no
nao ver corte algum DEIXAR GASTAR nao cortar,no
inves tirar populacao pobre tambem nao criar imposto fortuna exonerar cargo partariar comissao corte salario regalia deputado senador secretario presidente Republica diminua salario auto magistrado ai comeco acreditar governo Brasil bom,no
filme novela culpa mordomo,no
Temer expliquar sentir proprio carne ja nao vao cortar verba,no
Ahahahahaha voce deverar trabalhar dobro triplo nao,no
senado pagarar R reforma gabinete Romero Juca PMDBRR,no
lembrar Marcos Alves PEC importante tao sonhado reforma politico ja participar,no
dinheiro mao precisar suprir necessidade ser casa empresa municipio pai unico aonde economizar cortar pra nao negocio afundar restante sao julgador nao saber acontecer,no
discordo parte inves tirar populacao pobre tambem nao criar imposto fortuna exonerar cargo partariar comissao corte salario regalia deputado senador secretario presidente Republica diminua salario auto magistrado ai comeco acreditar governo Brasil bom,no
voce ver ja ser cobrar imposto pessoa aplicar dinheiro paise cortar salario aumentar impor ai nao resolver problema agravar cortar gasto desnecessario valer,no
governo nao carne carne estao cortar ver deservico publico,no
cortar proprio carne Ministros ter burlar regra FAB voo,no
Brasil amanha dizer porem Amanha falar recuperacao pai longo prazo ano ate la governo ai Brasil ja nao estar afundado vezVai ver,no
melhor comecar cortar despesa de ele nao haver ate entao nenhum presidente gastar tantocomece cortar proprio carne,no
cortar carne Pq auto salario mordomia nao entrar limite pec maldadefora temer,no
engracado meter mao dinheiro populacao querer ajudar empresa privado OI dinheiro publico jeito esperar outro meteoro reset novamente,no
cortar propria Carne churrasco planalto chamar unico Carne cortar mamata de eles,no
hahahahahahahahaa hahahahahaha piada cara,no
reforma urgente proximo previdencia PEC fichinha,no
cortar proprio carne aumentar gasto propaganda ta,no
hUAHUAHUAHUAHUAHUA PIADA pRESIDENTE,no
so acabar farra cartoe corporativo,no
Gastando MILHOES carto corporativo Hipocrita,no
gerar impopularidade eleitor parlamentar,no
QUera pq pagar erro politico Pq nao cortar proprio salario verba gabinete mandar Monte auxiliar parlamentar so servira sugar dinheiro publico Acabem roubalheira q Brasil avanca,no
pais sair crise economico sair alto investimento educacao tecnologia Ja Brasil receita contrario resultado ja saber volta Republica Banana classe media voltar pobreza pobreza voltar semiescravidao,no
politico ai Brasilia praticamente nenhum ficha limpo sao grande ladroes Brasil,no
acabar mordomia comunista vao trabalhar corrupto,no
crescimento,no
claro nao Votacao G ai PEC verdinho vermelho ir realmente impopular,no
lista cinquenta item tivessemos Governo diferente Governantes so pensar enriquecimento proprio,no
PEOCUPEMOS PAIS SUJOOS OUTROSPROBLEMA DELESIGNORANTES,no
carne carapaler,no
vario aposentadoria sentir corte kkkkkkkkkkkk,no
finalmente chegar hora trabalhar pra coisa pai Ja sentir trouxa trabalhar pra comprar coisa,no
preparemse corte concurso publico poderao colocar apadrinhado alto salario concurso verba saude educacao seguranca publicar aguardar aumento assalto reduzir gasto bastar corte alto salario cargo comissionar concurso beneficio gestor,no
carne Aumento vario categoria servidor servis dao suporte ser fazer unico sentir impacto real incrivel pareca tao alienado parcela loucura,no
tonto acreditar palhacar cortar pobre necessitar saude educacao governo pra aprovar terceirizacao mes vao aprovar caixa Delacoes Odebrecht poder realizar nao punir imundo,no
nao golpe Dilmae bonito trabalhador colocar la novamente,no
NOCAOSEM ARGUMENTO ADESTRADOJOGA CULPA,no
Antonio Oliveira VENEZUELA GASOLINA VALE CENTAVOS DOLAR POTENCIA,no
nao reconhecar governo ilegitimo golpista Temer companhia,no
ninguem importar vc mae,yes
palestra analfabeto quantas proferir apo Lava Jato,no
presidente vir reforma ir trabalhar chegar mimimi,no
Povao governo cortar direito previdenciario cortar gasto educacao saude manter privilegio poderoso nao poder aceitar ir protestar ir Lulo Lulala,no
so vejo comunista PEC resto q vejo sao,no
enfim iniciativa vista futuro nao so proximo eleicao,no
Heranca governo anterior,no
falar heranca sao ano PEC haver heranca pra deixar,no
vOCE BRINCALHAO,no
Parabens Pres tomar mediar duro culpa PTe,no
lascar miquinho amestrar,yes
IDIOTA,yes
pro tanque Sras Sonia,yes
Sonia cartao corporativo presidente ja bater casa R Milhoes,no
ja ouvir algum dia falar antena nao longo alcance nao ne rsrs,no
perfeita explicacao fisica Antonio Souza achar OC OT ninguem transmitir ne,no
famoso transglobe Philcoso servir pra ouvir radio Paraguai,no
FM loge nao chegar Acabar radio interior despovoar meta,no
Leier noticia tristeza transmissao AM unico possibilidade ouvir radio lugar longinquo Brasilsao transmissao FM limitar alcance devido frequencia radio transmissao modalidade sao autorizar legal nao precisar Sr presidente trabalho contrario dever estimular radio transmissao AM local populacoe necessitar acesso transmissoes Radio ate inclusao social inclusao Nacional pena,no
radio sao controlar politico so precisar presidente certo pra ganhar presente muito gente xiar AM alcance,no
nao entender existir transmissao radio AM aindaem cidade pequeno local afastar capital fm nao chegar chiadosa AM chegar ruim cheganos cantoe Brasilzao so AM chegar muito palha aco anteninhasagora ficar entretenimentopoisr tv analogico luxo tv digital sera utopiaagor AMserao isolar ate informacoestudo querer,no
mundo morar cidade Acorda,no
Brasil milhoes km propagacao FM nao passar km,no
Deixa pra la Esquece dificil compreender basico basico Bjs Tata,no
Infelizmentehoje dia melhor arruaceiro agitador Brasil trabalhador honesto,no
lista contir politico Lamentavel,no
imoralidade ate trabalhador vao sustentar parasita,no
FARRA BOI PEDINDO ANISTIASABE NE RIR,no
familia soldado civl morto bomba terrorista so receber xingamento pai so defender premio bandido,no
cara botar preco ideal nao idealistaE mercenario,no
anistia governo militar deixar Brasil mau,no
noticiar nao interessar globo,no
Torra absurdo politico militar judiciario problema velhinho pegar salario minimo,no
problema cara tirar dinheiro previdencia trabalhador iniciativa privado pagar beneficio servidor publico civilmilitar,no
senado instituicoe cara inutel pai votar corte gasto de ele naoBando ladravaz erario,no
PRAS RUAS MOSTRAR NAO ACEITAREMOS,no
pec comecar semana pai,no
Usar calculo diferencial integral voce ano contribuicao comecar ano hoje ano reforma cair pedagio ate faltar ano voce trabalhe anor ter ano cair reforma completo,no
Preparem PEC aprovar Brasil sera Etiopia,no
grana pra salvar oi sair,no
setor eletrico ninguem investigar,no
demente total,yes
acabar rotulo esquerda politico corrupto partido Vemos clareza partido defender interesse elite povao PMDB PSDB nao sao partido sao quadrilha organizar,no
esquerda ai nao condicoe linderberg gleisi Fatima Bezzeratotalmente insano,no
Joao Pereira anencefalo comentario enojar,yes
Olha em isso concordar Joao bom pagar SM estudante presidiario,no
pai podreque nojo,no
nao entender colocacao podre pai nao pai,no
nao entender Edsonda explicar duvida bom,no
outro Bertin lexotankkkVixemas vc mortadela filho,no
Resultado ano patria educadora Educando ladroes corrupto,no
engracado voce disputar emprego voce perder,no
votar quisermos voto livre vc nao gostar problema,no
nao frase so nascer Brasil so colonizar,no
Sr Sergio morar criar comissao magistrado corajoso p apurar crime medo,no
Desisto pai,no
modelo Enem enganar pensar entrar faculdadeentra pouco resto fraude,no
reclamar so ha corrupcao Brasil,no
Luiz vc nao ser tirar nota ficar mimi entrar atrave ENEM to estudar conspiracao kk,no
ocupacao escola sair pra ENEM esperto,no
fraude tanto fraudar ninguem saberar Alias pai historicamente ja fraude,no
corrupcao corrupcao area Brasil acontecer corrupto,no
vontade aipim rbbbbbbb,yes
Cade Sergio morar sobremesa,no
engracado fraude comecar nonpoder Brasilia,no
diga acao publicar nao fraude pai desconfianca tao ficor querer pessoa forro privilegiar traz esquema,no
esquerda mentir sera bom Brasil nao vao eleger ninguem,no
Edmond julgar comentario vc verdade projeto lei tratar reforma previdencia barrar oposicao epoca acaso golpe destino hoje governo,no
esperarnao adiantar perguntareles nao vao falar Milhoes Srra,no
cite amigo esquerdopatar LINHA DEFENDO SEJA SO,no
defendar imperio lei note grifo paguar fazer nao tolero hipocrisia mentira descabir esquerda incluor PSDB eu esquerda enter intolerante esquerda lha defender bandido estimacao atacar sao pequeno causa Hipocrisia nao,no
Brasil nao PEC maligno draconiano ser,no
Entendam causa principal acontecer politica reflexo negativo economia obra populismo ano desgovernanca so ter plano governo perpetuar custo,no
Derrotar urna Gostaria,no
DERROTADA Urnas urna ahahahh ate ganhar perder pra Votonulo ahahahh,no
nao derrotar urna VARRIDOS saber hehehehe,no
exercicio logica elementar PSDB ganhar cidade vencedor eleicoe supostamenteb perder voto nulo imaginar vermelho kkkkkk VARRIDOS SP entaoPrimeiro turno passeio,no
rir cara desconto aposentadoria troco apoiar golpista ahahahah,no
ladrao,no
to dizer globo Sergio moro boca urnaeles estao apagar mensagem,no
Nilsa Amaral TEMER MOE PROLONGADA ANOS,no
Mauro dementekkkkkkquem ta lutar sao voce apoiar bandido,yes
felizmente extirpamo projeTo defoder clePTorruPTo,yes
tao AMEACADORES clePTorruPTo verdadeiro corsa veadinho mansinho so mimimi,no
MESMOS NAO BASTOU AFUNDAREM BRASIL,no
Qualificou investir pesar PF achar unico CulpadoSP ta policial civil PM paulista achar kkkkkkkkkkkkk,no
economia casa empresa diferente economia pai empresa cortar gasto facilmente governo cortar gasto gerar desemprego queda economia John Maynad Keynes defender gasto responsabilidade cortar gasto educacao saude nao,no
torcer pior bom,no
estar la nao fazer alem distribuir dinheiro disfarcar bolsa familia coisa sentido Educacao Otima Saude Otimo ja bom distribuir dinheiro,no
vencedor urna voto branco nulo recado dar partido ver coxinhar,no
Aceita boquinha acabar doir Vermelho so ketchup,no
politico pecar possivel informar bom politico kkkkk,no
alvaro arma voto problema nao instrucao nao estudar historia Brasil,no
nao importar partido bandidagem sistemico ficar discutir pardidarismo comporativismo combate corrupcao sera velar Forro privilegiar pai alto nivel corrupcao afronta etica moral,no
assinatura laranja resto nao assinar,no
Russia montar base Venezuela problema passar,no
hora nao conseguir resposta claro nao existir,no
hora responder nao achar claro nao existir ditadura eficiente,no
MELHOR DITADURA MILITAR DITADURA ESQUERDA,no
kkkkk so ze mane ta guerra frio ate hoje,no
historia ensinar precaver futuro prova Venezuela estao fazer vitima impor ideologia genocido,no
apos hora nao conseguir encontrar sequer ditadura paises desenvolvir sera,no
realmente Brasil mudar situacao nao sair mar lama,no
Marcos Brasil nao haver ditadura militar haver governo militar vario medida reerguer pai citar criacao fgtsembrafilme embraer bnh hidreletrico eleicoe direto governador deputado Ta pra voce,no
China possuir ditadura grande economia mundo Marcos,no
Brasil tambem grande economia mundo desenvolver,no
enfiar kit cut,yes
globo sergio moro fazer boca urna em esse eleicoe,no
voce achar alguem votar PEC jogar Brasil Nigeria,no
dl bom Nigeria venezeruela,no
teucuquente porem continuar dar adoidar,yes
OPOSICAO conseguir atrair se proximo odio eleitor,no
Murilo terminar faxina limpar pai esquerda lha Urgente,no
Sao agitador so saber ha saber tambem roubar,no
Concordo plenamente so saber governar dar dar,no
oposicao governo governar aELITE,no
marco achar politica ferramenta transformacao quato engano,no
partido chamado P T P Sol sao doenca pra nacao enfermo,no
coisa gentinha estao feder mortadela podre nao tomar banho,yes
nao ai pro Brasil so,no
acabar forro privilegiar dai ministro STF livrar cara,no
esquerda seguir passo largo rumo quase extincao Continuem,no
PESQUISE PAICIPE Consulta Publica PEC,no
ESTAMOS PEINHOS MILHAO PAICIPANTES ACORDA BRASIL,no
Continuam espalhar mesmo mentira,no
Voltaram so senpre fizerem Sao defensor lamentavel,no
quebrar pai tentar boicotar trabalhar,no
BOICOTARAM governo eleger ano SAO GOLPISTAS nao oposicao ahahahh fazme rir,no
PESQUISE PAICIPE Consulta Publica PEC,no
ESTAMOS PEINHOS MILHAO PAICIPANTES ACORDA BRASIL,no
Esperem proxima eleicoe vao chegar,no
Rodrigo nao Bagunce ideia,no
ir lutar direito conquistar tanto luta,no
TA animadinho rapaz APOSENTADORIA DESCONTADA VOVO TAMBEM AHAHAHAH,no
corrupta terrorista apresentar ameaca honesto Uruguaio,yes
mulher destruir Petrobras destruir economia enriquecer custa,no
esquerda uruguaia nao roubar mojica ta fusca,no
ver possibilidade asilo politico ja receber ordem prisao,no
nao ter pensar em isso hipotese plausivel,no
verificar possibilidade asilo Lu,no
asilo pra nao ai excompanheiro palanque,no
nao tupamaro ja tirar aki nao,no
anta incompetenta soltar,yes
ta soltar ja invadir fortaleza de aqui novelina sair ar,no
mortadela ja beber cachaca q nao falar,yes
Temer ta pra caramba ne Trouxinha,yes
fafa de aquele aluno ser zuado escola pagar revoltadinho Internet,no
Pentateuto nome estranho acreditar capacidade discernir resgatar,no
pena linha reportagem dever pular,no
so nao nao perfeito esquecor rs,no
mao de ela foto acaso baseado,no
nao ir desrespeitar Fidel fumar charuto Uruguai,no
Uruguaios conversa de ela acabar falir tambem,no
ganhar Oreo Tabare milenar ritual esquerdista oferecer vento,no
pena existir vermelho espalhar pai mundo,no
dedo Socado mae kkkkkk,yes
dificil ha ano ceu ta zona,yes
ficar semana la Uruguai entrar recessao,yes
ja estar ter cuidado peso pesar real de ela,no
NAO ESTAO NAO SENAO RECRUTARIAM MAE VERME,yes
To sentido defensor bandido,no
ES CRO TO DESSES VERME,yes
QSF,yes
defenestrar nao aceitar insulto,no
Lamentavel garantar voto Luiz Inacio Messias Silva,no
nao voltar la Damos presente pro uruguaio,no
Brasil ta quebrado temer emprestar bilhoe FMI,no
doar bilhoe U vizinhanca colher dividendo,no
Estao perdidinhos anotar placa caminhao atropelar petebada outubro,no
recebir capim agua fresco,yes
Aproveita deixar capivara ai,yes
ficar la ANTA,yes
Uruguai ira receber escoria Brasil,no
aqu nao carne pescoco gostar so picanha parrilla,no
comunista fazer ato democracia Democracia vermelho,no
nao veia ta segurar cigarrinho maconha,no
NAO MACONHA CANABIS SEJA ELEGANTE CAITE,no
batata de ela ta assar ja fazer plano fuga,no
estar exportar mortadela ficar graca,no
nao forca senso ridiculo,no
ja comento sera comentario sao censurar,no
robozinho ficar buscar q nao pra censurar q precisar nao eliminar,no
visita Tabare Vasquez nao ganhar eleicao sindico predio,no
ficar ai Janete traste inutil Destruiu Brasil vaco,yes
Tabare Vazquez vc dever escolher melhor amizade,no
nao levantar suspeita pedir exilio dono triplex,no
lindo incompetente cair igual Jaca maduro,no
reuniao ex guerrilheiro la fazer,no
temer bom ta ter ne pai potencia mundo ne,no
cuidar bandida nao vendar infirmacoes sensivel Brasil,yes
motivo pra fugir sao aparecer constantemente lista lava jato,no
baitola mao ir Murro certeiro cara feio porrrra,yes
ta louco Davi To afim mao nao,no
dali pro Panama acabar esconder butim,no
ato uruguaio presenca de ela importante preco banana Monaco,no
PETRALHAS ESTAO ARRUMANDO ESCONDERIJO,no
Ajudou afundar pai nao vergonha cara achar normal,no
La receber Tabare receber Tabareus,no
erro entregar ponta terra extremo sul Brasil,no
cruz credo bosta,yes
Tabarez digame anda dir es,no
ato democracia ta enganar gostar,no
nao morrer desgraca,yes
dai formacao quadrilha defesa democracia so riso,no
ta fazer cama Moluscovai,yes
Muie drome cuie brincar fiuvicoCuidar,no
roubar bom passear,no
ficar receber presidente Uruguai padrao,no
terrorista nao preso roubar atrasar pai morra demonio,yes
falar verdade nao publicar falar liberdade expressao,no
Olha ai Sergio morar dar vacilo kkk pegar pow,no
putskkkkkde relevancia importanciakkkkkkk,no
provavelmente planejar rota fuga pai vizinho,no
morrer desgracado,yes
Sera discursar la falar espanhol sotaque,no
Tabare tipico bolivariano light existir,no
Saida tangente tambem comprar casa,no
