mensagem,odio
NOIZINHAS MENGAO URUBU chamar NKU jogo ano BOFES time dever levar NKU deixar NKU dever SRNSomos Rabudas Negao dcm DIAMETRO CRFCheirinho R Fedida,yes
umo povinho idota,no
ficar piroka metade ja ta docusso mae,yes
issoO Palmerda bi rebaixado continuar mundial Kkkkkkkkkkkkkkkkkkkkkkkkkkkkk,yes
Cabra frouxo,no
Arregao,no
Faltar opcao virar homem,no
procurar pra mamar Freddie Mercury bom rubroneca,yes
Velho babao falar asneira pagina,yes
Sonha boneca,yes
aa tricolete estao descontrolado,yes
RUBRONECAS,yes
retocar maquiagem tricolete frufru nao comer ninguem comer,yes
IDOLO FUDINENSE SERIE B ENTRAR JUSTICAO PRA NAO CAIR,yes
rosquinha tricolete estao arder causa Conca,yes
Dorzinha cotovelo Florzinha einMimimimi,yes
Florzinhas ficar chateado KKKKKKKKKKKKKKKKKKKKKKKK,yes
mulambos subornador paguem Serie B,yes
Meigos sao cheiroso nao Fedem Urubu,yes
Abel brucututreinar time Bonequinhasnao certo,yes
Paulo cid matar barato assinar contrato mes ja receber salario integral vc achar china fra ficar receber nao acreditar diretoria falar inocente,no
diretoria transparente nao mente igual voce nao q flamengo falar concreto fato credibilidade,no
so querer po arroz maquiagem ha esqueca paguem serie b,no
empresa concorrente oferecer super contrato trabalho voce trocar empresa quanta gente hipocrito torcida fluminense aff,no
so ve historia voce to vida ganhar ganhar quase milhoes mes durante ano culpa Fluminense pq nao sinceramente jogar ate graca obrigacao de ele bom retribuir vida ganhar graca Fluminense ja ganhar chamar ganancia mercenario nao idolo,no
KKKKKKKK CARAS DESSES JOGAR FUDINENSE,yes
Bbcas serie c vcs nao saben Separar quanto trocar epoca doval troca Fla x flu Vasco x botar Jogadores marcar epoca historia vcs sao eterno serie c,no
calcinha mae ja tirar facilidade perguntar pra,yes
contribuir gente levante taca ta flamengo so pagar comecar jogar,no
Maycon ate admitar negocio si Fla atualmente nao acreditar coisa va jogar Fla levante algum tacar ano kkkkk,no
Rafael finalista Libertadores ano passado de ele titular selecao Equatoriana outro futuro camisa selecao ja sondar clube Europa certo Conquinha ano bichado kkkkkkkk,no
estao melar calcinha tricoflorzinhas,yes
Comparacao nexo Tyson passar auge pra chegar sabesr motivo Tyson mito infelizmente perder carreira,no
nao entendi comparacao Tyson pra ambito psicologico,no
dizer ronda pegar adversaria verdade qdo pegar alguem bater forte afinar viver correr Ciborg pq saber ir perder medo apanhar parar lucrar,no
nao parar lucrar perder ultima total pagar so pra,no
Imperador balela Entao nao sao adversario verdade disser Anderson Silva pegar oponente Verdae pegar wrestling perder,no
so colocar pra safra ai q surra mau luta nao passar round colocar Semiaposentados pra ter algum chance,no
categoria so TJ chance consideravel Cruz tambem entanto apostar Cody Ja Aldo nao favorito Aldo usar jab low kicks fazer luta estrategico,no
historia cara moleque subir octagon pra receber cinturao louco cara ate sangue olho pra ajudar moleque nao,no
nao afoito nao Cruz paciente atraindoo trocacao franca So dar blitz adversario anterior ter confianca nao motivo botar dormir,no
vich evento ta cair luta card principal ta hora Dana comecar substituto pra d situacao q q ja deixar inusitar,no
Cruz so agilidade nocaute Cody vir preparado levar,no
caro amigo enigmaticosNao dever comparalo Tyson Tyson mito boxe deixar desejar pessoal entao nao pessoal profissional cara nao completo Chequei raciocinio assistir Faustao,no
chamar pra Atras escola sentar garoto kkkk,yes
Jhalim Rabei ate fiquei assustar começar ler comentario pensar Connorlevava menino tra escola dar bunda KKKKKKK,no
Irmao Honorato falar verdade agir razao inves emocao diferente tupims amer lindo,no
