mensagem,odio
NAO SABIA URUGUAI GOSTAVA PORCARIA JUNTO,no
graca idiota Levandowhisky,yes
Querer ir pro Paraguai tomar outro calote kkkkkkkkkkkk,no
vagabunda,yes
Vao sentir dentadura pao mortadela,no
Bruno nao Kou assimVar tomar Gu,yes
ja programa hoje,yes
Vira ai ir dedo,yes
pensar MOADELA maconheira chato,yes
vc assister bolsa Esmola,no
Vc algum retardo burrice Maria,yes
Maria Benta provar peba pimenta Malaquias,yes
Maria lavar louca voce ganhar,yes
Toma vergonha cara boiola maconheiro infectar,yes
cara chupar piroca,yes
quanto gente raivoso horror,no
entao va la aproveitar case homem la,no
Ganhou pq nordestino nao votar,yes
OBSERVO ESTAO COMPARECENDO DESCONTENTES GOLPE,no
entrar voto Saiu voto Cade golpe so afirmacao ne,no
Vinicius Moraes chamar Naldo Eh adequado kkkkkk,no
Marcio nao irmao nao nao irmao baitola,yes
so numero dislike coment inutil nao moral assimPalhaco,yes
Quena Tirso sentir muito charuto mertadela tadinho aceitar doi,yes
aonde vaca boi atrasTa apaixonar,yes
Tirso gente comer boca voce comer tra,yes
Carambaachei ja ter morrer Tirso Tambem,no
Democracia fazer venezuela petebas querer arrumar emprego,no
Roubalheira entao governo oriundo roubalheira ladrao tambem Eleicoes ja,no
leveza paralelepipedo honestidade DEDOS,no
Sera MAV conseguir ler falar paralelepipedo,no
total condicao opiniao liberdade expressao valer enfim,no
Rosanabandida esquerdista fedorentar,yes
Osvaldo Miranda nao concordar respeito comentario,no
rosano revolta devido mortadela,no
nao ofensa curiosidade estudo animal,no
golpe de ela Rosana pra reileita chamar bolsao familio,no
escarnio acreditar em ele ate falar beleza elegancia,no
pseudonimo SURREAL bidu,no
aha ta ir acreditar mentirinha nao acreditar nao,no
Collor nao digno limpar sapato DIVA,no
coitadinha pobrezinha Vitima golpe levar pra casa,no
alvo Nacional nao municipalaonde DOBRARAO,no
DESFILARA ELEGANCIA BELEZAPELAS RUAS AVENIDAS BRASILNAO pREOCUPEMr,no
ai gostar charuto mortadela perna,yes
Ilegitimo vc votar Temer votei Aecio colocar presidento vc,no
Joao Claudio lamento resposta nao publicar,no
Sr Temer pôr la vcs votar em ela,no
estrategia VERMELGA ACEFALA terceirizar culpa xingar denegrirKKKK TCHAU QUERIDOS,yes
nao Hospitais estao super lotar equipamento,no
Coitar minimo definila chamar PODRE,yes
burro,yes
nao tiro real orcamento pra destinar presidio hospital,no
area juridico Hospitais sao alcada Ministerio Saude simples,no
PRESIDIOS ESTAO OTIMOS PROBLEMA SAO ESCOLAS HOSPITAIS,no
hospedar politico Rubens,no
revolta Anderson familia presa,no
Mortadelas entender nadaKKK,yes
Roberto inteligente mafioso Skaf perguntar pagar pato,no
negativar sao presidiario Lucasestao equipar presidio,no
Bandido peidar pra Muzenga Resolvam problema superlotacao fazer Carandiru dia Simples,yes
Galera PSOL comunista apertar vermelho,no
policia civil RJ nao privado pra kaggar capivara ta preocupado bandido,yes
Carmen Capivara Lucia levar meia duzir de esse vitima sociedade pra casa faca coquete em ele liberir anel couro refresco groselha mostrar coracao,yes
ate enfim comentario prestar censor Grobo cochilar,no
Bandido defender bandido Estranho papo,no
conforto ate sofrimento familia destruir,no
so ha justico pobre pai rico ficar impune,no
interessante visitar hospital sus,no
concluir ato concordouai nao estupro kkkkkkkkkkkkkkkk,no
presidiar pro sujeito pagar pecado nao ficar resort feria,no
vitimas de esse bandido ninguem visitar ne ja matar,no
poder visitar tambem escola crianca estudar pe lama goteira muitas merenda estragar ate merenda ter andar quilometro pe caminhoes gostar gente ligar direito humano ter decencia nao gostar visitar presidio defender pobre vitima sociedade crianca pes descalco nao sao vitima sociedade porco,no
sera visita HOSPITAIS PUBLICO DF,no
dever haver lei obrigar politico so hospital publicose hospital particular ser proibir atendelo so olhar situacao saude publicar VACALHACAO,no
Deveria preocupado acelerar julgamento beneficiar trabalhador inves preocupar bandido,no
nao visitar familia vitima de esse criminoso,no
parente matar,no
Santa hipocrisia Batman mandar visitar hospital publico estao superlotado,no
Parabens Dra Carmen Sra la diferente existir saber sao marginal nao poder igualar,no
nao ficar cela superlotar nao roubar Trabalhe honestamente garantar nao problema,no
conhecimento leiatodo sao igual julgar condenar exceto militar,no
entao ministra motivo instalar pena morte,no
visitar instalacoe Conde Dracula vampiros,no
sera ministra Carmen Lucia presidente Supremo Tribunal Federal procurar vaga politico ladroes Bandidooooooooooooooos presidio visitar kkkkkkkkkkkkkkkkkkkkkkkkkkkkkkkkkkkkkkkkkkkkkkkk,no
ministra trabalhar km hospital BASE HRAN sera pretender visitar,no
admirar Bela atitude,no
precisavamo presidente,no
peco ajudar universitario ajudar interpretar zozoi querer,no
dever levar Renan Calheiros junto ficar la,no
excelentissimo ministra nao visitar familia vitima,no
deixar ignorante precisar mudanca prender nao Vitima,no
colocar pena morte ai diminuir,no
Sera haver faxina visita Ministra,no
nao reunir parente vitima,no
Trabalhar ninguem senao estar vazio,no
Gosto delaNo STF unico entender escutar,no
CEMINTERIO LOTADO CHEIO INOCENTES MOOS MAOS DESSES VERMES,no
virar Ministra Seguranca nao pra STF,no
visitar ESCOLAS HOSPITAIS,no
nao vejor visitar hospital crianca idoso trabalhador linha fino,no
ir quantas Maes filho assassinar assaltante Ministra visitar,no
Ave Dra Carmen Lucia estao prestes morrer saudam,no
poder estao preocupado bandido cidadao onesto renegar,no
Daqui pra frente piorar nao haver emprego aumentar furto roubo,no
aproveitar ai ja implantar pena morte lixo Bndido bndido mrto,no
visita familiar vitimar escoria sera louvavel,no
pena so vitima de eles comportar nao prender,no
visitar hospital tumulo vitima de esse marginal,no
superfaturamento tv algum Senador Deputado colocar bolso,no
duvido ministra pecar reducao salario tre real,no
culpa ter lei severo estar vazio,no
ter tirar auxilio familia mandar familia trabalhar sustentar,no
presidio superlotado F D fila hospital creche busca emprego,no
pra eu ta vazio ministra cuidar politico safar proteger,no
indulto dar juiz levar preso casa,no
Deveria julgar acoe envolver Jose Serra milhoes ninguem falar Cade,no
querer aparecer Moro gerar ciumeiro,no
eta Dra Carmem Lucia senhora sair marqueteira,no
depender STF Manda soltar mundoE aposentadoria,no
Deverer aplicar etica Aristoteles prisional justo medida,no
presidio lotar milhoes querer entrar em ele paradoxo,no
MULHER,no
receber premio agrado globo ta achar,no
mandar matar esvaziar cela virar heroina nacional,no
Gilmar MendesPSDB ficar ciumesEla querer aparecer,no
Unico comprar ena Brasil sao pobre bando hipocrita hipocrito hipocrito,no
corja golpe so falar merda,yes
excelente iniciativa Ministra Presidente Carmen Lucia Parabens,no
velho dever passear agir ate so conversa,no
Saulo eu preso estao la sao perigoso Brasil,no
Neimar esquerda Gabriel Jesus Marinho ataque,no
Marinho kkkkkkk so jogar ja merecer selecao,no
paulinhaFernandinha campo Messi deitar,no
pra nao hotel Ana Hickimann,no
Brasil vencer jogo dificil,no
x minino mano Bauza vim retranca,no
senado gastar decoracao gabinete,no
TITE NAO TOCAR MESSI DEITAR PAULINHOBRASIL X,no
Gastar reforma gabinete romero Juca sacanagem,no
Neymar gol agradar Messy,no
RLX neymar ja ta treinar barca so chegar vesti uniiforme,no
PALMEIRAS CAMPEAO MIMIMI MUNDIAL,no
Carlinhos Brown ta fazer aivai cantar babaquice de ele,no
neymar fazer algum selecao ausencia bom,no
pergunta ridicula globo jogo,no
Felipe massa ja aposentar sera selecao,no
Bauza retranqueiro botar pra cacar neymar tirar print,no
Marinho jogador desequilibrar jogo,no
Tomara Argentina Goleie fresco,no
Sao Paulo ja rebaixar,no
VAMOS MASSA ATLETICANA LOTAR MINEIRAO APOIAR ARGENTINA LUCAS PRATTO,no
VAMOS MASSA ATLETICANA LOTAR MINEIRAO PRATTO,no
Pratto ai Messi deitar rolar selecao falido,no
so pipoca apertar,no
pipoca excelente zagueiro nao culpa de ele,no
ir voltar ano atra x,no
Corinthians bom aluno enem enemlibertador Enempaulista enembrasileirao enemcopa Brasil,no
virar goleiro,no
nascer jamais sera Junior Baiano,no
Ta jogar selecao nao chance Thiago Silva marquinho Miranda sao bom,no
Jogar PSG decrescimo carreira,no
davi luiz dar certo comar camisa chelsea psg nao pra,no
compensacao levar,no
globo iniciar lobby retorno Selecao,no
David Luiz goleiro pra recorde pessoal vazar,no
tomar jogo so cara ruim,no
possuir outro recorde tomar gol jogo,no
Cahill pesadelo Emerson Sheik Paolo Guerrero,no
so igualar record pessoal ficar jogo levar gol,no
Joga,no
fan torcedor CR Real Madrid sao piada Raca nojentar,no
Melhor mundo,no
Apelar nao comparar jogar Facil,no
Melhor mundo Messi aceitar fato ronaldete,no
modinha rivalidade sao excelente jogador pronto,no
Daniel Lima nao rivalidade verdadeMessi acima futebol atual,no
kkkkkkkkkkkkkkkkkkkkkkkkkk Pepe tbm ganhar CR man,no
moral louco CR bom Messi velho,no
mano Messi ja eleger bom outro time seguir criterio Pele George Best Maldini Iniesta Garrincha sao BOSTAS citar time algunsMaldini Iniesta chegar jogar clube Pele jogar ano Santos ninguem dizer,no
mano boaAngelim voltar pro video game rapaz cara falar Messi ja eleger bom outro time acaso Pele considerar melhor outro Cosmos ja carreira nao existir provar outro clube seguir logica Iniesta bosta voce,no
Isaque nao faca tonto chorer Lionete,no
mano saber Ronaldete nao argumento,no
mano mesmoManona boano manoManooooooooo,no
CR ja ganhar Copa America nao Julio Baptista kkkkk to so pra zuar kkkk,no
so pergunta Real Madri Barcelona estrangeiro,no
Ser clube afinal jogador nacional fazer historia,no
so corrigir Europa estrangeiro,no
Rio Sao Paulo Rio Sul Minas Gerais,no
pele bom q cara,no
kkkkkkkkkkkk tulio nao contar ate golzinho asfalto,no
pra chegar artilheiro genio area Romario,no
videogame igual fas alienar de ele kkkkkkkkkkkkkk,no
cara for,no
Palmeiras continuar mundial,no
discurso Cristiano declarar secar NETO,no
so oculo de ele pra comprar apartamento,no
time contratar Marcelo Cirino ano damiaor ano,no
gol jogo oficial media Melhor mundo,no
ganhar premio FIFA bom temporada,no
Ficar monte mocinha brigar Messi CR Virem homem,no
pedir dica pro Ze pder jogar ate,no
ROMARIOgtRONALDOgtZIDANEgtMESSIgtRONALDINHOgtCR,no
Vao renovar contrato Sergio Ramos ate tbm,no
Messi Cristiano vao dormir hoje preocupar vcs achar de ele Tontos,no
ja nao ta jogar hj diaimagina,no
nao ta jogar hoje imaginar ta nivel alecgol,no
LINDINHO MOCO OCULOS,no
Sera ter tambem ano propaganda Clear men kkkkk,no
sair armario mesmo velocidade baixar qualidade futebol,no
contrato ano clube sao louco ano maximo,no
Real Madrid ta doido cara empurrar bola trave conseguir,no
temporada RALA titulo kkkkkkkkkk Messi ano Barca titulo,no
titulo ser Trofeus Joan Gamper amistoso Bela Galeria,no
mano Ivo Holanda sao titulo Joan Gamper,no
mano Valdeny coisa nao funcionar mundinho nao,no
nao nenhum penaltizinho pro inutil Penaldo bater ahhh poxa juizao,no
mano quase hattrick Solange So faltar penaltis,no
Atras so Robinho Fred Campeoes copa Brasil,no
jogador Daria reserva Fernandinho Fla,no
entao ir somar assistencia ganhaOs sao otimo Messi bom,no
de aqui falar titulo selecao,no
nao bom jogar facil,no
piada super engracado Ja pensar teste pro Zorra Total,no
Concordo,no
jogador jogar oq Marcelinho Carioca jogar poderoso timao chorar antl,no
mulher pia fogao cama,yes
CR ganhar Messi nao ganhar Choremmmmmmmmmmmmmmmmmmmmmmmmmmmm,no
voce falar mano voce chutar bola ENTENDE FUTEBOL CRFOREVER,no
Geraldo Gallo ir protestar Amigo ir invadir CT quebrar,no
Marias tremer pro Galo borrar pro argentino FATO,no
PARE VEXAME GENTE DEIXA CARA,no
saudade Otamendi Gabriel ser dupla zaga sensacional,no
dor cotovelo maria azul borradeirasador pagina galo,no
corrir nao Apagao refletor pra esfriar adversario rajkazblanks,no
corrir nao jogador adversario escorregar gol escancarar rajkazblanks,no
corrido gritinho acreditar nao colar rajkazblanks,no
corrir nao disputa penalty rajkazblanks,no
corrir nao Riascos pra errar penalty rajkazblanks,no
Anelkocando ate hj Maria nao argentino nao ver saber q Marias borrar pro argentino,no
pena Riascos nao Argentinota marcar historia momento marcanteskkkkk,no
MARIAS CIO PRESAS PREDILETAS VOU ESBANJAR DEVORALAS,no
forca peruca Galo RACA ROBINHO RACA PRATTO RACA CAZARES ir jogar amor camisa,no
Concordo parte sombra pro Vizeu nao acomodar igual Jorge,no
NAO ACHO CUEVA SO GOL PENALTY,no
junta ponta Fla nao Cueva,no
Flamengo motivacao meter x santo,no
QUEREMOS TIME PRA GANHAR TITULO NAO PRA FICAR TABELA NOVAMENTE,no
ue cheirinho voce estar sentir,no
Vizeu convocar frenquentemente selecao sub ir centroavante CIRINO,no
Devia ficar Damiao sair inutil guerrero choraor,no
ze burro cara empresario correr solto muito grana envolver,no
TB ACOMODOU PODERIA REVESAR RODNEY,no
perfeito garoto base sao bom jogador citar,no
rogerio antar nao colocar pra jogar,no
tecnico time ruim,no
Complicado colocar Cirino Gabriel atacante nao chutar nao gol,no
CariacicaES bom Bota jogo santo coxa la,no
correto Adriano Adryan bom q Cirino Gabriel Fernandinho etc,no
SANTOS LANCA GAROTOS FLAMENGO NAO,no
menguinho so vcs pensar falar,no
ze cuidar titulo jogo mexer,no
cara colocar chiquinho cirino Gabriel jogar nao normal,no
nao peidods montar elenco entao nao ir porrda cara,no
ELENCO POUQUISSIMA QUALIDADE,no
Abel Braga ano pra disputar libertador mandar Gabriel cia,no
voce nao falar serio,no
THIAGO SANTOS EH MELHOR Q GABRIEL FERNANDINHO CIRINO JUNTOS PQ GARORO N JOGA,no
colocar moleque carioca pra experiencia,no
Ze Ricardo Tecnico Libertadores entregar titulo palmeira,no
Demorou so digar,no
ze ricardo doido time empatar perder continuar Gabriel so caso amor,no
Base Ze nao so jogo la medalhao jogador empresario politica dinheiro bolso,no
NAO POSSIVEL CARA VA CONTINUAR COMANDO TIME,no
ZE CONTINUAR NAO VAMOS GANHAR NADAEM HORAS DECISIVAS ERRA,no
Ze ricardo nao avaliar jogador profissional q estao dira base,no
Verdade nao Escala substituir mau culpado perda titulo,no
culpado perda titulo briga titulo kk ver entender,no
Prefere Damiao Vizeu comentario,no
volante base AMOR DEUS Marcio AraujoPELA AMOR,no
MELHORES NW MELHOR RONALDO VOLANTE LATERAL JOGA,no
ze ricardo ta brincadeira culpa mane jogo time diferente fanfarrao,no
gigante nao ganhar nacional anosta sacanagem ne,no
falar cheirinho perder olfato Rsrs,no
Flamengo assumir ponta Demora voltar jogar Maracana,no
cair Real vascaino Kkkkkkkkk,no
JUIZ BANDEIRINHAS GARANTIRAM ROUBO estao acertar pra,no
ADRIANO IMPERADOR WAGNER LOVE RONALDINHO FABIO LUCIANO,no
jogador condicionamento fisico pra disputar brasileirao dar em isso,no
nao contratar medalhao flamengo so gastar gastar ter garoto base,no
gastar cuellar erradamente dar pra comprar cueva,no
Santos Kkkkkkkkkkkkkkkkkkkkkkkkkkkkkkkkk torcidinha caber Kombi kk,no
cara gabar eh pra nao algum ja,no
so ganhar ROUBAR senao CHEIRAO F Z S,no
padaria Flamengo vender sonho ja acabar so restar pao,no
STJDacorda pagina rubro negraseu viceADO,no
Digam querer Copinha OPG so arbitragem sao promessa KKKK SV,no
GAROTADA RUBRO NEGRA MANDOU LEMBRANCA CASA KKKKKKKKKKK,no
Vitor Nastari voce cabeca cheio kkkkkkkkk imagine kkkkkkkkkkkkkkkkkkkkkkkkkkkkk,no
cheiro bucelto mae,yes
ir levar porrada molecada nao corpo Vao pipocar,no
Concordo montar time,no
verdade so olhar pra tabela Entendem futebol,no
nojo flamengo timinho torcida terceirizar nordestino fedir pensar carioca gema nao passar time identificacao nordeste rio falar flamengo imaginar monte paraibas fedir agua falar FRAMENGO camisa camelo Respeito Vasco Botafogo falar rio janeiro lembrar de ele Saudacoes corinthiana,yes
desnecessario ofender flamengo envolver parte ai ja nao,no
dinheiro gente pegar nao ta quebrado,no
Lateral direito zagueiro atacante ja resolver problema Cruzeiro,no
so esperar recuperar futebol,no
soberba nao acabar kkkkkkkkkkkkk,no
Relaxa Veremos de aqui rodada Soberba,no
bishona de aqui falar leicester ganhar champions ucu,yes
negro pai mae dar pra jovem,yes
voce ta zona galinha,yes
Botafogo dificil acreditar classificacao Avante Glorioso Botafogo,no
ano pra vcs muito frustracoes eliminar participar,no
ah fu voce,yes
fanatismo nao doenca fisico espiritual doenca ignoranca odio,no
Voces precisar pesquisar melhor historia campeonato,no
nao haver rebaixamento existir liga,no
ficha sujo inelegivel nao saber,no
kkkkkkkkkkkkkkkkkkkkkkk rir,no
Palmeiras nao mundial,no
inveja matahhhhhhh,no
time gol so Muiuta sorte,no
importante ganhar filho acordar pra vida,no
MULAMBOS SETEM CHEIRINHO HEPICANUNCUKKKKKKKKKK,yes
Brasil torcida inter hoje Corinthians obrigacao ganhar,no
nao timeTemos bando jogador meia bocatodo qualificacaoBarcaJA,no
ATENCAO DIRETORIA QUEREMOS TIME COMPETITIVO,no
Traz volta deixar escolher tecnico,no
prender Aguarde,no
mundia libertador,no
futebol argentino piada so pancadaria confusaor,no
bandidagem continuar esconder,no
feliz voltar Bahia baiano,no
hora chegar,no
DALHE DALHE PORCO DALHE DALHE PORCO CHUP MOLAMBOS FICARAM SO CHEIRO,no
Deus nao nao adiantar lutar,no
nao roubouao gestao,no
Ragnar nome travesti Escandinavia,yes
Entrei so pra ler comentario perito,no
Emocionar morte posse,no
Fizeram pericia peca carro,no
SERA POLICIA PERICIA CARRO ESTRANHO NE,no
Sera sabotagem,no
Melhor investigar oposicao,no
QUEIMAR CORPO DELE CHEGAR POA POLITICO INFERNO,yes
nordeste acontecer,no
Idiota,no
investigador investigar vcefdpta,yes
ai sentar boneca,yes
apostar presidente Camara,no
roubalheira continuar sao profissional,no
banco cheio problema governador,no
so metade Voce ser otimista,no
Paulo to mar c uu,yes
Alex exponha argumento abc,no
tomar dinheiro pra industria seca,no
Milhoes Sergipe Milhoes pra Alagoas governador Sergipe Bndaum,no
seca Amapa so brincadeira,no
presidente,no
dinheiro ira brotar agua solo,no
dinheiro desviar,no
recurso vao sair,no
mau presidente historia,no
nao presidente golpista,no
AECIO UNICO CAPAZ TRANSFORMAR PAIS,no
finalmente Senador entender Parabens,no
Fiquei chocado noticia,no
voce meia duzer pensar,no
Passei so pra deixar TEMER,no
lazarentuuuuu,no
Sera empresa nao,no
Reforma estrutural rbbono nao,yes
prender inocente,no
tornozeleira eletronico,no
hmmmmmmmmmmmisso bichna,yes
entao lojinha anta,yes
lojinha mae prostituta,yes
aguentar ironia,no
neto vergonha de ele,no
Cara Pau,no
Boca mole bolso conta bancaria abarrotar dolar Sahfado,no
Boca Buxeta,yes
PIAUI QUERENDO ASSUSTAR MUNDO FIGURA SO NASCE GENTE FEIA LA,yes
Vermelho nojento dever levar tiro cara bandido,yes
vagabundo,yes
corrupcao cupim corroir democracia instituicoe,no
corrupcao estampar cara individuo,no
desgracar bandido bandido votar desgraca eta burro,yes
Raposao politico profissao ta carreira Piaui adorar Eh boca mole eheheh,yes
pagar boq cadeia preso boca buc inchar,yes
deboche escarnio perder senso ridiculo humilhacao,no
debil mental,yes
MELHOR C U DIARREIA,yes
ja haver arranjar apelido casa ocuquefala,yes
cara comecar falar mudo canal,no
absurdo indignado chacota,no
voce ato enriquecer curriculo bandido entao explicar,no
kkkkkk,no
Estourou placar,no
peteba sao piores asno puxador Carroca,yes
mesmo denuncia burrao,yes
pior contar dedo mao kkkkkkkkkkkk,yes
querer matar,yes
ONU KKKKKKKK ONU bosta mesmo antar,yes
sentir peru entrar,yes
morar sentir peru Aecio entrarkkkk,yes
Carlinha Antinha servico petebas Ridicula,yes
muito denuncia acao,no
muito denunciar acao,no
muito denuncia muito prova cadeia,no
Joao retardar prestar atencao gangue tomar Brasil assalto,yes
entao ir perdoar Ladrao so turma tambem nao bom prender,no
saber causa pesquisa poder presidente,no
voce duvidar medida tao rapido MPF,no
calmo questao lembrar Cunha,no
so conviccao nao prender ninguem,no
verdade apesar achar pesquisa sao furar,no
politico sao reflexo,no
denuncia pedir juiz caso blz,no
Curitiba esperto voce pensar,no
Concordo Carlos lavagem cerebral pra asno,yes
PRENDER FUJA PRA CUBA,no
votar indicar,no
Kkkkk,no
Olha ai esquerdopata cmedor alfafa negativar,yes
pesquisa comprar,no
SERA RECEBIDO JUIZ SERGIO MORO,no
Prendam chefe mor corrupcao,no
nao existir materialidade so conviccaor,no
verdade ja passar hora,no
ACEFALOSESTE CIDADAO TORNOU MITO DIA PERCEBEMOS NAO PASSA RATO LADRAO DIGAM CONTRARIO,no
casa cair,no
Cade prova,no
JA VIROU NOVELA CHEGA CANSAMOS,no
pulso,no
materia espetacular Grs,no
denunciado hoje ok prender,no
JAMAIS SERA,no
fato Nao ha politico honesto Brasil,no
ai materia so titulo Kd resto,no
,no
so denunciar prender,no
nao entender ta faltar pra prender,no
sera prender,no
denuncia denunciar denunciar cadeia,no
Indiciam denunciar nao prender,no
triplex cair,no
finalmente prender,no
tucano rei delacoe,no
Homem honesto Brasil,no
desordem Regresso,no
Srs JUIZES PREDEM BANDIDO,no
noticia antigo,no
prender Natal,no
processo gente cana,no
QueseFODAesseFDP gostar defender tbm,yes
enorme rechear pizza,no
Denuncia nao encher barriga precisar valer,no
Indiciacoes semana ja pedir musica,no
estao tentar desviar foco,no
Serra milhoes tambem,no
nao,no
g CANALHAS COMENTARIOSENFIA LA,yes
Ententam nao ha denunciar prova,no
monte bosta minimo norte nordeste trabalhar nao trabalhar viver Bolsa familia votar luladrao,yes
Cade algema,no
gauchada boiola kkkk,yes
Guy Gay boiola pai,yes
foro privilegiar bosta Burro,yes
pro lulao levar viagra,yes
Deixem cara paz,no
kkkkkk,no
Credo Globo instigar violencia,no
filhodaPhuta Brasil,yes
provar irao cadeia,no
voce colocar rotulo pessoa,no
encantador burro pegar,yes
kkk voce sao comedia,no
MPF trabalho interesse tucano pmdbista,no
nao serio acabar ler,no
investigar dar aula Portugues,no
ano,no
Brincadeira vc acreditar realmente em isto,no
de ele cadar denuncia,no
BURRO ASNO TOPEIRA,yes
mulher grosso estupido ignorante,yes
alem burro analfabeto,yes
Hahahahahaha jumento,yes
la lamber bola de ele,yes
idiota abestar voce,yes
lavar panela vaca,yes
Idiotao sabidao,no
Romulo comer bosta,yes
Lizzie comer bosta,yes
achar ta faltar prova,no
ter baianoputz povinho,yes
KKKKK LADRAO MERECE MOE,yes
cala boca jumento,yes
serio,no
Pobre BURRO neque,yes
peco respeito Falei,no
entao pecar respeito Falei,no
GABRIEL VOCE COVARDE VOCE PEIDAR VOCE CAGA,yes
asno nome ta sacanagem,yes
Sao paulino gostar mamar cajado,yes
nao futebol paraguaio,no
Tomara estar certo colega,no
ir ficar ja estao ai,no
Vc retardar,yes
cara jogar,no
Enfia rab mae,yes
achar voce pagina errar,no
Andre noiar diminuer fumo Ta dificil,yes
colocar vc otario su amae,yes
moral idiota quase voltar Kkkkkkkk,no
SRN R B U D Negao,yes
passar mulher deixar g z d,yes
Jkkkkkkkkkbosta Clubenao dinheiro pra contratar pra comprar camisa Estadiokkkkkkkkkvice eternopiar Brasil voltar,yes
P I R N H,yes
fundo poco,no
Virou bagunca,no
comum time pequeno,no
dinheiro clube falido,no
jogo flaF Z S estadione g l b,yes
ate pena time so passar vergonha,no
varzea Time pequeno,no
cala bocar idiota,yes
ai matador,no
Gostei mudanca estrategia,no
outro asno nao Artur,yes
mITO futebol,no
precisar centroavante lateral esquerdo,no
Volante centroavante lateral esquerdo,no
divulgar procurar ai,no
time gostar ceder cauda,yes
vc analfabeta,yes
Sera ganhar copa Brasil,no
diferenca,no
Sao Paulo apressar comer C u,yes
nao pra comparar fato,no
verdade triste verdade,no
darar certo rumo gloria,no
JOGADOR TIME PEQUENO,no
Walter dever lutar SUMO PODERIA,yes
gordao ficar rir conseguir ficar pe,yes
burro,yes
dirigente falar algum mentira,no
ja ta chato historia Walter td ano,no
nao importar sao mesmo jogador,no
sorriso sonatar ver jogar futebol Marcelo Daniel Alves jogar ano time ponta Europa ja ganhar ds titulo ja vario selecao mundo bosta falar q sao ruim,yes
reserva capaz vir reserva,no
ver,no
vier otimo reforco,no
vier sera reforco,no
excelente jogador sera titular Jo,no
ser faca trabalho,no
GOSTEIKKKKKKKKKKKKKKKK,no
Karen lavar louco q ta sujo,yes
CHORO CONTINUA SENDO LIVRE,no
bom clube planeta,no
Intao vc nao ganhar nd pk ruim Msm,no
Ta cara peidar farofa kkkkkkk,yes
enganar,no
voce desinformar,no
sincero Corram atr,no
Falou cara nao sair pagina verde,no
choro livre,no
aprender escrever cavalo,yes
vc chacota bi b mundial kkk,no
mundial bi b lesma verde kkkkk,yes
Anselma Bibona invejoso criatividade,yes
mina cara cavalo,yes
Ricardo cara cavalo potranca,yes
empresario rapaz simplesmente magico,no
Ser feliz,no
venda casado,no
otimo noticia massa atleticano,no
dever contratar,no
empresario,no
Libera rapido turco desistam,no
eis sorte bater porta,no
alguem disponivel pra levar aeroporto,no
Jogar milho sentar sabugo ne Maria,yes
voces nao disputar libertador,no
pq precisar trabalhar,no
GUILHERME IDIOTA,yes
Lurdinha burro,yes
,no
Alo botar ovo fracast,yes
MIERDAS,yes
Alguem falar helicoptero,no
falar,no
time bosta cair gigante kkkk,yes
contratacoes franga vao tomar oi,yes
time,no
pior cego burro,no
dinheiro fruto corrupcao vc deverar prender,no
BATATA JA ESQUENTOU BEBADO LADRAO POVOCADEIA nELES DRSERGIO MORO,yes
ADVOGADO BANDIDO BANDIDO IGUAL EXTERMINADO,yes
aCHO AECIO NAO TELEFONOU JUIZECO HOJE TA DANDO PITI SAUDADES KKKKK,yes
mamis ja ne chamar mulher mamis inocente,yes
AdiANALdo pregar continuar firme forte,yes
Igual mamis pregar indestrutivel kkkkkkkkkkk,yes
Ruy vc acreditar Japa Federal tb ne Jumento,yes
Entrou fedidinho Junior ui proprio gayzisse,yes
dia macho chegar Aguarde comprar lenco pro choro esterco humano,yes
Alexandre maluco so comeu titico crianca,yes
Olha ser ja ter prender esquartejar luladrao kd,yes
Junior nome Marmota atitude Ooooooo sujeitar tapar,yes
Acordem Trouxinhas casa cair,no
bixario coxa ta desespero,no
Bixaria mortadela tar desespero,no
La afeminado Peta invadir comentario alheio Uiiiiiiii Nojentaaaa,yes
devolver troco R servico oral,yes
Adinaldo kkkkkkkkkkkk defe car mortadela,yes
nao Junior Soares Defequei Juniorizinhos Soares,yes
nordeste bandido estao sudeste,yes
cei tao dano buesta cair ano,no
BOFE Joao Paulo alem LINDO PAUlo MARAVILHOSO Noizinhas MENGAO amar SRNSomos Rabudas Negao dcm DIAMETRO CRFCheirinho R Fedida,yes
