mensagem,odio
"A partir do momento que esse ministro se põe a favor de Bolsonaro e contra a ciência, eu não só perdi toda a admiração como também o respeito por esse palhaço. VÃO SE FODER BOLSONARO E ASTRONAUTA FDP!!",OFF
"não faz sentido: desfarcar USER USER eh gay (naum o USER USER, as pessoas USERue são gays, tpo, eh gay, e banca o maxão, sabe o USERue eu falo neh?)",OFF
Olhem o quão violento o corno é: USER,OFF
Bando de gado safado esse cara quer Davi golpe no Brazil6,OFF
Larga a porra da maconha,OFF
"USER Cu, se encaixa em qlq situação. Teu cu, vai tomar no cu, só se eu tirar do meu cu, enfia no cu... Vc toma um susto e bam ""aí meu cu"" 😂😂😂",OFF
">>57322>>57389>>57396deu match? olhe na tua agenda quando você estará disponível pra sair e marque qualquer merda. começar na internet é merda demais. use a internet para começar com pessoas que estão mais distantes, não pra uma que está há 1km de distância.",OFF
Palhaçada 🤡,OFF
' nós q ritma a putaria no cpx🤡,OFF
"USER USER fio presta atenção, ela USERuis dizer pra ele acorda o 'biel' pra carregar água, pUSER ele fez parte da punição ela n tinha ND USER pra pega água se toca a 'porra da jojo' USER USER USERuis dizer tá rica e USER?",OFF
USER o emoji com carinha de psicopata passo mt malkkjk,NOT
Para de usar drogas na hora de fazer entrevista. Olha só a merda que deu!,OFF
"Vergonha alheia dessa mulher!!! Mds, e o povo venera, aplaudem. Sinceridade, falar na cara é muito diferente desse baixo nível. USER acha que sinceridade é a maior virtude e aí confundem essa arrogância toda com ""SER USER"".",OFF
USER But uno es tan imbécil para fallar en el ufo del drop final,OFF
"Mano, o USER estava chapadooo ele não é Nazista",OFF
"mas eu parei, essa porra doi",OFF
A Burra da mulher esqueceu o celular no ônibus e ta chorando aqui no busão queria não rir,OFF
"Argumentos do Monark: Ta uma merda, que merda e vai da merda e a gente faz merda depois USER come merda",OFF
Se ela tá certa leva pra tua casa bora ver se ti aguenta alguém te esculachando e achando a fodona,OFF
[26/3 20:19] amandinha: passei na rua debaixo ai vi uma florzinha e lembrei do ce [26/3 20:19] Nanda: Sério kkkkk🥺 [26/3 20:19] amandinha: sim [26/3 20:19] Nanda: Para q eu choro [26/3 20:20] amandinha: era uma rosa vermelha [26/3 20:20] amandinha: cor de puta 🥰🥰🥰 KKKKKKKKK,OFF
"azeiteiro, quero q te fodas volta para a tua terra",OFF
Q roupa esquisita dessa jojo...ela mostrando quem é ela ..boca suja..alguém coloca essa mulher no lugar dela..,OFF
"O sitio era sim desse bandido, foi uma caixinha e que caixinha, ladrão de alto nível",OFF
casa dia mais feia. pqp,OFF
"Enquanto não aconteceu isso,o coitado era só mais um,largado e sem ninguém ligar pra ele. Agora estão explorando a imagem dele. Porque não o ajudam?Hipócritas!",OFF
"Deixem nossas crianças em paz, bando de capeta🤬",OFF
Que USER é esse que ama os héteros e condena os homossexuais? O amor é direito de todos HASHTAG,NOT
"o convidado nem conseguia olhar pro USER, que merda hein",OFF
"USER USER USER ela literalmente disse que é contra o que a Natália faz. e outra, feminismo não é o ""contrário"" de machismo, femismo que é. feminismo nunca quis ser escroto e mal educado que nem o machismo. 😊",OFF
"Mulher mal educada, achando que é dona de tudo.",OFF
Ele teria cagado pro cancelamento só que se ele fizesse isso um monte de pessoas que trabalhão no flow irão se ferrar ai ele saiu,OFF
"O USER USER COM VOCÊ JAIR BOLSONARO , OS USER VÃO PRO INFERNO , ABRAÇO 😂😂😂😂",OFF
Palhaçada esse homem é um grande estúpido,OFF
"USER Ô canalha mirim, tu já foi lá na faculdade resolver o problema da dívida? KKKKKKKKKKK",OFF
USER.. so USER.... ganhou so USER LIKE... 14 anos.. estamos cansados..... voces que USER o GADO Passado.. e USER gado com lavagem cerebral.. nao mudam.. mesmo vendo o partido que apoiaram TODO PRESO e provado que foram corruptos... ainda os apoiam.....,OFF
Manda fogo em Sodoma USER!!!!,NOT
"USER😂😂😂😂 USER que cara engraçado, USERma idiota vai falar mau das mulheres, mandar os eleiUSERres do luladrao comer capim..... 😂😂😂😂😂😂USER me acabando de rir",OFF
USER USER USER a zuada aí zé USER...Leia os debates que eu já tive nesse post com gente muito melhor do que você...como eu sei que não vai entender.. nasça de novo.,OFF
Fica um monte de infuencer defendendo canal que tava dando voz prum bosta…. inclusive influencer q vc curte,OFF
rt USER foda é qnd vc tá feia no espelho e horrível na câmera URL,OFF
"USER USER USER da Silva é outra o USER conseguiu precisou de varios mandatos pra deixar o "" país na merda"", já o USER conseguiu na metade do seu primeiro mandato.",OFF
USER então vai comer putinha agora!!!,OFF
Execução para quem fez isso com o mito. USER porra....,OFF
"USER USER USER a verdade em palavras dói, dai o bolsominion parte pra usar a arminha. Lula ladrão roubou meu coração",OFF
"Cara eu dava um tiro na cara desses 2 vagabundos ,nessa hora que sinto repúdio de ser brasileira lei que benefícia os assassinos , essa USER é um monstro que a justiça está dando de comer que nojo 🤮🤮🤮🤮🤮🤮🤮essa lei é só aqui que tudo é um lixo",OFF
USER Ladrão safado,OFF
"Tá certíssima a USER... Todo mundo tem o direito de beber, curtir e se divertir, mas as responsabilidades estão de pé... Encher o cu de pinga, largar tudo bagunçado, fazer os outros se lascarem e depois não quer nem colaborar com pra limpar a merda que fez? Tá certinha ela! Bando de playboy mimado, que querem tudo na mão",OFF
"USER tenho preconceito trato gays ou lésbicas ou qualquer outro tipo de pessoa igual, o mundo tem que parar de ser preconceituoso principalmente o USER estamos no seculo XXI pelo amor de Deus mude USER mude mundo....",NOT
USER USER É burro ou mau caráter?,OFF
"a única depósito que eu tive na vida eu transava sem camisinha e fiquei anos com medo de aids, só não tenho mais medo porque esse ano vai fazer exatos 10 anos que isso aconteceu.uma vez a gente transou e na hora que ela se limpou (eu gozava dentro, pqp como eu era burro, tinha sorte dela ser gente boa e não querer me ferrar fazendo filho) e saiu sangue, achei que era do meu gozo, mas ela me acalmou dizendo que era dela, que tinha machucado lá dentro ou algo assim.",OFF
"O próximo comercial vai ser o orgulho paralelo, minha irmã é drogada, meu pai é marginal, meu outro pai tá preso e eu sou estuprador, meu tio é pedófilo e lá em casa a gente se dá muito bem. Só estamos com saudade do vovô que está preso porque matou a vovó. POR FAVOR NÉ? Uma coisa é respeitar, outra é dizer que é normal, normal não é.",OFF
por favor deuses do olimpo me deixem dormir cacete eu n aguento mais,OFF
"USER USER USER USER USER USER Você sabe bem disso, tanto que virou uma putinha na internet e defeca por msgs, não teve amor de ninguém nem atenção e quer buscar nas redes sociais, quem tá errado é a porra do motoboy, a mina usa a roupa que ela quer, foto de anime ainda no perfil, deve fazer eco essa cabeça",OFF
USER USER USER USER não quer ter filho da o cu então o filho da puta,OFF
Deu até dó mano kkk,NOT
Dois merdas que não produzem nada e vive da classe trabalhadora que produz paga impostos e o povo ainda fala bem da gabriela ou do USER deixem de ser marionetes,OFF
"Será que você diz isso por que esse sujeito é um mendigo? será que o foco de tudo isso é uma mulher que teve relações com uma pessoa ou uma mulher que se relacionou com um ""MENDIGO""? Ele não é uma pessoa? por que a ênfase no mendigo? Aparentemente todo mundo aborda esse tema da seguinte forma: ""Só pode ser louca, se deitou com ""MENDIGO"". Será que acham que mendigo não é gente?",NOT
RT USER: USER Eu devo conhecer esse corno kkkkkkkkkkkkkj Cuzao demais,OFF
Bando de infeliz USER USER mechendo com coisa seria ai e o coração de Deus da nojo ver isso,OFF
USER esta apaixonado ....ágora fudeu .... USER não cobiçar mulher do proximo cuando o proximo está proximo!!!,OFF
"Sorriem como se não tivesse feito nada.... dois monstros soltos em saidinha. Esse país devira mudar isso,me revolto cm tanta coisa errada. 🤦",OFF
"Amo kiso, o modo que meu twitter é formado na ariana e na minha vida merda, oh glórias!.",OFF
como essa bicha vei teve coragem eu e as meninas tudo lá...,OFF
"USER bom o USER nossa nunca ri tanto assim ... USER voce fala eh vdd pq um monte de menina escrota curte essa merda e vivem no USER da fantasia e deixam de olhar pra um monte de caras legais e passam a idealizar um cara q na moral ... elas NUNCA vao encontrar... e o final tdo USER conhece ... "" voce vai acabar gorda ,sozinha,vigem e cheia de poster no crepusculo no seu quarto "" . USER otimo USER",OFF
"USER Até porque ele não conseguem ver, pai de família, mães cm filho no colo pedindo qualquer ajuda nas sinaleira e toda parte do Brasil, aqui em Poa e essa a realidade, o nosso governador falando da Anita. Que falta de caráter desses políticos safados, que não tá nem aí para o povo",OFF
"Bando de gente frouxa aturar isso,acha q é dona da casa. USER se acha total e o público enchendo a bola dela. Vai dá ordem lá no .....",OFF
rt USER me apaixonar s贸 por homem q n茫o vale a 谩gua q bebi t谩 me deixando s贸 a ca莽amba de lixo,OFF
"Este cara tem que ser investigado, parece que ele se aproveitou de uma situação de fragilidade psíquica de uma mulher para obter favores sexuais. Se comprovar que ele cometeu este crime que seja punido exemplarmente",NOT
"Meu USER USER que comentário sem noção kkkkkkkkk o cara tava de boas na rua, uma mulher aparece chamando ele pro carro e USER acha que ele não ia? O NOME USER É USER, o marido dela pra tentar diminuir o quanto ele é corno, resolveu falar que ela teve um “surto”",OFF
"Os 'tolerantes' donos do poder e sua carneirada submissa, quando contrariados só ofendem e tentam ridicularizar. Hipócritas de mau perder!",OFF
USER gracias pau t amo,OFF
A corrupçáo e do ministro lei proteGe as mordomias de marajas na cara dura .na politica do brasil e USER apontamdo USER .tudo termina com festa,OFF
"Cancelar o guri que falou merda estando bêbado é fácil, quero ver cancelar o Presidente que influenciou milhares de pessoas a não se vacinar, a se infectar com Corona e a apoiar ditadura e golpe militar.",OFF
RT USER: USER USER USER vcs sao uma vergonha pro futebol goiano. O que aconteceu hoje foi mais do que pr…,OFF
CARALHOOOO O ZOOM É A PORRA DO JAY ESSE FILHA DA PUTA CERTEZA Q É ELE NOSSA CUZAO DO CARALJO,OFF
USER maldita samuela,OFF
USER USER USER vc é foda demais ídolo!,OFF
crepusculo e uma USER,OFF
"'Acho seus argumentos ridículos, não mudarão minha opinião, mas eu não consegui refutar nem uma linha' Resumo: 'Eu _ URL",OFF
USER USER USER USER USER!,NOT
Essa roupa tá ridícula ora reunião,OFF
"Tristão isso aí, todo mundo erra todo mundo fala merda as vezes, o problema é ser uma pessoa pública tão influente ai necesita de muito mais cuidado com o que fala, vejo a tristeza do próprio igor de falar sobre isso, e parabenizo o monark por aceitar para poder preservar os funcionários, espero que eles superem e sigam sua vida da melhor maneira.",OFF
"USER Vc é um hipocrita, não engana ninguém safado",OFF
"Que propaganda mais triste essa, perderam clientes pra caramba. 🐲🐉🐲🇨🇳",NOT
"USER Tu é foda demais Luisa nunca deixe ninguém te fazer duvidar disso,te amo❤",OFF
Conversa esticada do cacete! 🤦🏾‍♂️,OFF
"o grande mérito do lookismo é escancarar que o fator mais importante, ainda que não seja o único, da atração é aquele que as depósitos de porra mais escondem, desinformam ou, em outras palavras, draminam.",OFF
"USER caroline a minha buceta, para de me chamar de caroline",OFF
"Concordo, a ignorância tem q ser respondida com conhecimento, e USER com o linchamento de uma pesUSERa, USER é ignorante, USER precisa ser taxado de n4z1, ao mesmo tempo uma conversa dessa é mt importante, e ele sim tem q USERfrer consequências pelo q ele falou. Sei la, USER fico triste pq fui ver o instagram dele ontem e tinha ate gente falando para ele morrer. Falei no começo e repito, a ignorância deve ser respondida com conhecimente e USER com odio. Odio USER gera mais odio.",NOT
"Que mulher ridícula, aff qro q ela saia logo",OFF
"Oh seus puto! Falei que fim de semana rolou uma coisa daora com o maridão! Escrevi sobre e publiquei no blog! Da aquela ajuda, lê, comenta lá, da RT aqui 😈😈😈 URL URL",OFF
Fica Gil da cachorrada 🤣🙌🏽,OFF
"USER USER Bem, você me mandou caçar um serviço sem saber da minha. Estudo, trabalho, minha vida é maravilhosa e não apoio tortura animal, muito menos lambo bolas de político. Te garanto que o único motivo pelo qual você faz isso é pq ele representa o esgoto de ser humano que você é.",OFF
"USER mas é verdade, cu. era o nick do cara!!!!",OFF
"USER porra cara kkkk , o mulherzinha 😂😂😂👌",OFF
"Ontem já achei o Igor totalmente deslocado no Flow, alguma coisa já estava acontecendo, acho que o USER fez pra fuder mesmo cm o canal, que sacanagem cara 🙈👊",OFF
USER USER tem vida seu peido do capeta kkkkkkkkkkkkkkkkkkkkkkkkkk raxeei,OFF
Cara eu adoro Crepusculo! kkkk Tudo que vc falo se parar pra pensar é USER! Na moral USER tu é foda! kkkkkkkk USER USER de rir! USER USER! kkkkkkkkkkkkkkkkkkkkkkkkkkkkkkkkkkkkkkkkkkkkkkkkk,OFF
morar aqui me faz um mal desgraçado e era a ultima coisa que eu precisava pra me recuperar,NOT
ela se vingou do marido duas mil e quinhentas vezes ele deve de ter enfiado muito chifre nela na vida kkkk se lascou o personal e coitado do mendigo kkkkkkkkk,OFF
USER USER USER Você acredita mesmo que a criança vira gay por ver isto?,NOT
"Assim como o Tenente Aldo USER em BASTARDOS INGLÓRIOS vocês não consideram que, no fundo, o USER queria fazer como a personagem e, mesmo que alguém que é nazista e queira 'se esconder' recebam uma MARCA INAPAGÁVEL na testa? E, apesar do tamanho da merda que o USER falou, ele conseguiu levantar de forma, até aqui inalcançável, um debate pra que o USER jamais seja considerável em nenhum outro momento. Tenho certeza que o moleque jamais defendeu o USER.",OFF
As pessoas comentando porque o cara fala bem não é porque ele é morador de rua que ele tinha que ser analfabeto. Eu sou mulher mas não vou passar a mão na cabeça dessa mulher não o problema dela não é na v USER não é no meio das pernas tipo de mulher que não pode ver homem,OFF
PUTA MERDA QUE FOFURA URL,OFF
"RT USER: SPOILER BRIDGERTON , , , , , , , , ai anthony vai tomar no cu porra se vcs estão nessa situação não é pq a kate é uma gra…",OFF
"USER USER Que tal imbecil. Asi esta nuestra sociedad, contaminada con ideologias estupidas.",OFF
USER eitcha como é burrinho,OFF
Tomei nojo dessa mulher,OFF
USER Se vc não sabe respeitar nem o cara mais fofo e educado que já apresentou o programa por causa de um macho escroto manipulador chorão...Sinceramente procura ajuda.,OFF
"Existe Tinder pra fazer amigs? Queria uma amiga pra falar merda, fofocar, gravar vídeo retardado, tirar rolê, uma ir na casa da outra, tipo adolescente. É pedir muito mesmo?",OFF
"RT USER: Terrorista se fantasiou de ""refugiado"" e se mandou para a Europa cortar mais cabeças por lá URL",OFF
ta de parabens o comercial e lindo e dane-se o preconceito,NOT
Demônios USER assumiram USER mataram a menina,NOT
"O USER é um anarcocapitalista IGNORANTE (acho USER ficou redundante pUSER ancap e ignorância são sinônimos) USERue não acredita no estado e nem em investimentos estatis mas USER USER?? O estado de Singapura (USERue ele compara com o Brasil) investe o dobro de dinheiro nos alunos tanto de educação básica USERuanto universitários (8,000 e 12,000). Além disso, Singapura da salários eUSERuivalentes a médicos brasileiros para os seus PROFESSORES, USER USER!!! Ou seja, ele dá exemplo de um país USERue só ta no topo do pisa por causa dos investimentos estatais e ao memso tempo diz USERue o estado é dispensável... BURRO PRA CARALH* Tem como comparar??? Só poderiamos comparar se os investimentos fossem iguais! Além disso Singapura é uma ilha menor USER a cidade de São USER.",OFF
"Bando de gente passando pano pra Jojo, aplaudindo a falta de educação dela... Duvido se aguentariam morar uma semana com ela kkkkkkkk",NOT
to cansada de vcs discutindo racismo vo dar unfolo,NOT
USER a cara do vagabundo,OFF
USER USER Tanto estaban mmando y presumiendo a montes cuando hizo Fray play. Y ahorita como les convenía el penal inventado ahí si no dicen nada. Ridículos jaja,OFF
puta q pariu né mano,OFF
"são 126 pessoas no grupo, o dia inteiro falando de cachaça porra, já avisei ele q vou ficar pela csa dele mesmo kkkk",OFF
USER USER Haja saco para ser escroto da harmonização,OFF
Q ridículo ! Ensinamos os filhos a respeitar as pessoas agora querer q eles achem normal o q não é ..aí é demais pai!!,OFF
"cara você é foda, eu adoro você e mais todas as mais puras verdades que você fala! Felipee você siim é o homem e o fodãoo que merece idolatração.. eu adoro você !",OFF
Todos se contaminando e o louco brincando de presidente que vergonha do Brasil. Um miliciano no poder a que ponto chegamos. USER,OFF
fico de cara com os velho broxa retrogamer que diz que earthbound é ruim ou até msm horrível,OFF
caralho irmão,OFF
"USER NO tiene vergüenza, una ambulancia? Hijos de puta están matando gente los rusos papa anda a la puta que te pario",OFF
minha mãe quase infarta vendo vôlei pqp kkk,OFF
USER USER!!! Chegou a hora de virar o jogo e fazer a limpa nessa corja!,OFF
Esse aí além de apanhar ser deu bem comeu a mulher do cara kkkkkk,OFF
Ninguém ali tá sendo obrigado a nada cala boca e vai dormir,OFF
Eu amo poder conversar minhas porcarias com Ana Júlia nossa. Me sinto até mais leve,NOT
bicha do ceu q mao eh essa URL,OFF
e ainda quebrei a porra da agulha,OFF
"Por marica es que me pasan las cosas, no es más.",OFF
"USER melhorem esse áudio seus, que merda de áudio.",OFF
"Gente, qualquer pessoa por menos estudo que tenha, sabe das atrocidades acontecidas no Holocausto!! A defesa da regulamentação de um partido nazista, JAMAIS SERÁ LIBERDADE DE EXPRESSÃO!! Esteja bêbado ou não!! Quem concordar com ele nos comentários, devem sofrer ás sanções da Lei!!",NOT
kkkkk de brinco? que viadinho URL,OFF
A estupidez a cima de tudo,NOT
"USER USER USER USER enqt vcs se emociona com o dudu jogando bem no paulista, e virou reserva na UCRANIA, enquanto um e uma das maiores revelações do Santos destruindo no real, imagine o quanto vcs ficariam malucos de ver o rodrygo jogando no lugar do dudu, a reação seria 2x mais, você e doente.",OFF
"USER USER Típico del populista, narcisista mentiroso, mesianico encantador de masas o de""idiotas"" que se creen todos los sueños que les prometen pero que son imposibles de cumplir.Enseña ignorancia,resentimiento y reinaras Porqué creen USER Es el borrego de Petro",OFF
"cara, que ódio da emanuelle, que ódio mano",OFF
NÃO É A PRIMEIRA USER QUE UM PRESIDENTE QUE ATÉ USER É FAVORITO MORRE USER DAS ELEIÇÕES! USER USER,NOT
"RT USER: ""Aí bolsonaro, Neguinho é o caralho, meu nome é Emicida, porra!"" HASHTAG HASHTAG",OFF
le dije a mi ex d fake q ya tengo novio fdp Chao cabros fue un gusto,OFF
HASHTAG achar que por vc ser gorda está fora do 'normal' e feia.,OFF
ai sua piranha filho da puta da madrugada pirata ladrao invasor torturador assassino comunista filho de uma puta rato ioiô da SERIE B? mandou muito sua porra comunista filho da puta com essa tua tortura de corna comunista fdp de privação do sono cadela vira lata pirata fdp? ...,OFF
"depois de tudo que aconteceu ele vem na maior cara de pau, puta que pariu",OFF
Eita USER!!! Essa porta era pra tá fechada desde a posse do Nosso Presidente eleito pela maioria da população e essa emissora marrom não aceita,OFF
Povo julga como se eles mesmos não tivessem um dedinho nazist@ na suas atitudes kkkk,OFF
"entao agora pega e imagina o tanto de merda que vai acontecer ainda e a gente nao tem nem ideia, imagina falar pra alguem de 2017 do covid, e o legal que nao acontece uma coisa boa pra sociedade em geral, todo avanço tecnologico que a gente tem custa a natureza basicamente",OFF
eu odeio crepusculo o negosio chato chato chato pracaraio,OFF
"USER, o MELHOR sao os comentarios das fãs (menininhas - veeelho, acho muito foda quando vc chama elas assim)... elas tao puuuuuuuuuuuuutas com voce... aaai, escrotas mano. elas gritam quanto veem a porra do jacob que tem cara de cachorro sem camisa.... e o USER é muuuuuuuuuuuuuuuuuuuuuuuuuuuuuuuuuuuuuuuuuuuuuuuuuuuuuuuuuuuuuuuuuuuuuuuuuuuuuito gay, porra! sera que nao da pra ver isso caralho?",OFF
"Pra mim, as piores pessoas são os adolescentes, os idiotas que fazem tudo por atenção.... Me dá nojo 🤯",OFF
Trabalho com crianças e creia que não são poucas . Essa maneira de fazer publicidade é no mínimo idiota tanto quanto lançou essa ideia. Estarei orientando os pais que não comprem produtos dessa empresa. Cuidado com a falência.,OFF
Que absurdo esse comercial!!! Não usem nossas crianças para propagarem suas ideologias!,OFF
USER USER USER pervesor de crianças USER USER é o cara não que pedir desculpa pra ninguém!! é preciso urgente aprovar uma Lei que inclua estudo bíblico obrigatório na base nacional comum. Temos obrigação de livrar as crianças brasileiras desse esgoto moral!!!!,OFF
"☑️𝕜𝕒𝕡𝕡𝕒𝕆𝕟𝕖®🔰 o figura resolveu tirar a máscara e mostrar a sua cara.. $ugou e mordeu tanto os paulistanos que ficou assim, com a calcinha apertada, com a boca inchada e sem dentes.. um horror só. XÔ!! 🕳🧹 URL",OFF
O MELHOR SIM!!!!!!!! FDS A TAL PAGINA LAZARENTA FALANDO MERDA URL,OFF
Esse vídeo ficou incrivel eu também acho o crepúsculo uma grande merda eu comecei a ver seus videos ontem e já sou sua fã.,OFF
"USER de qq coisa (homo ou hetero) ñ importa... o maior prejudicado no caso foi a própria boticário...tenho certeza q os gays vão continuar comprando cosméticos importados (pq todos os q conheço só usam importados) e os heteros q compravam boticario vão passar a comprar Natura, USER USER....USER (péssima jogada de marketing)...o numero de dislikes prova isso....",OFF
😂😂😂 ridícula você,OFF
USER espero que o casamento de vcs dure mais q o meu que foi um puta desastreKKKKKKKKKKK,OFF
Lindo demais. ! USER que existe tanta gente preconceituoso e ignorante .,OFF
"Aí Arthur, vai tomar no cu vai Mimimi do crlh, voltou do paredão 50 vezes e tá nessa, até parece q n sabe q vai voltar dnv, não fode HASHTAG",OFF
USER e um lixo igual a globosta moro traira 🤮🤮🤮👹👹👹💩💩💩,OFF
Globo é USER viu,NOT
"USER E a gente te ama também, porra ❤️ (falo em nome de tds mesmo fodase)",OFF
"USER USER É TÃO USER QUE TA USER QUE O USER É BRANCO TEM IMAGENS COLORIDUSER QUE PROVAM USER,USER USER QUE É VERMELHO,USER USER NÃO USER USER MORAL USER LOUCURUSER DUSER.....E NUSER COMENTARIUSER AQUI O POVO TUDO USER NA LABIA DUSER LOUCO",OFF
Os dois tem que apodrecer na cadeia,OFF
USER essa reporter bela HIPOCRITA,OFF
O gado sem noção,OFF
"Ao menos o monark poderia ter admitido o erro e pedido desculpa e se despedido decentemente do público que acompanhou ele todos esses anos, mais pela atitude dele só mostrou o nível de preocupação dele com a apologia ao nazismo, ele cagou pra tudo o que rapaz explicou e apenas fez birra e falou é isso último flow cabou",OFF
to com o nariz escorrendo nesse crlh merda mesmo praga ruim,OFF
"Falta de respeito com as famílias e crianças,porque não deixam as crianças serem apenas crianças e quando forem adultos decidirem suas escolhas sexuais com pleno discernimento? Porque não deixam as famílias ensinarem o que acreditam aos seus filhos? Porque querem empurrar ideologias na marra? Fique claro que não tenho absolutamente nada contra a escolha sexual de nenhum adulto capaz segundo a lei 18 anos em diante, mas essa bestialidade foi longe demais...USER USER USER USER. Falem sobre lanches e ponto e aprendam respeitar gregos e troianos...",OFF
USER Son unos hipócritas que no les importa el bien de el Pueblo y todo por seguir en contra de el Gobierno. Dan asco.,OFF
"Tudo rato , bando de bandidos , não sobra um !",OFF
USER USER 10,NOT
mds que muie fdp,OFF
Quem se fode sou eu que não posso nem colocar alguma coisa na Alexa pra me ajudar a relaxar e dormir,OFF
"saudações, anões! me ajudem, irmãos! suponha que conhece uma mulher, e que tem certo nível de intimidade, mas sem conotação sexual. seria possível oferecer dinheiro pra fornicar a mesma, sem passar por pervertido?isso é viável ou pura ilusão? ela se sentiria ofendida?",OFF
"Resumo, vcs acham que achismo é realidade, e culpa a mina pela burrice coletiva de vcs USER vai com Deus.",OFF
AGORA FODEU,OFF
o ******* é muito babaca,OFF
"USER USER STF é uma vergonha no Brasil, essa é uma organização do crime não é juiz, são advogados de bandidos criminosos políticos corruptos ladrões.",OFF
"USER palhaçada tão fazendo com o cara, só pq ele falou uma merda. USERuem nao erra nessa vida cambada de FDP",OFF
"""a vida vai te fuder, e se tu for uma boa puta, tu sai ileso"" -um filósofo aí",OFF
"Todos os dias um acéfalo diferente a dizer que a Margarida é culpada de tudo isto quando o único erro que ela cometeu foi confiar numa pessoa que não merecia, y’all are disgusting",OFF
