mensagem,odio
presidente USER precisar adiantar mídia porcar querer derrubálo cair conversa fiar falar Bolsonaro mostrar infectar morto Corona USER ir aprender perdido 2022 Poderiam tomar vergonha cara jornalismo verdade achar mau bom dever mudar tática convencer valer pena falar Bolsonaro criticar detestar BOLSONARO 2022 USER USER falido,OFF
extremamente manipulador convincente típico paciente psiquiátrico,OFF
prefiro morrer tossir q morrer transar 4 filho Bolsonaro,OFF
bando covarde,OFF
Bglh ridicular querer vida pessoal,NOT
claro q dia ir chegar falar merda pra krl programa defender Nazista inaceitável,OFF
Falar respeitar preconceito realmente pro inferno né,OFF
USER USER PORRA USER USER USER PUTO USER VOCE HAHAAHHHAHAA FODÃAAAAAAAAO,OFF
USER certicimo gnt preguiçoso tratar jeito msm achar peitar,OFF
mutir deslike comercial continuar vergonha Brasil país preconceituoso amar video USER USER,NOT
USER USER acéfalo pra achar ngc de esse,OFF
USER gostar crepúsculo fodase rir USER,OFF
monark errar feio cancelar atentar comunismo Che USER Fidel USER USER Tbm governo totalitário genocida Pesquisem USER USER mandar fuzilar nazismo nascer PAIDO USER ALEMÃO história esconder gente,OFF
porrar cara defender caralho crepuslocrespuslo eo USER porra nao prestar pra nadae vcs fas pcsiquera par xingar Felipe oq pra vcsseu maozinha nervoso,OFF
capitão doido cagada muito cagar globo 1000 USER globo moral pra falar USER esperar pra q crime cruel q USER entregar,OFF
lance pra cartão imundo ladrão fuder desgraçar bacaca,OFF
USER caier máscara farsante,OFF
ninguém seguir religião discriminador preconceituoso religião ensinar ódio,OFF
caralho frase sentido,OFF
algum evolução criação homem ficar homem mulher ficar mulher haver diferença ligar homem ser ficar homem ter vagina poder haver continuar evolução concluir homem pênis mulher vagina fazer ficar junto excretor fazer posta prazer,OFF
USER USER USER mulher vergonha cara pra vir público defender pastor VUSERUSER ordinário Emparelharam MEC corja ladrão Governinho mrda sair prestar Damares vUSER valer bombinha estourar,OFF
USER insuportável pqp USER USER,OFF
USER USER opinião desmerecer várias pessoa lgbt religião ir supor vc cristã chegar dizer vergonha estimular criança ser cristãs crtz vcs tratar respeito aprendam colocar difícil,NOT
USER USERO USER USER USER USERA USER USER USER USER USER qVEM USER USER USER USER USER RAINHA USERS USER USER USER USER PINGO HUMILDADE,NOT
GALERA USER USER PATROSINADO FILIPE VEJAO 00 USER USER USER USER nerd parafernalha,NOT
USER USER morno puro imbecilidade,OFF
falar vista de elas oque LGBT saber respeitar vc respeitar ngmmorrer solução esperar ajudar estudar comentar merda,OFF
Odeio grito acordar jeito mandar puta q parir,OFF
USER USER sinto USER vida mediocre vazio pena educar USER prova q importar comentário responder en ofensa ehr procurar ajuda profissional educar ler viajar aprender coisa dia USER aprender amar cuidar garotinho,OFF
clima merdar ficar monark dizer,OFF
USER USER gente noção escrúpulo gente adorar meter vida vergonha de esse pessoa fã Carla,OFF
cê achar q trouxa olhar p cara,NOT
pov pensar q ter dar pessoa errar voltar flr cm começar flr Bosta KKKKKKK Vsfd,OFF
Bolsonarismo mau petismo,OFF
constituição ter rasgadamatar filhomata mãe pai regaliasfala serioo justiça brasileiro vergonha,OFF
engano parecir realidade reconhecer comercial astuto colocar abraço inocente kkkk parecer normal dicionário casal constituir macho fêmea lógico anuncio ai preconceituoso normal pessoa escolher homossexual existir prova científico mostrar indivíduo nasça gay mostrar gay feliz complexo trauma lar complicar Parem alterar original mundo porcaria imaginar família totalmente disfuncional,OFF
faltar professor trazer estudo Holodomor USER mesmo merda NaziFacismo,OFF
USER imbecilidade criatura limite,OFF
vejor comentário medíocr bravateiro,OFF
USER vc roupa complexo vc sapatão falar vc metido prestar,OFF
USER roubar caruda USER vagabundo pra defender presidente fraco merda deixar acontecer pra eu tds USER estar preso morto,OFF
mulher pensadoesse mendigo bonito personal trainingvai passar peia,OFF
Assistam USER USER outro filmão tratar tema USER Monark burro,OFF
USER ir campeã burrar kkkkfiquei triste sair USER USER ter chance agredir USER amar USER maravilhoso pra eu manoor,OFF
USER USER exército,NOT
discurso lir senador kátia abreu parabéns hipocrisia,NOT
USER nao vida peido capettaaakkkkkkkkk,OFF
foda to triste acordar menstruar ta chover frio pra caralho so pq hoje festa URL,OFF
eleitor Bozoasno comentário defecar boca kkk USER AMO,OFF
qm bunda mole q quotar c Priv nao coragem mostrar cara ein ein URL,OFF
Ei USER USER USER Site USER USER USER USER USER USER USER USER Curtirem Porrada USER USER USER USER USER USER USER USER USER USER banheiro USER USER USER USER USER USER USER USER Celular USER 80359941,NOT
burro auge cancelamento Internet falar muito besteira custar caro dever parar exagerar droga álcool escutar bom assessoria defender nazismo pra justificar vista inaceitável,OFF
Avee puta ranço mdsss,OFF
USER mandar esfaquear Bolsonaro kkkkkkkkkkkk,NOT
USER filho de ele corrupto,OFF
Estressei ir pra puta parir,OFF
sensação horrível puta merda,OFF
q odio mlk tomar q fodar mt arrombado desgraçar,OFF
USER USER USER BURRAeu USER to flaUSERdo video felipeUSEReto to flaUSERdo PUTA COMENTARIO USER USER flar mau alguem primero apreUSERde ler USER USER pq USER USER pra freUSERte,OFF
USER comercial,NOT
HASHTAG cara pau imoral canalha defensor bandido,OFF
maçonaria satanico boneco fantoche kkkkkk vcs enganar ninguém ventríloquos bode derrotar kkkkkk otario fdps,OFF
volta aula foder maneiro,OFF
deslike vídeo fácil comprar USER fácil boicotar Apple USER USER USERUSER USER USER USER Google youtube vcs comentar Google tar Microsoft USER USER vario empresa apoiar casamento gay crentalha destilar veneno USER USER kkk Parabéns USER 3,OFF
clima bosta ficar,OFF
USER USER USER USER USER ée IdiotaaBicha USER USER,OFF
Olhem vlog akii USER foda watchvVSyKjojMQuU ehr video pq ehr vlog,OFF
USER USER MACHANDISE QUIXOS BURRA,OFF
USER USER Almenos iniciar nazismo Alemanha exatamente USER defender der direito expressar disseminar ideia idiota de eles ganhar USER USER força calar voz oUSER USER ta sofrer comparar ir sofrer caso merda ser pra frente bêbado pUSER USER sóbrio continuar arrepender MERDA USER USER falar agradecer cancelamento pUSER USER poder presor,OFF
6186361862618596185861857618566185561861aprenda sair matrixganhe dinheiro razoáveladquiro algum propriedade afastadagaste certo pesquisar estudandosequestre depósito porra bom genesestuprea quebrartenha filhosavalie piranha fielse descartear criar filho sozinho amamentálos,OFF
USER bom fracassar miseravelmente,OFF
cara ter juízo sair candidato deputado torcer Bolsonaro ganhar USER ter misericórdia de ele USER,OFF
USER dividir dinheiro publico matador aluguel atravez Rachadinha,NOT
detalhista né ar esfumaçar bom kkkkkk USER imaginar perfume de esse transar loucamente carro fechar,NOT
USER complementar ficar claro ridículo mentir criar briguinha ser fã Camila C,OFF
USER gostar crepusculo ter 10 ano USER 13 achar q imbecil mundo,OFF
morrer muito gente muito gente morrer morrer pensar bolsominiuns,OFF
sentido slender man retardado pro floresta noite procurar droga pagina diario retardado fico colocar floresta USER,OFF
USER USER USER USER USER CRIAR IDIOTAS,OFF
Imoraiscovardesvcs contramão Deusindo crioude Deus zombaDeus USER fogo consumidornão brinquar Deus nãoquer gay ser casaninguém haver escolhasagora criança falar saberexiste tudodeixa criança crescer descobrir mesmasvcs apologia homossexualidade gay Imoralcrime,OFF
USER cara doente arreper voto,OFF
Toma vergonha rosto procurar,OFF
plobema USER falar muito merda,OFF
manifestação recado corrupção nocivo covid19 morar traidor decepção morar covarde USER errar cúmplice depoimento pra amigo delegar falsamente amparar ministro fdp careca acompanhar 4 advogado bandido famoso clima festivo pizza tocar globo Escolheram errar pata enganat população USER,OFF
bando SAFADOS USER USER DINHEIRO USER USER MUQUIRANAS OLHA USER AVISAR HORA USER USER USER USER FAÇAM USER QUERUSER QUUSER USER QUERUSER USUSER USER RESPEITO USER USER USER USER,OFF
USER estudar mano pqp quanto besteira falar merda,OFF
Bunitao durmir jojo sair cozinha escrar cozinha,NOT
SURRA MILHÕES LARA ser deixar bostinha chão HASHTAG,OFF
USER USER d cama kkkkkkkkkkkkkkkkkkkkkkkkkkkkk,OFF
kkkkkkkkkkkkk eh p foder velho fdp URL,OFF
ladrão fdp,OFF
USER ver filme kkk AUSERho USER USER USER apaixonar vampirinho gay,OFF
USER Militar acusar Haddad kit gay condenar 12 ano distribuir pornografia infantil URL,NOT
merda viar,OFF
USER bichona URL,OFF
USER filho kkkk,NOT
ir aceitar falar comigo ir briga feio,NOT
USER BOLSONARO TOMAR CU URL,OFF
USER Ué gol recente retardado,OFF
USER USER surpresa eleger inútil único fazer 30 ano vida público colocar família parasita política elogiar torturador miliciano claro esquecer crime PT Brasileiro pastar,OFF
ENVENENAR palavra veneno USER mostrar respeito criança vc dever procurar tbm,NOT
USER nojento pessoa preconceituoso,NOT
Facada ter levar tiro,OFF
imprensa sujo,OFF
Merda comercial homofóbico existir naturalidade criatura vivente Querer ensinar criança destratar ninguém querer ensinar normal natural homem casar homem mulher mulher inaceitável família filho expor criança crescer tomar decisão ser errar aprender natural plantar semente venenoso mente de ela,OFF
rt USER USER USER perguntar idiota claro q estar Morodeltan lavajato sr q,OFF
cristão pessoa amorma pessoa sexo amar julgar impura pecaminosasvocês hipócrita nojento,OFF
filho dia tar mana gay usar bala upa descartar lixo direito usar seringa usar pra injetar droga felizmente cidadã ignorar vagabundo URL,OFF
achar cara mala achar ser noção USER merecer continuar sucesso ai vcs Flow,OFF
ir falar verdade nao gostar crepusculo nao q achar filme merda la vampiro moderno q USER lobiUSERmem isUSER nao USER estragar cultura tambem estragar futuro criança USERnhar dracular vizinho ano achar q brilhar Alem crepusculo 1 milhao semana alem americano propaganda ir concoradar q robert patinUSERn USER USER muçher escolher,OFF
USER USER USER USER USER USER USER USER USER USER USER USER USER USER USER USER USER USER USER USER USER USER USER USER USER esperar q vc dormir rola grosso rabo,OFF
USER governo Evangelicos governo Corruptos governo Criminosos governo Irresponsaveis governo Bandidos governo psicopata,OFF
USER vc trouxa,OFF
USER Véi cara ficar feliz levantar pra foto Linna cara insuportável babaca Arthur sair d,OFF
HAHAHAH mau explicar teoria vampiro lobisomem huahauhauhauhau USER PROBLEMINHA Filmes adolescente perequita começar coçar,OFF
cara louco descrição fiquei enjoar coitado de esse cara descrição nojentar,OFF
USER USER ir perder mentira demagógico barato,OFF
ir mandar pra pqp KKKKKKKKKKKKK USER ir aplaudir,OFF
USER USER monstro atrever falar palavra Deus Escroto genocidar,OFF
USER USER esgoto lixo beneficiar publicidade governo federal USER canalha,OFF
dia sociedade medíocre viver perder origenssua Fé infelizmente q ser aceitar sociedade preferir juntar compartilhar q Deusonde valoresComo ser futuro filhosVC achar normal homosexualismo ser dar continuidade origem claro q refirar prática deixar Deus homem mulher USER em isso,OFF
HASHTAG nao refugiado oriente médio pra k cara nao sao burro,OFF
USER USER slk maluco dizer ter falar merda pedir desculpa maconheiro falar merda reencarnação Hitler totalmente desnecessário caguar andar USER ficar nazista nazista causa mudar literalmente sociedade alarde Caguei andar assistar deriva,OFF
USER mau edição,OFF
USER merda respeito,OFF
USER comercial super ofensivo homem exalar amor publicamente dever crime olho ate doer assistir cena sentir verdadeiramente ofender ousadia insistencia quebra familia tradicional horrer vergonha dizer ofensa péssima influencia jovem navegar Internet acabar cair video provavelmente irao virar gay USER pensar jeitinho brasileiro sinceramente dizer sentido brasileiro tao burro preconceituoso imbecil Caralho porrar imundo nao aceitar diferença direito opiniao rejeitar considerar adverso erro poder cometer cara Injusto vejor injustiço começar presidenta continuar,OFF
USER filho kkkkk idiota finger kkkkk,OFF
nojo de esse imundície esperar ser boicotar,OFF
USER comprar USER devolver acesso conta Alguém entrar alterar email conseguir entrar atendimento telefônico lixo segurança idem Trabalho esperar Aguardo,OFF
To achar feio gordo ficor feliz crush chamar pra sair semana,OFF
USER USER tomar cu,OFF
USER Ladrão desgraçado hipócrita inferno pras rua bandido,OFF
dar mó treta epoca,NOT
atiçar pra caralho transar lema,OFF
USER tradicional brasileira USER,NOT
USER muito cara pau,NOT
vergonha,NOT
USER Crlh foda jogar igualzinho pai,OFF
USER colocar mau Brasil pobre vc pare mimimi,OFF
repórter organização podre Globo Foice SPUSERPiauí bosta encarar reporterzinho ficar ai máscara Criem vergonha passar traidor rolo compressor recado dado Entendam quiser principalmente senhor STF USER respeitar constituição encarar rua,OFF
USER ir ler constituição cara incrível pedir pra fechar STF cúmulo burrice realmente funcionar democracia,OFF
Tida mulher real Ser gordo magro alto baixo pretabranca feio bonito mulher real mulher real,NOT
pra depor ficar silencio putaria,OFF
ai tomar cu juiz safado porra,OFF
filho de ele merda discurso mídia comprar choro nhonho,OFF
vergonha propaganda podre hambúrguer podre,OFF
USER USER USER BUSCAR LUZ,NOT
31 segundo 2 mulher 2 homem abraçar ser mencionar namorado USER TA FAZENDO ALARDE USER mundo tomar c af,OFF
maconha tar acabar neurônio cara falar merda,OFF
USER USER USER USER fato reparar comportamento torcida racional organizar expressar melhor comadr gente emotivo educação analfabeto Jade adolescente burrinho reparar,OFF
USER meme agonia caralho,OFF
cara conseguir cara pau USER primeiro 30 segundo,OFF
USER entender burro,OFF
USER ver pessoa tirar vida pessoa 10 ano ta passear rua vergonha Brasil USER USER JUSTIÇA USER 50 ano fechar USER,OFF
Cliche winx cgi ruim pior arma sao lgl anime personagem chato historia merda n achar nd mt Memoravel alem arma especificamente foice espada mina ruivo estranho,OFF
USER USER ficar campanha pra negativar video promover boicote empresa homofobia gay ser gay,NOT
problema abraço homem mulher abraço amiga abraçar gente preconceituoso problema gay USER USER humano sentimento vzs legal pessoa USER ACHO ISUSER USER USER USER EDUCAÇÃO lavar louça invés vim criticar,NOT
Deixar assistir programa achar Monark maconheiro direito liberdade inerente humano ser falar merda,OFF
USER JOGANDO NAÇÃO USER USER BOBO OTÁRIOS USER USER PAÍS PÔS USER USER USER LÁPOR USER SABEMKKKKĶK,OFF
USER QI pra debater entrevistado ruim falar muito merda,OFF
USER corintiano mano Apaga passar vergonha or KKKKKKKKKKKKKKKKKKKK,OFF
merda dar vida q tô sentir cu mané,OFF
USER burrinho,OFF
USER USER USER fanto laranja meio boca p caralho,OFF
USER USER desculpa Macaco saber cê analfabeto,OFF
USER USER DIAS GAYZAO,OFF
ter ver falar surto sexo Brasil,NOT
Perdeu cliente USER Usam criança pra força ideológico,OFF
Wrecking ball pra comer cu palhaço hein URL,OFF
USER burguerking querer ganhar fama lgbt USER nao po USER,NOT
USER haver nenhum ler faça sentir lêr bosta livro quiser dizer pensar concordar assistir vídeo leia Crepúsculo paz oO,OFF
Cara revoltante vergonha lei país,NOT
USER gostariamqualquer pilantra serveaté canalha Putin manipulávelvir Bidenqualquer merda surpreender,OFF
dizer gente colher gente planto tá guardar filho puta,OFF
USER bafomet vergonhoso,NOT
USER achar reportagem interessante ficar postar porcaria rezar,OFF
USER retrato elite nazista socialista eugenista progressista iluminar extremo esquerda radical URL,OFF
USER Mulher virar traveco,OFF
USER cadêr porra chave casa to doido pra mijar URL,OFF
rt USER USER USER pqp fiz ontemm mãe virar super saiyajin,OFF
USER Gordola espécie humano medonho mundo,OFF
caralho mano q sonho cabuloso q lkkkkkl seloco,OFF
USER viver haver século pobreza ignorância novidade Acham cortar verba educação pra saber investir educação resultar perda voto ser exatamente pobre humilhável ignorante,NOT
USER Central putinho pq cara falar técnico superestimar hauhauhuahua,OFF
USER debochado,OFF
4000 retardado,OFF
USER USER USER USER USER indicar Arthur tokinho leitar cu prolapsar,OFF
postar ter porra 3 ANOS,OFF
quase quebrar casa pra matar bicho estranho q entrar cozinha kkkkkkk,NOT
lixo bk,OFF
Scooby PA leonino fazer besteira liderança pra lina canceriano inferno astral de ele merda fazer ter visão signo ir rolar colocar de ele,NOT
achar Jojo irritante pensar gritar sera q surdo mulherzinha chato aff Alguém falar pra fulana educação pq grito Adiantace algum porco morrer,OFF
USER Aham noel existir neh velho LADRÃO FDP,OFF
pra eu n existir nenhum desaforo vida pior q alergia absorvente caralho preciso merda quase morro tomar cu,OFF
USER CHINA USER nazista problema hj governar carrada sociopata presidência senador deputado estadual federal aproveitar situação pra deixar sociedade doente tar culpa sociedade permitir aprender político tar pra servir servir político,NOT
USER USER USER Bandido msm jto opinião político q definir cara bandido vagabundo vergonha ae 500 kkkkkkk,OFF
Absurdo erro pq video editar compactuo nazista facista racista supremacista branco USER DEIXANDO ASSINAR TOTALMENTE USER USER USER USER ACABAR USER USER USER USER CHEGA,NOT
NAO USER USER USER USER USER,NOT
PorracaralhoEsse cara sábio,OFF
heróiparabéns eleo capeto voltar inferno,OFF
serio vcs dar premio pra menina voz insuportavel,OFF
USER USER Pilantras quinto inferno vcs merecer HASHTAG,OFF
gente louco,NOT
USER USER USER incrível USER ver comentário pensar pq religioso alienar nojento,OFF
USER USER Ri ablr livro pra menina falar falar exatamente querer falar saber Show USER,NOT
cara matar filha sair dia pai USER USER USER kkk,NOT
USER tar chapado vc ver liberdade expressão limite tar fazer,OFF
USER Aaaa ficado avisar merda,OFF
comer arroz feijão fdp fresco caralho,OFF
cara tenque lavar lingua,NOT
USER desgraça msm,OFF
ah USER USER USER USER biblia USER USER USER USER usar perfume família tradicional cú rolar amor possuir gênero raça obedecer padrão,OFF
USER USER USER Resumido mulher escroto marido mendigo escroto mulher marido escroto mendigo santo história 3 escroto vítimas filho infelizmente povão adorar,OFF
mt otário vsf,OFF
achar colocar macara i pra rua mostrar pra tirano ta bola ficar sentar reclamar adiantar cabeça doente de ele achar USER ta mostrar pra representar,OFF
país atrasado prova manifestação homofóbico discurso preconceituoso mundo inteiro mover sentido entender ninguém direito julgar outro amar Brasil continuar burro preguiçoso cheio moralidade torpe,OFF
USER falhar asa Monark inúmero cagada USER USER defender cortar raiz sabichão Monark colocar risco trabalho suster várias família depender podcast pena cheirar cueca Monark,OFF
continuar cheguei seguinte USER achar alguem ir falar USERdo pra nao pessoa nao ir chegar falar ei ei USER saber crepusculo la eduard fodao etc claro nao USER outro video de ele so micareta começo USER USERdose USER micareta respirar fundo USER pegar aids saber mesmo assuntoniguem falar pra assismsabiar vç micareta respirar USERPegaAid,OFF
USER sair USER falar de ela USER esperar encontrar rede nacional kkkkk USER tar dar mole arrumar treta Atoa roça sair causa pena gostar de ela,NOT
ai cara primo mostrar voce gostar MysteryGuitarMan ta curter cara gostar voce continuar bater emprensa colocar legal pessoa enchergam voce emprensa dominar dai foda ficar revoltado pá continuar gostar voce le abração car,OFF
nojo Toddynho ridículo humano horrível,OFF
USER gay problemaproblema querer obrigar agenda gay hetero,NOT
sucesso mundo ganhar milhão merda USER,OFF
monstro criminoso matar sangue frio inocente Isabella largo fogo inferno esperar vcs ninguém escapar justiça USER monstro ter dia livre dia pai pai mae matar criança terao USER vida,NOT
USER vc sapatao fan suju,OFF
USER vírus taí imbecilidade aglomeração etc,OFF
JAJAJAJAJAJAJAAJAJAJAJAJAJAJAJAJAJAJA MAMANDO URL,OFF
Velho escrotar URL,OFF
deus ódio Internet merda vagabundo pilantra,OFF
USER Meninhos q querer menininha USER,OFF
de esse índir índia verdade rosto japonesa feio pra caralho teta murcho quadril geladeirasão coisa horrível,OFF
vídeo USERue ver USERaí puxar sacoaliás USER gostar puxar ninguém assisti confessar USERue concordei todosUSER POLÍTICOSAliásnão concordar dar ótimo gargalhada jeito falar verdade tarja misturar humor cara USERUSER acessório USER diferençaTe admiror Parabéns trabalho Ah vc Gatocara Vlw,NOT
Desculpe USER xará nazismo vencer eleição democraticamente dizer ir matar gente USER discurso assinar acordo USER eleitor ideia entender USER querer nazismo vencer eleição convencer matar gente legal mentira USER poder outro podcast convidar abordar história nazismo direito,NOT
Kkkk gurio noçãoUSER ficar famoso palhaçar ah guria c internar lokanem famosagente seguro loka PERIGO p sociedadenão ta respeitoa Lei q tomar ATITUDEenquanto passar fome tristezar USER USER,OFF
USER Jojo imaginar souber compadre de ela morrer ruim agente perder alguém maneira violentá,NOT
barulho gente preconceituoso burro USER quanta gente imbecil mundo,OFF
USER INFORMA mau caratismo tamanho administrar página vergonha cara,OFF
USER USER USER USER USER Vá pra puta parir Messi merecer bola ouro 2018 Messi jogador bom Salah Ronaldo poder vencer bola ouro seguir lógico Messi merecer bola ouro 2018,OFF
USER PUTARIA,OFF
nome dar entrada hospital precisar respirador infelizmente ficar chupar dedo,OFF
apoiarma máscara manifesto livrar maldito vírus mortal vir China,OFF
USER querer depender USEReiro iiiii achar dar ruimUSER país Covardesnegócio carnaval futebol muito bebida prostituiçãoUSER ACABOU,OFF
USER muchar hora sacosó corpinhoooo,OFF
muito pessoa aceitar mulher fetiche esquisito Mulhero corno satisfaz mulher cara situação rua inocente,OFF
passar verdade nenhumparece ensaiar chegar beirar ridículo reportagem Mtos detalhe tar obviil tar mentir falar comeu pq pedir pronto precisar falação,OFF
regra Brasil hoje USER CASA merda USER doença matar milhar,OFF
falar moral moral pra falar merda,OFF
USER USER hoje caraio puta parir tomar cu,OFF
USER merecer USER USER mau miserável Doria ir moro,OFF
macho bicho escrotar ver mulher,OFF
estética amiga estético retardar,OFF
mulher completamente descontrolar exigir monte coisa nao pequeno educação,OFF
rabo uu,OFF
comparar assassinato dever preso negligência trânsito matar pedestre Bruno matar prender diferente calmo mane ninguém moral pra falar ninguém URL,NOT
USER USER USER gostar de ele culhao contratar segurar onda foder opinião ser SP zona político diretor outro outro ai rolar ciumeiro foder Ficar impressão ano Landim chamar galera dizer mar,OFF
pro bglho Breno disposto ficar voltar dor desgraçar kkkk odio,OFF
soltar vídeo cantar tô famoso tomar cu pai URL,OFF
fila caixa cheio gente recomendação profissional saúde manifestante apoiador Bolsonaro aglomeração Eita globo lixo,OFF
Tô fase vida tacar fodase pra falar falar N tomar cu pra ficar pagar pau p ninguém 10 pessoa 2 gostar eu tô tô ai,OFF
vini foder,OFF
USER USER Entregaram Cruzeiro né velho fdp q ser verdade clube entregar pq vc quadrilha quebrar deixar situação,OFF
vc ensinar filho respeitar opinião vc incentivar gay pra pqp,OFF
mina egocêntrico achar certo,OFF
cara USER conseguir entender errado deus,OFF
USER afinal parasita devolver dinheiro receber injustamente absurdo coordenação pagamento auxílio emergencial rico receber ficar moita devolver descobertar,OFF
Empresa lixo ação ir cair absurdamente ver criança pra falar LGBT USER brincar curtir infância assunto caber Marca nojentar,OFF
Deus USER Deus religião criar humano pastor pra eu USER pastor Arnaldo assistir vídeo de ele USER sexualidade caráter ninguUSERm gay má pessoa conhecer USER gente honesto ficar porra preconceito igreja casa deixar viver vida algum homossexual prejudicar,OFF
Deixar criança criança aff,NOT
q sexo vida mulher,OFF
USER parada seguinte nao descordar USER falar realmente USER razao fan serie nao achar certo USER generalizar coisa ridicularizar pessoa USER opniao USER exagerar serio USER machista idiota USER direito falar USER pensar pensar melhor falar ok,OFF
argumento cara ridículo falar,OFF
dia gostar respeito religião Bando cínico aproveitador URL,OFF
USER Jojo tar queimar desnecessário showzinho de ela USER levantar gritar igual louca perder jogo tô pegar ranço,OFF
USERuar pessoa conseguir sucesso criticar sucesso Auhsuahs parabéns criatividade USER SENTIDO fikar falar USER USER USER gostar muito gente gostar neeh USER virgem mãe achar principe encatado Odeio Justin USER Adoro Crepusculo prova controversia teoria,NOT
achar incrível consideração pessoa doar pessoa enfiar consideração cu,OFF
USER chegar mandar kk,NOT
63388dei gabarito áudio de ela confirmar dizer apesar de ela explicitar sentir conversar entender paranóico implicante beta desesperar migalha buceta,OFF
ARROMBADA NMRL COBRA SEMANA,OFF
doido cara tar aproveitar fama sinceramente olhar sinto nojo,OFF
rt USER mano alguém ligar noite 47 atendi manhã falar to ficar puta desespero,OFF
Colocamos pessoa Intelectual Jumento pra debater saber,OFF
vontade tacar fodase ta,OFF
cigarro álcool acabar saúde 2 cancerígeno,NOT
APRENDAM USER HANG HIPÓCRITAS CPI,OFF
tô fechado Gordola deixar revoltar bixo URL,OFF
educação históriar USER vagabundo safar,OFF
dor cabeça krl porra q n descer,OFF
arrependimento matar tar morta enterrar podre terra,NOT
